product_description,product_price
"DenTek Triple Clean Floss Picks, No Break Guarantee, 150 Count",3
"Howard Products FW0016 Feed-N-Wax Wood Polish and Conditioner, Beeswax &, 16 oz, orange, 16 Fl Oz",8
Electric Toothbrush Clean as Dentist Rechargeable Sonic Toothbrush with Smart Timer 4 Hours Charge Minimum 30 Days Use 5 Optional Modes Whitening Toothbrushes for Adults with 3 Brush Heads Black,29
"Evriholder Sw-250I-Amz-6, Furemover Pet Hair Removal Broom with Squeegee & Telescoping Handle That Extends from 3-5', Black & Yellow",13
"Premium MCT Oil derived only from Non-GMO Coconuts - 32oz BPA Free Bottle | Great in Keto Coffee,Tea, Smoothies & Salad Dressings | Non-GMO Project Verified & Vegan Certified (Unflavored)",27
"Lansinoh Stay Dry Disposable Nursing Pads, 200 Count (2 Packs of 100), Superior Absorbency, Ultra Soft Leak Protection for Breastfeeding, Non-Toxic Milk Pads, Nursing Essentials",18
OXO Good Grips All-Purpose Squeegee,6
"HAIRFLUENCE - Hair Growth Formula For Longer, Stronger, Healthier Hair - Scientifically Formulated with Biotin, Keratin, Bamboo & More! - For All Hair Types - Veggie Capsules",21
Fitbit Charge 3 Fitness Activity Tracker,139
"Playtex Sport Tampons with Flex-Fit Technology, Regular & Super Multi Pack, Unscented - 50Count",8
"Diapers Size 2, 124 Count - Pampers Swaddlers Disposable Baby Diapers, Giant Pack",27
Hydrating Argan Oil Hair Mask and Deep Conditioner By Arvazallia for Dry or Damaged Hair - 8.45 Oz,12
"Gillette Fusion5 ProGlide Men's Razor Blades, 8 Blade Refills (Packaging May Vary)",24
"Dove Beauty Bar Sensitive Skin 4 Ounce, 16 bars (2 x 8 bars)",12
"Kleenex Trusted Care Facial Tissues, 8 On-The-Go Travel Packs, 10 Tissues per Pack (80 Tissues Total)",2
"ANGEL SOFT Toilet Paper Bath Tissue, 60 Double Rolls, 260+ 2-Ply Sheets Per Roll",27
"Gillette Mach3 Men's Razor Blades, 15 Blade Refills",21
"Remington PG6025 All-in-1 Lithium Powered Grooming Kit, Beard Trimmer (8 Pieces)",20
"Honest Calming Lavender Hypoallergenic Bubble Bath with Naturally Derived Botanicals, Dreamy Lavender",9
YIHONG Set of 8 Reusable Stainless Steel Metal Straws- Ultra Long 10.5 Inch- Regular Size 6 mm Wide - 30oz Tumblers Compatible - 4 Straight+ 4 Bent+ 2 Brushes+ 1 Pouch,175
"Downy Ultra April Fresh Liquid Fabric Conditioner Smart Pouch, Fabric Softener - 48 Oz. Pouches, 3 Pack",5
"PURA D'OR Moroccan Argan Oil (4oz) Usda Certified Organic 100% Pure Cold Pressed Virgin Premium Grade Moisturizer Treatment for Dry & Damaged Skin, Face, Scalp, hair, Body & Nails (Packaging May Vary)",13
"Clorox ToiletWand Disinfecting Refills, Disposable Wand Heads - 30 Count",12
Gillette Venus Extra Smooth Women's Razor Blade (Venus Embrace) - 4 Refills ( Pack May Vary ),11
"It's a 10 Haircare Miracle Leave-In product, 10 fl. oz.",23
"Hyaluronic Acid Serum for Skin- 100% Organic HA- Anti Aging Serum for Face and Neck-Hydrating Facial Serum for Fine Lines, Wrinkle, Dry Skin, Leave Skin Full, Plump, Soft, Smooth (1FL Oz)",9
"Vitamin C Serum for Face and Neck- Natural Anti-Wrinkle Anti-Aging Facial Serum with Hyaluronic Acid, Vitamin E -Antioxidant Serum for Fine Lines, Age Spots, Sun Damage, Dark Circle, 1 fl.oz (30ML)",9
"SYLVANIA 74765 A19 Efficient 8.5W Soft White 2700K 60W Equivalent A29 LED Light Bulb (24 Pack), 24 Count",23
"Sea-Band Wristband, Adult, Colors May Vary, 1 Pair, Anti-Nausea Acupressure Motion or Morning Sickness, 2 Count (Pack of 1)",7
"HUGGIES Simply Clean Fragrance-free Baby Wipes, Soft Pack (9-Pack, 576 Sheets Total), Alcohol-free, Hypoallergenic (Packaging May Vary)",12
"Centrum Silver Men (200 Count) Multivitamin / Multimineral Supplement Tablet, Vitamin D3, Age 50+",13
"Philips Norelco Multigroom All-In-One Series 3000, 13 attachment trimmer, MG3750",19
"L'il Critters Gummy Vites Complete Kids Gummy Vitamins, 190 Count",9
"Vitamin K2 + D3 with Organic Coconut Oil for Better Absorption | 2-in-1 Support for Your Heart, Bones & Teeth | Vegan Certified, GMO & Gluten Free (60 Veggie Softgels)",19
"Jivi Conditioner With Argan Oil (Lavender) | Makes Hair Softer, Shinier, and More Manageable | 100% Natural with Organic Ingredients | Made for All Hair Types, Color Safe | 14 fl. oz.",13
Beauty America Tea Tree Facial Cleansing Wash - with Jojoba Beads - 2 pack,9
"KIND Bars, Peanut Butter Dark Chocolate, Gluten Free, 12 Count",13
"Vitafusion Vitamin D3 Gummy Vitamins, Assorted Flavors",9
Honest Amish Beard Balm Leave-in Conditioner - Made with only Natural and Organic Ingredients - 2 Ounce Tin,164
"Sparkle Paper Towels, 18 Pick-A-Size Plus Rolls = 37 Regular Rolls, Longer Lasting Rolls, White, 115 Sheets Per Roll",11
"Weleda Skin Food, 2.5 Ounce",28
"Vitafusion Extra Strength Vitamin B12 Gummies, 90 Count (Packaging May Vary)",11
"American Crew Fiber, 3 Oz",9
Glucosamine Chondroitin Turmeric MSM Boswellia - Joint Support Supplement for Relief 180 Tablets - Arazo Nutrition,10
"Medline Heavy Absorbency Underpads, 36"" x 36"" Quilted Fluff and Polymer Disposable Underpad, 50 Per Case, Great Protection as Bed Pads and Pee Pads",19
"MuscleTech Platinum Creatine Monohydrate Powder, 100% Pure Micronized Creatine Powder, 14.1oz (80 Servings)",35
"Bona® Hardwood Floor Cleaner Refill, 128 Fl Oz (Pack of 1)",10
"Windex Ammonia-Free Glass Cleaner Trigger Bottle, Crystal Rain, 23 Fl Oz",17
"Puffs Plus Lotion Facial Tissues, 8 Family Boxes, 120 Tissues per Box",14
"Larabar Gluten Free Bar, Peanut Butter Chocolate Chip, 1.6 oz Bars (16 Count)",15
"Braun Pulsonic Series 7 70S Foil and Cutter Replacement Head, Compatible with Models 790cc, 7865cc, 7899cc, 7898cc, 7893s, 760cc, 797cc, 789cc",15
Click to see price,18
Vitamin D3 (5000iu/125mcg) Enhanced with Coconut Oil for Better Absorption ~ Non-GMO & Gluten Free (360 Mini Liquid Softgels),13
"Scotch-Brite Lint Roller, 5 Rollers, Picks up Lint, Pet Fur, Fuzz, and Hair",16
Nature Made Vitamin D3 5000 IU Ultra Strength Softgels Value Size 180 Ct,5
"Easy@Home 50 Ovulation Test Strips and 20 Pregnancy Test Strips Combo Kit, (50 LH + 20 HCG)",11
"Weiman Stainless Steel Cleaner and Polish - Streak-Free Shine for Refrigerators, Dishwasher, Sinks, Range Hoods and BBQ grills - 22 fl. oz.",177
"Vitafusion Extra Strength Melatonin BlackBerry, 5mg",12
Dr. Scholl's HEAVY DUTY SUPPORT Pain Relief Orthotics // Designed for Men over 200lbs with Technology to Distribute Weight and Absorb Shock with Every Step (for Men's 8-14),12
"Duracell - CopperTop AA Alkaline Batteries - long lasting, all-purpose Double A battery for household and business - 16 count",21
"Huggies Snug & Dry Baby Diapers, Size 3 (fits 16-28 lb.), 210 Count, ONE MONTH SUPPLY (Packaging May Vary)",36
"Nature's Bounty Biotin Supplement, Supports Healthy Hair, Skin, and Nails, 10000mcg, 120 Softgels",9
"The ConfiDental - Pack of 5 Moldable Mouth Guard for Teeth Grinding Clenching Bruxism, Sport Athletic, Whitening Tray, Including 3 Regular and 2 Heavy Duty Guard (3 (lll) Regular 2 (II) Heavy Duty)",21
"Pure Love 7.5 Inch Textured Silicone Dildo with Suction Cup, Beige Colored Penis, Adult Sex Toy",18
"Lysol Laundry Sanitizer Additive, Crisp Linen, 2X90oz",19
"Tide PODS 3 in 1 HE Turbo Laundry Detergent Pacs, Original Scent, 81 Count Tub, Packaging May Vary",19
"Crest Toothpaste Gum Detoxify Deep Clean, 4.1oz (Pack of 3)",10
"Align Probiotics Supplement for Digestive Health in Adult Men and Women, 63 Probiotic Capsules - Bifidobacterium 35624",41
"Hello Oral Care Kids Fluoride Free and SLS Free Toothpaste, Natural Watermelon, 4.2 Ounce",3
"Revlon 1875W Compact & Lightweight Hair Dryer, Black",9
"Diapers Size 5, 128 Count - Pampers Cruisers Disposable Baby Diapers, ONE MONTH SUPPLY",49
"Dixie Everyday Paper Plates, 8 1/2"", 480 Count, 10 Packs of 48 Plates, Lunch or Light Dinner Size Printed Disposable Plates",25
MainBasics Bath Shower Loofah Sponge Pouf Body Scrubber Exfoliator (Set of 3),6
"UNNI ASTM D6400 100% Compostable Trash Bags, 2.6 Gallon, 9.84 Liter, 100 Count, Extra Thick 0.71 Mils, Food Scrap Small Kitchen Trash Bags, US BPI and Europe OK Compost Home Certified, San Francisco",11
"Mederma Advanced Scar Gel - 1x Daily: Use less, save more - Reduces the Appearance of Old & New Scars - #1 Doctor & Pharmacist Recommended Brand for Scars - 0.7 ounce",16
Vitamin C Serum for Face - Anti Aging Facial Serum,10
"Crest 3D White Whitening Toothpaste, Radiant Mint, 3.5oz, Twin Pack",5
Bed Head Wave Artist Deep Waver for Beachy Waves Generation II,27
"Philips Norelco OneBlade Replacement Blade, 2 Count, QP220/80",24
"Munchkin Arm & Hammer Diaper Pail Snap, Seal and Toss Refill Bags, 20 Bags, Holds 600 Diapers",17
"Ashwagandha 1950mg Organic Ashwagandha Root Powder Extract of Black Pepper Anxiety Relief, Thyroid Support, Cortisol & Adrenal Support, Anti Anxiety & Adrenal Fatigue Supplements 90 Veggie Capsules",15
"Pure Love Flexible Vibrating Anal Beads with 7 Functions, Purple Color, Adult Sex Toy",31
"Gillette Fusion5 ProGlide Men’s Razor, Handle & 2 Blade Refills (Packaging May Vary)",9
"Pure Love New Squeeze-Control Dual Hug Vibrator, Rechargeable, and Waterproof Massage Wand, Memory Function, Adult Sex Toy, Teal Color",49
"Pure Love Rechargeable Vibrating Bullet Purple, Waterproof, Multispeed and Multifunction, Adult Sex Toy",20
"Babyganics Alcohol-Free Hand Sanitizing Wipes, Mandarin, On-The-Go, 20 count reseal pack (Pack of 4), Packaging May Vary",7
"Pure Love 9” Silicone Vibrating Wand and Personal Massager, Pink Color, Adult Sex Toy, Body Massager",16
"Pure Love Combo Pack with 2.25 Inch Vibrating Bullet and Premium Lubricant, Adult Sex Toy",18
"Pure Love 7 Inch Clear Rubber Dildo with Suction Cup, Lifelike Dong, Adult Sex Toy",22
"Pure Love G-Spot Silicone Rabbit Vibrator Pink, Rechargeable Clitoris Stimulator, Water-Resistant and Multi Function, Adult Sex Toy, Dual Stimulation",37
"Pure Love Vibrating Tongue Shaped Finger Sleeve, Waterproof and Multi Speed Bullet, Stimulator for Clitoral, Anal, Vaginal and Testicular Pleasure, Adult Sex Toy for Men, Women and Couples, Pink Color",18
Kleenex Hand Towels,17
"MIGHTY BLISS™ Large Electric Heating Pad for Back Pain and Cramps Relief -Extra Large [12""x24""] - Auto Shut Off - Heat Pad with Moist & Dry Heat Therapy Options - Hot Heated Pad",249
"Hefty Strong Multipurpose Large Black Garbage Bags - 30 Gallon, 56 Count",36
"Ziploc Sandwich Bags, XL, 3 Pack, 30 ct",12
"Vitamin C Serum Plus 2% Retinol, 3.5% Niacinamide, 5% Hyaluronic Acid, 2% Salicylic Acid, 10% MSM, 20% Vitamin C - Skin Clearing Serum - Anti-Aging Skin Repair, Supercharged Face Serum (1 oz)",8
"Vitamin C Serum Plus 2% Retinol, 3.5% Niacinamide, 5% Hyaluronic Acid, 2% Salicylic Acid, 10% MSM, 20% Vitamin C - Skin Clearing Serum - Anti-Aging Skin Repair, Supercharged Face Serum (1 oz)",14
"AsaVea Teeth Whitening Pen (2 Pack), 35% Carbamide Peroxide Gel, 20+ Uses, Effective, Painless, No Sensitivity, Travel-Friendly, Easy to Use, Beautiful White Smile, Natural Mint Flavor",19
"Crest 3D White Luxe Whitestrip Teeth Whitening Kit, Glamorous White, 14 Treatments, (Packaging May Vary)",34
"Fitbit Inspire HR Heart Rate & Fitness Tracker, One Size (S & L bands included), 1 Count",95
"Ddrops Baby 400 IU, Vitamin D, 90 Drops 2.5mL (0.08 Fl. Oz (Pack of 1))",14
Gillette Venus Tropical Disposable Women's Razors - Single Package of 3 Razors,6
"Pure Love 7.5 Inch Silicone Dildo with Suction Cup, Beige Color Dong, Adult Sex Toy",21
"Honest Bubble Bath, Sweet Orange Vanilla",9
"Tide PODS Plus Downy 4 in 1 HE Turbo Laundry Detergent Pacs, April Fresh Scent, 61 Count Tub - Packaging May Vary",174
"All Liquid Laundry Detergent, Free Clear for Sensitive Skin, 2X Concentrated, 110 Loads",19
"Cetaphil Baby Wash & Shampoo with Organic Calendula, 7.8 Oz",14
"AmazonBasics 1.45 Volt Hearing Aid Batteries - Pack of 60, Size 312",4
"Baebody Retinol Moisturizer Cream for Face and Eye Area - With Retinol, Jojoba Oil, Vitamin E. Fights the Appearance of Wrinkles, Fine Lines. Best Day and Night Cream 1.7 Fl. Oz",19
"Premier Protein 30g Protein Shake, Chocolate, 11.5 Fl Oz, Pack of 12",23
"Neutrogena Hydro Boost Hyaluronic Acid Hydrating Face Moisturizer Gel-Cream to Hydrate and Smooth Extra-Dry Skin, 1.7 Oz",16
Evening Primrose Oil (1300mg) 120 Liquid Softgels ~ Cold-Pressed with No fillers or Artificial Ingredients ~ Non-GMO & Gluten Free,16
"Anker Alkaline AA Batteries (24-Pack), Long-Lasting & Leak-Proof with PowerLock Technology, High Capacity Double A Batteries with Adaptive Power and Superior Safety",15
"Cliganic USDA Organic Jojoba Oil, 100% Pure (4oz Large) | Natural Cold Pressed Unrefined Hexane Free Oil for Hair & Face | Base Carrier Oil | Cliganic 90 Days Warranty",9
"Air Wick plug in Scented Oil 5 Refills, Hawaii, (5x0.67oz), Essential Oils, Air Freshener",7
"#LubeLife Water Based Personal Lubricant, 8 oz Sex Lube for Men, Women & Couples",7
"Castor Oil (2oz) USDA Certified Organic, 100% Pure, Cold Pressed, Hexane Free by Kate Blanc. Stimulate Growth for Eyelashes, Eyebrows, Hair. Lash Growth Serum. Brow Treatment. FREE Mascara Starter Kit",9
"alli Weight Loss Diet Pills, Orlistat 60 mg Capsules, 120 Count Refill Pack",52
"DampRid FG60FS Moisture Absorber, Fresh Scent, 10.5-Ounce, 2-Pack",4
"Bioré Most Trusted Blackhead Removing and Pore Unclogging Deep Cleansing Pore , 14 Count",7
"Hefty Ultra Strong Tall Kitchen Drawstring Trash Bags, Blackout, 40 Count",12
"Pacific Blue Select Multifold Premium 2-Ply Paper Towels by GP PRO (Georgia-Pacific), White, 21000, 125 Paper Towels Per Pack, 16 Packs Per Case",26
"Renew Life Women's Probiotic - Ultimate Flora Women's Care  Probiotic Supplement - Gluten, Dairy & Soy Free - 25 Billion CFU - 30 Count (Pack of 1)",14
"Lysol Laundry Sanitizer Additive, Crisp Linen, 90oz",10
"IDSON Muscle Roller Stick for Athletes- Body Massage Sticks Tools-Muscle Roller Massager for Relief Muscle Soreness,Cramping and Tightness,Help Legs and Back Recovery,Black Green",8
"Amazon Brand - Solimo Prenatal Vitamins & DHA, 90 Gummies, 45-Day Supply",26
Sweet Sweat 'Workout Enhancer' Gel - 6.4oz Sports Stick,9
"Cottonelle FreshCare Flushable Wipes for Adults, Alcohol Free, 252 Wet Wipes per Pack (Packaging May Vary)",16
"Hefty Strong Multipurpose Large Black Garbage Bags - 30 Gallon, 74 Count",8
"Nature's Bounty Magnesium 500 mg, 200 Tablets",36
"Crest 3D White Whitestrips Gentle Routine Teeth Whitening Kit, 14 Treatments",22
"Philips Norelco Electric Shaver 2100, S1560/81",39
"Premium MCT Coconut Oil Spray, Pure, Perfect for Keto and Paleo Diet | 16oz BPA Free Bottle | Non-GMO | Vegan Friendly | Great in Coffee, Tea, Smoothies & Salads",20
"Clorox Disinfecting Wipes plus Clorox Disinfecting Wipes with Micro-Scrubbers Value Pack (2 Pack of 75 Count, 1 Pack of 70 Count), Bleach Free Cleaning Wipes, 1 Set",14
Finishing Touch Flawless Women's Painless Hair Remover,17
BIOLAGE Colorlast Shampoo For Color-Treated Hair,18
Tribulus Terrestris Extract Powder - Testosterone Booster with Estrogen Blocker - 45% Steroidal Saponins 1500mg - Arazo Nutrition USA - 180 Capsules,19
SweatBlock Antiperspirant - Clinical Strength - Reduce Sweat up to 7-days per Use,19
"Jarrow Formulas Milk Thistle (Silymarin Marianum), Promotes Liver Health, 150 mg per Capsule, 200 Veggie Capsules",12
"KIND Bars, Caramel Almond & Sea Salt, Gluten Free, Low Sugar, 1.4oz, 12 Count",14
"Quantum Health Super Lysine+ / Advanced Formula Lysine+ Immune Support with Vitamin C, Echinacea, Licorice, Propolis, Odorless Garlic (180 Tablets)",11
"Mrs. Meyer´s Clean Day Dish Soap, Lavender, 16 fl oz, 3 ct",11
15 Pack Easy@Home Marijuana (THC) Single Panel Drug Tests Kit - #EDTH-114,10
"Turmeric Curcumin 95% Curcuminoids Highest Potency 1950mg with Bioperine Black Pepper for Best Absorption, Made in USA, Best Vegan Joint Pain Relief Turmeric Pills by Natures Nutrition - 60 Capsules",8
"SmartyPants Kids Formula & Fiber Daily Gummy Vitamins: Gluten Free, Multivitamin & Omega 3 Fish Oil (DHA/EPA), Fiber, Methyl B12, Vitamin D3, Vitamin B6, 120 Count (30 Day Supply) - Packaging May Vary",20
"Kleenex Expressions Ultra Soft Facial Tissues, 18 Cube Boxes, 65 Tissues per Box (1,170 Tissues Total)",28
CeraVe Foaming Facial Cleanser | 16 Fl. Oz | Daily Face Wash for Oily Skin | Fragrance Free,13
"Charmin Ultra Soft Cushiony Touch Toilet Paper, 18 Family Mega Rolls (Equal to 90 Regular Rolls)",26
"Colgate Optic White Whitening Toothpaste, Sparkling White - 5 ounce (3 Pack)",10
Crest Scope Outlast Mouthwash Long Lasting Peppermint,3
"Tide Free and Gentle HE Laundry Detergent Liquid, 100 oz, 64 Loads, Unscented and Hypoallergenic for Sensitive Skin, Free and Clear of Dyes and Perfumes (Packaging May Vary)",11
Bio-Oil 4.2oz: Multiuse Skincare Oil,18
"Updated 2019 Version Nose Hair Trimmer for Men & Women, AMAGARM Electric Nose and Ear Hair Trimmers/Clippers Removal, Wet/Dry, PX7 Waterproof , Mute Motor, Double-Edge Stainless Steel Blades",9
"Aveeno Positively Radiant Skin Brightening Exfoliating Daily Facial Scrub with Moisture-Rich Soy Extract, Jojoba & Castor Oils, Soap-Free, Hypoallergenic & Non-Comedogenic Face Cleanser, 5 oz",5
"Big Red Rooster White Noise Machine | Sleep Sound Machine For Sleeping | 6 Soothing Sounds | White Noise Machine For Office Privacy | Plug In Or Battery Operated | Sounds for Home, Baby or Travel",17
10 Regular Size Reusable Silicone Drinking Straws - 30oz and 20oz tumblers compatible - extra long - with cleaning brush,8
"Dawn Ultra Dishwashing Liquid Dish Soap (4x19oz) + Non-Scratch Sponge (2ct), Original Scent (Packaging May Vary)",14
OXO Good Grips Dish Brush,5
"NOW Supplements, Vitamin D-3 5000 IU, 240 Softgels",9
Schick Hydro Silk TrimStyle Moisturizing Razor for Women with Bikini Trimmer,12
"Black Seed Oil - 120 Softgel Capsules (Non-GMO & Vegetarian) Premium Cold-Pressed Nigella Sativa Producing Pure Black Cumin Seed Oil with Vitamin E - Made in The USA - 500mg Each, 1000mg Per Serving",13
"POY Replacement Bands Compatible for Fitbit Charge 2, Classic & Special Edition Adjustable Sport Wristbands",4
"Muscle Milk Genuine Protein Shake, Chocolate, 25g Protein, 11 FL OZ, 12 Count",6
Nature's Way Charcoal Activated; 560 mg Charcoal per serving; 100 Capsules (Packaging May Vary),13
"Diapers Size 3, 198 Count - Luvs Ultra Leakguards Disposable Baby Diapers, ONE MONTH SUPPLY (Packaging May Vary)",8
Hot Cream Cellulite Treatment – Belly Fat Burner for Women and Men – Natural Anti Aging Cream with Antioxidants and Essential Oils Rosemary Lavender Aloe – Deep Tissue Massage Muscle Relaxer,28
"TheraBreath Fresh Breath Oral Rinse, Icy Mint, 16 Ounce Bottle (Pack of 2)",11
"Nature Made Melatonin 3mg Tablets, 240 Count for Supporting Restful Sleep† (Packaging May Vary)",8
"GUM Crayola Kids' Flossers, Grape, Fluoride Coated, Ages 3+, 75 Count",2
"OxiClean Odor Blasters Stain & Odor Remover, 80 Ounce",11
AmazonBasics AAAA 1.5 Volt Everyday Alkaline Batteries - Pack of 8,4
Tolco Empty Spray Bottle 8 oz. Frosted Assorted Colors (Pack of 3),5
"Baebody Eye Gel for Appearance of Dark Circles, Puffiness, Wrinkles and Bags - for Under and Around Eyes - 1.7 fl oz (50ml).",24
"Wool Dryer Balls - Natural Fabric Softener, Reusable, Reduces Clothing Wrinkles and Saves Drying Time. The Large Dryer Ball is a Better Alternative to Plastic Balls and Liquid Softener. (Pack of 6)",7
"DevaCurl Styling Cream, Define and Control, Touchable Hold, 5.1 Fl Oz (Pack of 1)",13
"Hair Remover, Veet Gel Hair Removal Cream Sensitive, 13.5 Ounce, Sensitive formula with Aloe Vera and Vitamin E  ( Packaging May Vary )",7
"Nuun Sport: Electrolyte-Rich Sports Drink Tablets, Juice Box Mixed Flavor Pack, Box of 4 Tubes (40 servings), Sports Drink for Replenishment of Essential Electrolytes Lost Through Sweat",21
"Squatty Potty The Original Bathroom Toilet Stool, 7"" height, White",23
"Dove Men+Care 2 in 1 Shampoo and Conditioner, Fresh and Clean, 12 oz, 4 count",9
Mario Badescu Facial Spray with Aloe Herbs and Rosewater,7
"ACDelco AA Super Alkaline Batteries in Recloseable Package, 100 Count",22
Moroccanoil Color Depositing Mask,28
"Organic Ashwagandha 2,100 mg - 100 Vegan Capsules Pure Organic Ashwagandha Root Extract and Powder - Natural Anxiety Relief, Mood Enhancer, Immune & Thyroid Support, Anti Anxiety",15
"Diapers Size 4, 160 Count - Pampers Cruisers Disposable Baby Diapers, ONE MONTH SUPPLY",49
Ketogenic Keto BHB Supplement - Appetite Suppressant Weight Loss Pills for Women and Men - Ketosis Diet Pill Weightloss Supplements - Exogenous Ketones- 60 Capsules,14
Seventh Generation White Toilet Paper 2-ply 100% Recycled Paper 24 Rolls,20
"Remedy Antifungal Soap, Helps Wash Away Body Odor, Athlete’s Foot, Nail Fungus, Ringworm, Jock Itch, Yeast Infections and Skin Irritations. 100% Natural with Tea Tree Oil, Mint & Aloe 12 oz",14
"Vitafusion Calcium Supplement  Gummy Vitamins, 100ct",9
"Quilted Northern Ultra Soft & Strong Toilet Paper, 24 Supreme Rolls, 340 2-Ply Sheets Per Roll",26
Finish - Quantum - 82ct - Dishwasher Detergent - Powerball - Ultimate Clean & Shine - Dishwashing Tablets - Dish Tabs,18
"Charmin Ultra Soft Toilet Paper, 48 Double Rolls = 96 Regular Rolls",29
"Bulletproof Brain Octane Oil, Reliable and Quick Source of Energy, Ketogenic Diet, More Than Just MCT Oil (16 Ounces)",24
"Centrum Silver Women (200 Count) Multivitamin / Multimineral Supplement Tablet, Vitamin D3, Age 50+",15
"Turmeric Curcumin with Ginger and Bioperine. Vegan Joint Pain Relief, Anti-Inflammatory, Antioxidant, Anti-Aging Supplement with 10 milligrams of Black Pepper for Better Absorption. Natural Non-GMO",21
"Depend Incontinence Guards for Men, Maximum Absorbency, 2 Packs of 52, 104 Total Count (Packaging May Vary)",23
"Ziploc Storage Bags, quart, 80 Count (Pack of 1)",7
"Scott 1000 Sheets Per Roll Toilet Paper, 32 Rolls, Bath Tissue",27
"Amazon Brand - Mama Bear Diaper Pail Refills for Diaper Genie Pails, 1080 Count (Pack of 4)",16
"Benefiber Daily Prebiotic Dietary Fiber Supplement Powder for Digestive Health, 100% Natural, Clear & Taste-Free, 125 Servings of Fiber Powder, 17.6 oz",19
"Hefty Trash Bags for The Recycling Bin - Blue, 13 Gallon, 60 Count",8
"simplehuman Code J Custom Fit Drawstring Trash Bags, 30-45 Liter / 8-12 Gallon, 100-Count Box",29
"Nature's Way 100% Potency Pure Source MCT Oil from Coconut- Certified Paleo, Certified Vegan- Non-GMO Project Verified, Vegetarian, Gluten-Free, 16 Fluid Ounce (Packaging May Vary)",12
Gillette Venus Sensitive Women's Disposable Razors - 6 Pack,12
Biotin Shampoo for Hair Growth B-Complex Formula for Hair Loss Removes DHT for Thicker Fuller Hair Anti Dandruff Formula with Zinc Tea Tree Oil Extract Jojoba Oil Argan Oil For Women and Men 8 oz,9
AmazonBasics AA High-Capacity Rechargeable Batteries (8-Pack) Pre-charged - Packaging May Vary,17
Degree Men MotionSense UltraClear Black+White Antiperspirant Deodorant Stick 2.7 oz 4 ct,13
"Kitsch Spiral Hair Ties, Coil Hair Ties, Phone Cord Hair Ties, Hair Coils - 8 Pcs, Brunette",7
"Febreze Extra Strength + Unstoppables Fabric Refresher, Fresh, 2 Count",10
"NOW Supplements, Psyllium Husk 500 mg, 500 Capsules",19
Activated Charcoal Natural Teeth Whitener Teeth Whitening Charcoal Powder Proven No Hurt on Enamel with Bamboo Brush,8
"American Crew Forming Cream, 3 ounce",10
"Amazon Brand - Solimo Facial Tissues with Lotion, 75 Tissues per Box (18 Cube Boxes)",23
Knee Brace with Side Stabilizers & Patella Gel Pads for Knee Support,17
"Vitamin C Facial Cleanser - Anti Aging, Breakout & Blemish, Wrinkle Reducing, Exfoliating Gel Face Wash - Clear Pores on Oily, Dry & Sensitive Skin with Organic & Natural Ingredients - 6.7 oz",19
"Vitafusion Prenatal Gummy Vitamins, 90 Count (Packaging May Vary)",9
"ACDelco Aa Super Alkaline Batteries In Recloseable Package, 40Count",9
"Quilted Northern Ultra Soft & Strong Toilet Paper, 12 Count, Pack of 4",25
CeraVe Facial Moisturizing Lotion AM SPF 30 | 3 Ounce | Daily Face Moisturizer with SPF | Fragrance Free,12
"FDA cleared OTC HealthmateForever YK15AB TENS unit with 4 outputs, apply 8 pads at the same time, 15 modes Handheld Electrotherapy device | Electronic Pulse Massager for Electrotherapy Pain Management -- Pain Relief Therapy : Chosen by Sufferers of Tennis Elbow, Carpal Tunnel Syndrome, Arthritis, Bursitis, Tendonitis, Plantar Fasciitis, Sciatica, Back Pain, Fibromyalgia, Shin Splints, Neuropathy and other Inflammation Ailments Patent No. USD723178S",24
"Glad Tall Kitchen Drawstring Trash Bags – ForceFlexPlus 13 Gallon White Trash Bag, OdorShield – 80 Count",12
"Philips Norelco Multigroom Series 3000, MG3750/50, Beard Face and Body Hair Trimmer for Men, 13 Attachments - NO BLADE OIL NEEDED",19
"RXBAR, Chocolate Sea Salt, Protein Bar, Breakfast Bar, High Protein Snack, 12 Count",21
"Multi Collagen Pills (Types I, II, III, V & X) - Collagen Peptides + Absorption Enhancer - Grass Fed Collagen Protein Blend for Anti-Aging, Hair, Skin, Nails and Joints (90 Collagen Capsules)",25
"Nature Made Super B Energy Complex Softgels, 60 Count for Metabolic Health† (Packaging May Vary)",7
"Lysol Handi-Pack Disinfecting Wipes(320ct),  Lemon & Lime Blossom, Pack of 4",14
"Listerine Ultraclean Access Disposable Snap-On Flosser Refill Heads For Proper Oral Care, Mint Flavored, 28 Count",3
"Havasu Nutrition Elderberry Gummies - Supports Immune System Health - Made with Premium Plant-Based Pectin - NO Gelatin, NO Fructose Corn Syrup, Gluten Free - Natural Ingredients, 60 Gummies",14
"Natrol Melatonin 10mg Gummy, 90 Count",9
"CeraVe SA Lotion for Rough & Bumpy Skin | 8 Ounce | Vitamin D, Hyaluronic Acid, Salicylic Acid & Lactic Acid Lotion | Fragrance Free",13
"Seventh Generation Dish Liquid Soap, Free & Clear, 25 oz, Pack of 6",17
"Dove  More Moisturizing than Coconut Soap Bars, Coconut Milk Beauty Bar 4 oz, 6 Bar",6
"Scott Essential Professional 100% Recycled Fiber Bulk Toilet Paper for Business (13217), 2-PLY Standard Rolls, White, 80 Rolls / Case, 506 Sheets / Roll",50
Certain Dri Prescription Strength Clinical Antiperspirant | Doctor Recommended Hyperhidrosis Treatment | 72 Hour Protection from Excessive Sweating | Roll-On | 1.2 Ounces,6
