product_description,product_price
"Philips Respironics DreamStation Filter Kit, Includes Pollen Filter(s) and 6 Disposable Ultra-Fine Filters (2 Pollen 6 Ultra-Fine)",14
"Nioxin Cleanser Shampoo System 2 for Fine Hair with Progressed Thinning, 33.8 Ounce",32
"EltaMD Foaming Facial Cleanser, Gentle, Oil-free, Paraben-free, Dermatologist-Recommended Enzyme and Amino Acid Face Wash 7.0 oz",25
"ADC Temple Touch Digital Fever Thermometer, Non Invasive and Quick Read, Suitable for Babies, Newborns, Kids, and Adults, Adtemp 427, White",12
"Sambucol Black Elderberry Syrup Original Formula,  7.8 Ounce Bottle",14
"Optimum Nutrition Micronized Creatine Monohydrate Capsules, Keto Friendly, 2500mg, 300 Capsules",23
"Pampers Swaddlers Diapers, Size 1, 20 Count Pack of 2 (Total of 40 Pampers)",14
Old English Scratch Cover For Dark Woods Polish 8 oz,4
"Degree UltraClear Black + White Antiperspirant Deodorant 2.6 oz, 4 count",9
"Scotch-Brite Heavy Duty Dishwand Refill, 4-Refills",7
"Betty Dain Fashionista Collection Mold Resistant Lined Shower Cap, Deco Dots",6
"Pocket Pussy,Male Masturbators Cup Adult Sex Toys Realistic Textured Pocket Vagina Pussy Man Masturbation Stroker",26
"HairAnew (Unique Hair Growth Vitamins with Biotin) - Tested - for Hair, Skin and Nails - Women and Men - Addresses Vitamin Deficiencies that Could be the Cause of Hair Loss or Lack of Regrowth (1)",29
"It's a 10 - Miracle Leave-In Plus Keratin Spray, 10 oz.",27
"Philips Hue White and Color Ambiance LED Smart Light Bulb Starter Kit, 3 A19 Smart Bulbs & 1 Hue Hub (Works with Alexa, Apple HomeKit & Google Assistant)",99
"Cellucor C4 Ripped Pre Workout Powder, Cherry Limeade, 30 Servings - Preworkout Powder for Men & Women with Green Coffee Bean Extract & L Carnitine",29
"Reusable Silicone Ear Plugs - ANBOW Waterproof Hypoallergenic Noise Reduction Earplugs for Sleeping, Swimming, Snoring, Concerts, 32dB Highest NRR, 3 Pairs with Bonus Travel Pouch",9
"Mrs. Meyer's Clean Day Dryer Sheets, Lavender, 80 ct",6
Adaptive Sound Technologies LectroFan High Fidelity White Noise Sound Machine with 20 Unique Non-Looping Fan and White Noise Sounds and Sleep Timer,49
Nature Made Vitamin B12 1000 mcg. Softgels Value Size 150 Ct,15
"Sonimart Replacement Toothbrush Heads compatible with Sonicare ProResults HX9024, 8 pack, fits 2 Series Plaque Control, 3 Series Gum Health, DiamondClean, FlexCare, HealthyWhite, EasyClean",11
"TRU NIAGEN Nicotinamide Riboside - Patented NAD Booster for Cellular Repair & Energy, 150mg Vegetarian Capsules, 300mg Per Serving, 30 Day Bottle - (Pack of 3)",119
ZZICEN Hair Scrunchies Velvet Elastic Hair Bands Scrunchy Hair Ties Ropes Scrunchie for Women or Girls Hair Accessories - 46 Assorted,8
"Amazer Kitchen Scrub Brush Sink Bathroom Brushes with Scraper Tip Comfortable Grip Odourless Bristles for Pot Pan Cast Iron Skillet Dishes Cleaning, 2-Pack",6
"New Boob Tape Nude DIY Lift Boob Job, Push up Breast, Body Tape,Breast Lift Tape,Bra Tape,Foot Tape,Medical Grade and Waterproof. A-E Cup, Kim K's Trick.",9
"Organic Blend of Olive, Lavender, Almond and Grapeseed oils with Vitamin E. Daily Moisturizer for Skin, Hair, Cuticle, Scalp, Foot, nail and face care. Pure natural Full Body oil for Men and Women",14
"Happy Baby Organic Yogis Freeze-Dried Yogurt & Fruit Snacks, 3 Flavor Variety Pack,1 Ounce",10
"Gain flings! Laundry Detergent Pacs Plus Aroma Boost, Original Scent, HE Compatible, 96 Count (Packaging May Vary)",21
"Neutrogena Rapid Wrinkle Repair Daily Hyaluronic Acid Retinol Face Moisturizer, Anti Wrinkle Face Cream & Neck Cream with SPF 30 Sunscreen - Hyaluronic Acid, Retinol & Glycerin with SPF 30, 1 fl. oz",17
"Garden of Life Raw Organic Protein Vanilla Powder, 20 Servings *Packaging May Vary* Certified Vegan, Gluten Free, Organic, Non-GMO, Plant Based Sugar Free Protein Shake with Probiotics & Enzymes",32
"Colgate Max Fresh Whitening Toothpaste with Breath Strips, Clean Mint - 6 ounce (4 Pack)",7
"Amazon Elements Vitamin C 1000mg, Vegan, 300 Tablets, 10 month supply",15
"Maca Powder Organic - Peruvian Root Premium Grade Superfood (Raw) - USDA & Vegan Certified - 226.7g (8oz) - Perfect for Breakfast, Smoothies, Baking & Ice Cream.",9
"#1 Most Effective Foot and Shoe Deodorizer Spray - All Natural and 100% Safe for All Shoes & Feet - Fresh Peppermint & Tea Tree Deodorant, Shoe Odor Eliminator & Kills Bacteria Immediately!",13
"Garden of Life Multivitamin for Men - mykind Organic Men's Once Daily Whole Food Vitamin Supplement, Vegan, 60 Tablets",34
"Copper Compression Copper Arch Support - 2 Plantar Fasciitis Braces/Sleeves. Guaranteed Highest Copper Content. Foot Care, Heel Spurs, Feet Pain, Flat Arches (1 Pair Black - One Size Fits All)",13
"Kitchiny Silicone Bottle Brush | One Brush | 12.5” Bottle Cleaner for Your Hydro Flask, Vacuum Sports Bottle, Vase and Glassware | Water Bottle Cleaning Brush for Washing Narrow Neck Containers",8
iProven Medical Digital Ear Thermometer with Temporal Forehead Function - Clinically Approved Upgraded Infrared Lens Technology DMT-489 for Better Accuracy - New Medical Algorithm (White Grey),29
"FiberAdvance Gummies, 90 Count",9
"Depend FIT-FLEX Incontinence Underwear for Men, Maximum Absorbency, Disposable, Large, Grey, 52 Count",30
"Differin Daily Deep Cleanser - Sensitive Skin Formula.  Deep Cleans With The Power Of Maximum Strength Benzoyl Peroxide But With Less Irritation and Redness, 4 ounce",8
"Casabella 1 Count Dustpan and Brush Set, Graphite/Orange",8
"Suave Antiperspirant Deodorant, Shower Fresh 2.6 Ounce (Pack of 1)",1
Pure Tea Tree Oil Shampoo - Natural Essential Oil Anti-Dandruff Shampoo For Dry Itchy & Flaky Scalp - Anti-fungal & Anti-Bacterial - Sulfate Free Hydrating Cleanser - Prevent Head Lice & Thinning Hair,9
"Bottle Brush Cleaner 5 Pack - Long Water Bottle and Straw Cleaning Brush - Kitchen Wire Scrub Set for Washing, Wine Decanter, Baby, Kombucha, Pipes, Hydro Flask Tumbler, Sinks, Beer Brewing Supplies",11
"Listerine Gentle Gum Care Interdental Floss for Sensitive Gums, Oral Care, Mint, 50 Yards, Pack of 6",14
"2 Pairs Foot Peel Mask Exfoliant for Soft Feet in 1-2 Weeks, Exfoliating Booties for Peeling Off Calluses & Dead Skin, For Men & Women Lavender by Bea Luz",17
"DUDE Wipes Flushable Wet Wipes 30 Wipes, Individually Wrapped for Travel, Unscented Wet Wipes with Vitamin-E & Aloe, Septic and Sewer Safe",10
"Shiatsu Back Shoulder and Neck Massager with Heat - Deep Tissue 3D Kneading Back Massager for Neck, Shoulders, Foot, Legs - Electric Full Body Pillow Massage, Relieve Muscle Pain - Home & car (Gray)",49
"Aveeno Baby Calming Comfort Moisturizing Lotion with Lavender, Vanilla and Natural Oatmeal, 18 fl. oz",7
"Professional Ionic Salon Hair Dryer, Powerful 2200 watt Ceramic Tourmaline Blow Dryer, Pro Ion quiet Hairdryer with 2 Concentrator Nozzle Attachments - Best Soft Touch Body/Black& Rose Gold",49
OXO Good Grips Microfiber Hand Duster,9
Mario Badescu Facial Spray with Rosewater & Facial Spray with Green Tea Duo,14
"Lysol Dual Action Disinfecting Wipes Value Pack, Citrus, 150ct",8
"Babyganics Baby Shampoo and Body Wash, Fragrance Free, 3 Pack",19
Metatarsal Pads | Metatarsal Pads for Women | Ball of Foot Cushions (2 Pairs Foot Pads) All Day Pain Relief and Comfort One Size Fits Shoe Inserts for Women,15
"Nature Made Calcium 600 mg Tablets with Vitamin D, 220 Count Value Size (Packaging May Vary)",14
"Tongue Scraper, Effective Tongue Cleaner 2 Pack Surgical Stainless Steel Rustproof Tongue Scrapers Reusable Lifetime Dental Scraper with Handy Carrying Store Case - New",4
Frida Mom Upside Down Peri Bottle for Postpartum Care | The Original Fridababy MomWasher for Perineal Recovery and Cleansing After Birth,15
Thayers Alcohol-free Unscented Witch Hazel Toner (12-oz.),9
"Facial Hair Remover for Women, LEUXE Painless Hair Removal Waterproof Shaver Razor with LED Light for Peach Fuzz Fine Hair Chin Cheek Upper Lip",19
"Natural Vitality Calm PLUS Calcium Supplement Powder, Raspberry Lemon- 16 ounce",22
ACT Kids Anticavity Fluoride Rinse Wild Watermelon 16.89 Ounce,3
"Nature's Bounty Dual Spectrum Bi-Layer Melatonin 5 mg, 60 Tablets",4
"Millennium Tanning Products: Dark Tanning Lotion, 100x, 13.5 Fl Oz",16
"NOW Supplements, Magnesium 400 mg, 180 Capsules",9
"Medpride Instant Cold Pack (5”x 6”) – Set of 24 Disposable Cold Therapy Ice Packs for Pain Relief, Swelling, Inflammation, Sprains, Strained Muscles, Toothache – for Athletes & Outdoor Activities",18
"Turmeric Curcumin C3 Complex 500mg, Enhanced with Black Pepper & Organic Coconut Oil for Better Absorption; Non-GMO & Gluten Free - 120 Liquid Softgels",29
"Nad's for Men Hair Removal Cream, 6.8 oz.",6
"Neutrogena Rapid Clear Stubborn Acne Face Wash with 10% Benzoyl Peroxide Acne Treatment Medicine, Daily Facial Cleanser to Reduce Size and Redness of Acne, Benzoyl Peroxide Acne Face Wash, 5 oz",8
Hefty Medium Round Disposable Foam Bowls - 50 Bowls,2
Trojan Mangum Bareskin Lubricated Condoms,15
"Eucerin Daily Protection Face Lotion - Broad Spectrum SPF 30 - Moisturizes and Protects Sensitive, Dry Skin - 4 fl. oz. Pump Bottle",187
"Life Extension Neuro-Mag Magnesium L-Threonate, 90 Vegetarian Capsules",7
CeraVe Face Moisturizer with SPF 30 | 1.7 Ounce | Light-Weight Face Lotion with Hyaluronic Acid | Fragrance Free,24
"Taylor of Old Bond Street Sandalwood Shaving Cream Bowl, 5.3-Ounce",14
"Dr. Scholl’s Moleskin Plus Padding Roll (24"" x  4 5/8"") // All-Day Pain Relief and Protection from Shoe Friction with Soft Padding That Conforms to the Foot and Can Be Cut To Any Size",12
Happy Baby Organic Superfood Puffs Assortment Variety Packs 2.1 Ounce (Pack of 6),6
"Dawn Platinum Dishwashing Liquid Dish Soap (3x24oz) + Non-Scratch Sponge (2ct), Refreshing Rain",18
"Puritan's Pride Super Strength Melatonin 10mg Rapid Release Capsules, 60-Count",15
Vitafusion Power C Gummy Vitamins for Adults,4
"Biosilk Silk Therapy Original Cure, 12 oz",9
"Melitta Super Premium Coffee Filters, Basket, 8-12 Cups, White, Pack of 600",7
"Goo Gone Pro-Power Spray Gel - 24 Ounce - Surface Safe, Great Cleaner, No Harsh Odors, Removes Stickers, Can Be Used On Tools",25
"Hair Scalp Massager, Heeta Scalp Shampoo Brush with Soft Silicon Brush Head Tourmaline Contained (Black)",7
"McKesson UPHV3036 StayDry Ultra Underpads, 30"" x 36"" (Pack of 100)",5
"Downy April Fresh Fabric Softener Dryer Sheets, 240 count",37
"Isopure Low Carb, Keto Friendly Protein Powder, 100% Whey Protein Isolate, Flavor: Dutch Chocolate, 3 Pounds",8
"BSN SYNTHA-6 Whey Protein Powder, Micellar Casein, Milk Protein Isolate, Chocolate Milkshake, 48 Servings (Packaging May Vary)",41
"Boveda 62-Percent RH 2-Way Humidity Control, 8 Gram - 10 Pack",42
Revlon Detangle & Smooth Black Cushion Hair Brush,14
"Glad Small Trash Bags - OdorShield 4 Gallon White Trash Bag, Febreze Fresh Clean - 26 Count Each (Pack of 6)",5
"John Frieda Hot Air Brush, 1 1/2-inch Hot Air Brush",12
"Amazon Brand - Solimo Fiber 4g, 90 Gummies (2 Gummies per Serving)",29
"VicTsing Upgraded Mini Oil Diffuser 130ml, Easy to Use Super Quiet Essential Oil Diffuser, Aromatherapy Diffuser with Waterless Auto Shut-off, 8 Color LED Lights and BPA-free for Home Office(Black)",17
Reynolds Kitchens Quick Cut Plastic Wrap - 250 Square Foot Roll,3
"Babyganics All Purpose Surface Wipes, Fragrance Free, 150 Count (contains Two 75-count canisters)",13
"Electrolyte Supplement for Rapid Hydration | NO Calories NO Sugar | 20%+ More Potassium, Magnesium & Zinc | Keto Flu & Leg Cramp Relief | 48 Servings",19
100% Pure Garcinia Cambogia Extract 95% HCA - 2100mg Appetite Suppressant Capsules - Orphic Nutrition - 90 Caps,16
"Changing Lifestyles Safe-er-Grip 17"" Bath & Shower Handle",11
Hyaluronic Acid Serum for Skin - 2oz Double Size,10
"Glucosamine Chondroitin MSM Turmeric for Hip, Joint & Back Pain Relief. Anti Inflammatory Supplement with Hyaluronic Acid, Collagen, Boswellia, Bromelain & Fruitex-B. Gluten Free & Non GMO",17
"Dr. Bronner’s - Pure-Castile Liquid Soap (Baby Unscented, 8 Ounce)",7
"LifeStyles SKYN Elite Condoms, 36 Count",14
5 Pack Charcoal Toothbrush [GENTLE SOFT] Slim Teeth Head Whitening Brush for Adults & Children - Ultra Soft Medium Tip Bristles (Black),7
"NOW Supplements, Quercetin with Bromelain, 120 Veg Capsules",16
"Andis 17150 Pro Foil Lithium Titanium Foil Shaver, Cord/ Cordless (Grey)",47
"Jarrow Formulas MK-7 90 mcg, 60 Count (Packaging may vary)",13
Tea Tree Shaping Cream,19
"Hustle Butter Deluxe – Tattoo Butter for Before, During, After The Tattoo Process – Lubricates & Moisturizes – 100% Vegan Replacement for Petroleum-Based Products – 5 oz",19
"Vitamin K2 (as MK7) with Organic Coconut Oil for better absorption | Made with clinically proven MenaQ7 and Formulated without Soy or gluten ~ Non-GMO Verified, Vegan Certified (60 Veggie-Softgels)",14
"Solimo 5 Blade Razor for Women, Handle, 12 Cartridges & Shower Hanger (Cartridges fit Solimo Razor Handles only)",17
"Genuine Philips Sonicare toothbrush head variety pack – C3 Premium Plaque Control & C2 Optimal Plaque Control, HX9023/69, 3-pk, white",26
"Renpure Coconut Whipped Creme Leave-In Conditioner, 16 oz",6
"Amazon Brand - Revly Biotin Complex, Biotin 2500 mcg per Serving (2 Gummies) with Vitamins C & E, 60 Gummies, Vegan, Non-GMO, Gluten free",11
"ARM & HAMMER Plus OxiClean Odor Blasters 3-in-1 Power Paks, 40ct",7
Energizer Rechargeable AA and AAA Battery Charger (Recharge Value) with 4 AA NiMH Rechargeable Batteries - Packaging May Vary,10
"Toenail Fungus Stop Nail Repair Pen 2 Pcs, Nail Fungus Stop, Fingernail Fungus,Fungi Nail Fungus Remover, Fungus Nail Care Solution",17
"Olay Ultra Moisture Shea Butter Body Wash, 30 Fluid Ounce",6
"Free & Clear Hair Shampoo | Fragrance, Gluten and Sulfate Free | For Sensitive Skin | 12 Ounce",10
"Quickie Stand and Store Stand & Store Lobby Broom and Dustpan Set (487), 1-Pack",13
Micro Touch SOLO Rechargeable Full Body Trimmer and Shaver,19
"St. Tropez Self Tan Express Advanced Bronzing Mousse, 6.7 Fl Oz",44
Elizavecca CER-100 Collagen Coating Hair Protein Treatment 100ml,7
"Degree Dry Protection Antiperspirant, Fresh Energy 2.6 Oz (Twin Pack)",8
"Lubricant for Him and Her, K-Y Yours & Mine Couples Lubricant, 3 oz, Couples Personal Lubricant and Intimate Gel. Sex Lube for Women, Men & Couples.",13
"Marpac Rohm Portable White Noise Machine for Travel | 3 Soothing, Natural Sounds with Volume Control | Compact Sleep Therapy for Adults & Baby | USB Rechargeable | Lanyard for Easy Hanging",27
"Mrs. Meyer's Clean Day Multi-Surface Concentrate, Lemon Verbena, 32 fl oz, 2 ct",15
"Ubbi Disposable Diaper Pail Plastic Bags, Made with Recyclable Material, True Value Pack, 75 Count, 13-Gallon",19
"Mueller Green Fitted Wrist Brace, Black, Left Hand, Small/Medium",13
Revlon 1875W Volumizing Turbo Hair Dryer,17
"Nature's Way Alive Once Daily Men's 50+ Ultra Potency Tablets, 60",13
Smarter Turmeric Curcumin - Potency and Absorption in a SoftGel | The Most Active Form of Curcuminoid Found in the Turmeric Root | 95% Tetra-Hydro Curcuminoids (60 Count - 1 Month Supply),39
"Aveeno Ultra-Calming Cleansing Oil-Free Makeup Removing Wipes for Sensitive Skin, 25 Count",6
"Rosehip Seed Oil by Kate Blanc. USDA Certified Organic, 100% Pure, Cold Pressed, Unrefined. Reduce Acne Scars. Essential Oil for Face, Nails, Hair, Skin. Therapeutic AAA+ Grade (1 oz)",12
ArtNaturals Organic Moroccan Argan Oil Shampoo and Conditioner Set - (2 x 16 Fl Oz / 473ml) - Sulfate Free - Volumizing & Moisturizing - Gentle on Curly & Color Treated Hair - Infused with Keratin,23
"Viking Revolution Beard Oil Conditioner - All Natural Unscented Organic Argan & Jojoba Oils – Softens, Smooths & Strengthens Beard Growth – Grooming Beard and Mustache Maintenance Treatment, 1 Pack",8
"Puritan's Pride Vitamin E 1000 IU Softgels, 100 Rapid Release Softgels",9
Nature's Bounty Optimal Solutions Hair Skin & Nails Extra Strength,3
"Sambucol Black Elderberry Gummies, 30 Gummies",212
Überlube Luxury Lubricant 100ml,9
"Beautify Beauties Flairosol Hair Mist Spray Bottle – Ultra Fine Continuous Water Mister for Hairstyling, Cleaning, Plants, Misting & Skin Care (5 Ounce)",28
"Grimm SUPA 50 Brass Screens Pipe Filters - 3/4"" (.75) Pipe Screens",5
"Schick Women's Razor Blade Refills, Hydro Silk 5 Sensitive care, 4 ct (Packaging May Vary)",13
"Timeless Skin Care 20% Vitamin C Plus E Ferulic Acid Serum, 1 oz.",15
"Baby's First Toothbrush with Case, Silicone, BPA-Free  - SmileFrida the Finger Toothbrush by Fridababy, cleans teeth and gums with double-sided brush for babies 3 months and up",7
Surviveware Biodegradable Wet Wipes - Large Pack,9
Trojan Magnum Lubricated Latex Large Size Condoms,12
"St Ives Apricot Scrub, Acne Control 6 Fl.oz",180
"Garden of Life Ultra Pure EPA/DHA Omega 3 Fish Oil - Oceans 3 Oceans Mom Dietary Supplement with Antioxidants, 30 Softgels",3
"Kleenex Multifold Paper Towels (01890), White, 16 Packs / Case, 150 Tri Fold Paper Towels / Pack, 2,400 Towels / Case",6
LyteShow: Ionic Electrolyte Concentrate for Rapid Rehydration (40 Servings),25
"Bed Wedge, FitPlus Premium Wedge Pillow 2 Inches Memory Foam 2 Year Warranty, Acid Reflux Pillow With Removable Cover Dr Recommended For Snoring And Gerds",16
"Lysol Laundry Sanitizer Additive, Crisp Linen, 41oz",39
"Party Dimensions 300 Count Cutlery Combo Box, Clear",10
"Pure Protein Powder, Whey, High Protein, Low Sugar, Gluten Free, Vanilla Cream, 1.75 lbs",15
"Garden of Life - mykind Organics Prenatal Gummy Vitamins - Berry -  Organic, Non-GMO, Vegan, Kosher Complete Multi - Methyl B12, D3 & Folate - Gluten, Soy & Dairy Free - 120 Real Fruit Chew Gummies",24
"Huggies Little Swimmers Disposable Swim Diapers, Swimpants, Size 4 Medium (24-34 lb.), 18 Ct, with Huggies Wipes Clutch 'N' Clean Bonus Pack (Packaging May Vary)",13
CYLEN Home-Memory Foam Bamboo Charcoal Infused Ventilated Orthopedic Seat Cushion for Car and Wheelchair - Washable & Breathable Cover (Black),21
"Boveda 72 Percent RH 2-Way Humidity Control, Large, 60 gram, 4-Pack",16
Vitafusion Fiber Well Fit Gummies,9
"Depend FIT-FLEX Incontinence Underwear for Men, Maximum Absorbency, Disposable, Small/Medium, Grey, 60 Count",167
"Dust Pan and Broom/Dustpan Cleans Broom Combo with 52"" Long Handle for Home Kitchen Room Office Lobby Floor Use Upright Stand Up Broom and Dustpan Set",35
"Antifungal Balm - Made in USA - Helps Treat Eczema, Ringworm, Jock Itch, Athletes Foot and Nail Fungal Infections - Best Ointment to Soothes Itchy, Scaly or Cracked Skin",27
"PuriLens Plus Preservative Free Saline 4 Fl Oz bottles, Pack of 12",19
Weiman Silver Polish and Cleaner - 8 Ounce - Clean Shine and Polish Safe Protective Prevent Tarnish,39
"BSN Medical BEI076168 Leukotape P Sports Tape, 1 1/2 Inch x 15 Yard",8
"Gaia Herbs Black Elderberry Syrup - Daily Immune Support with Antioxidants, Organic Sambucus Elderberry Supplement, 5.4 Fl. Oz",21
"Glade PlugIns Scented Oil Refill Cashmere Woods, Essential Oil Infused Wall Plug In, 2.01 FL OZ, Pack of 3",6
Oh Yuk Jetted Tub System Cleaner 16 Ounces,16
"Plum Organics Stage 2, Organic Baby Food, Fruit and Veggie Variety Pack, 4 ounce pouches (Pack of 18) (Packaging May Vary)",25
"Downy Unstopable In-Wash Scent Booster Beads, Lush, 20.1 Ounce",11
Arm & Hammer Disposable Waste Bag Refills,7
"(20 Pack) Extra Large Magic Cleaning Eraser Sponge - 2X Thick, 2X Longer Lasting Melamine Sponges in Bulk - Multi Surface Power Scrubber Foam Pads - Bathtub, Floor, Baseboard, Bathroom, Wall Cleaner",9
"Now Supplements, Vitamin D-3 2000 IU, 240 Softgels",8
"Nature Made CoQ10 200 mg Softgels, 80 Count Value Size for Heart Health† (Packaging May Vary)",24
"Neutrogena Hydro Boost Hydrating Gel Cleanser, 6 Ounce",7
"Genius Sleep AID – Smart Sleeping Pills & Adrenal Fatigue Supplement, Natural Stress, Anxiety & Insomnia Relief - Relaxation Enhancer and Mood Support w/Inositol, L-Theanine & Glycine – 40 Capsules",19
Bath Loofahs Sponge Shower Pouf Body Scrubber Ball Mesh Pouf Bath Sponge 3 Pack,8
Wild Growth Hair Oil 4 Oz,7
"ResMed Climate Line Air Heated Tube for ResMed AirSense 10 & AirCurve 10, 37296",30
"Energizer Max C Batteries, Premium Alkaline C Cell Batteries (8 Battery Count) - Packaging May Vary",12
"Omega-3 Wild Alaskan Fish Oil (1250mg per Capsule) with Triglyceride EPA & DHA | Heart, Brain & Joint Support | IFOS 5 Star Certified, Non-GMO & Gluten Free (180 Softgels)",37
"Sunbeam Heating Pad for Pain Relief | Standard Size UltraHeat, 3 Heat Settings with Moist Heat| Light Blue, 12-Inch x 15-Inch",13
"Zipfizz Healthy Energy Drink Mix, Hydration with B12 and Multi Vitamins, Grape, 20 Count",18
"NOW Supplements, NAC  (N-Acetyl Cysteine)600 mg with Selenium & Molybdenum, 250 Veg Capsules",18
"Kitsch Spiral Hair Ties, Coil Hair Ties, Phone Cord Hair Ties, Hair Coils - 4 Pcs, Brunette",5
"Braun Series 3 32B Foil & Cutter Replacement Head, Compatible with Models 3000s, 3010s, 3040s, 3050cc, 3070cc, 3080s, 3090cc",24
Pureology Colour Fanatic Hair Leave in Treatment Spray with 21 Benefits,25
"Cetaphil Daily Hydrating Lotion with Hyaluronic Acid, 3.0 Fluid Ounce",12
Nature Made Sublingual Vitamin B12 1000 mcg. Cherry Flavored Lozenges 50 Ct,7
"Color My Bath Color Changing Bath Tablets, 300-Piece",12
ResMed Standard Water Chamber for AirSense 10 and AirCurve 10 Humidair Heated Humidifier,18
"Andis Professional T-Outliner Beard/Hair Trimmer with T-Blade, Gray, Model GTO (04710)",59
"Diapers Size 4, 150 Count - Pampers Pure Disposable Baby Diapers, Hypoallergenic and Unscented Protection, ONE Month Supply",62
"KIND Bars, Cranberry Almond + Antioxidants with Macadamia Nuts, Gluten Free, Low Sugar, 1.4oz, 12 Count",14
"Colgate Peroxyl Mouth Sore Rinse, Mild Mint - 500mL, 16.9 Fl Oz",8
Dr. Scholl’s EXTRA SUPPORT Insoles // Superior Shock Absorption and Reinforced Arch Support for Big & Tall Men To Reduce Muscle Fatigue so You Can Stay on Your Feet Longer (for Men's 8-14),12
"200mg Caffeine Pills - MCT Oil from 100% Coconuts + 100mg L-Theanine, Advanced Energy, Clean Focus and Perfect Clarity + All Natural Smooth Extended Release",19
"Ziploc Big Bags, Large, 5 Count",6
"Charmin Freshmates Flushable Wet Wipes, 40 Count (Pack of 12)",31
"Bissell 78H63 Deep Clean Pro 2X Deep Cleaning Concentrated Carpet Shampoo, 48 ounces - Silver",24
"Puracy Natural Laundry Stain Remover, Enzyme-Based Spot Cleaner, Free & Clear, 25 Ounce",12
"TIGI Bed Head for Men Matte Separation Workable Wax, 3 Ounce",8
"Cetaphil Cetaphil Pro Oil Absorbing Moisturizer With Spf 30 Broad Spectrum Sunscreen, 4 Ounce",14
"OGX Hydrating + Tea Tree Mint Shampoo, 13 Ounce",5
"Viva Naturals Sweet Almond Oil, 100% Pure and Hexane Free, Ideal for Skin and Hair DIYs (16 fl oz)",12
"Degree Men Antiperspirant and Deodorant, Everest 2.7 oz, Twin Pack",9
"Scotch-Brite Non-Scratch Dishwand, Keeps Hands out of the Mess",2
Colgate Sensitive Maximum Strength Whitening Toothpaste - 6 ounce (3 Pack),12
Gillette Venus ComfortGlide White Tea Women's Razor - 1 Handle + 2 Refills,7
Reynolds Wrap Heavy Duty Aluminum Foil - 130 Sq.Ft(43.33 YDS X 12 Inches),11
"Summer Brush and Comb, Teal/White",3
"Amazon Brand - Solimo Snack Storage Bags, 300 Count",7
"Genius Caffeine – Extended Release Microencapsulated Caffeine Pills, All Natural Non-Crash Sustained Energy & Focus Supplement –Preworkout & Nootropic Brain Booster For Men & Women,100 veggie capsules",14
"Aleve Liquid Gels, Naproxen Sodium Capsules 220 mg (NSAID), Pain Reliever/Fever Reducer, Fast Pain Relief, 120 Count",14
"NOW Supplements, Magnesium Citrate, 120 Veg Capsules",9
"Flyby Hangover Cure & Prevention Pills (30 Capsules) - Dihydromyricetin (DHM), Chlorophyll, Prickly Pear, N-Acetyl-Cysteine, Milk Thistle for Morning After Alcohol Recovery & Aid - Certified Organic",17
"NatureWise CLA 1250, High Potency, Natural Weight Loss Exercise Enhancement | Increase Lean Muscle Mass, Non-Stimulating | Non-GMO, Gluten-Free, & 100% Safflower Oil [2 Month Supply - 180 count]",20
Aquis Exfoliating and Invigorating Back Scrubber,11
Hyaluronic Acid for Face (2 oz) - 100% Pure Medical Quality Clinical Strength Formula - Anti aging formula for your skin,13
"Got2b Ultra Glued Invincible Styling Hair Gel, 6 Ounce (Pack of 3)",11
O-Cedar EasyWring Spin Mop Refill (Pack of 4),17
Palmer's Cocoa Butter Formula Daily Skin Therapy Body Lotion with Vitamin E | 13.5 Fl Oz (Pack of 1),4
"Ecover Automatic Dishwasher Soap Tablets, Citrus, 45 Count",8
"TYLER Gallon Glam Wash Laundry Detergent, Diva",67
"UNNI ASTM D6400 100% Compostable Trash Bags, 13 Gallon, 49.2 Liter, 50 Count, Heavy Duty 0.85 Mils, Tall Kitchen Trash Bags, Food Waste Bags, US BPI and Europe OK Compost Home Certified, San Francisco",16
"Purple Shampoo for Blonde Hair by GBG – Blonde Shampoo Instantly Eliminate Brassiness & Yellows - Brighten Blonde, Silver & Grey w/Celebrity Stylist Created Purple Toning Shampoo – 8oz",24
"Bioré Blackhead Removing and Pore Unclogging Deep Cleansing Pore Strip, 24 Count",13
"Glad Large Kitchen Drawstring Trash Bags - ForceFlex Kitchen Pro 20 Gallon Black Trash Bag, Febreze Fresh Clean - 80 Count",21
"Jarrow Formulas Methyl Folate 5-MTHF, Supports Brain, Memory, Cardiovascular Health, 400 Mcg, 60 Caps",4
"Havasu Nutrition DHEA Extra Strength Designed for Promoting Youthful Energy, Balance Hormone Levels & Supports Lean Muscle Mass, Non-GMO, 50 mg Supplement for Men & Women, 60 Capsules",16
"ArtNaturals Moroccan Argan Oil Shampoo - (16 Fl Oz / 473ml) - Moisturizing, Volumizing Sulfate Free Shampoo for Women, Men and Teens - Used for Colored and All Hair Types, Anti-Aging Hair Care",12
Nuun Active Hydration Variety Pack New & Improved (6 Flavors - 60 Tabs),30
"BrightJungle Under Eye Collagen Patch, 24K Gold Anti-Aging Mask, Pads for Puffy Eyes & Bags, Dark Circles and Wrinkles, with Hyaluronic Acid, Hydrogel, Deep Moisturizing Improves elasticity, 24 Pairs",14
"Dove Advanced Care Cool Essentials Antiperspirant Deodorant 2.6 oz, 4 count",25
"Garden of Life Vitamin B12 - Vitamin Code Raw B12 Whole Food Supplement, 1000 mcg, Vegan, 30 Capsules",6
