product_description,product_price
Saw Palmetto Supplement For Prostate Health - Extract & Berry Powder Complex - Healthy Urination Frequency & Flow Formula - May Help Block DHT - 500mg Capsules,10
"CloSYS Fluoride Toothpaste, 7 Ounce, Gentle Mint, Whitening, Enamel Protection, Sulfate Free",10
100 CRYSTAL CLEAR PLASTIC PLATES | 6 .25 Inch Disposable Plates | Fancy Dessert Plates | Hard Round Party Plates | Elegant Appetizer Plates | Heavy Duty Wedding Plates | Small Cake Plates [Diamond],16
"Heavy Duty Contractor Bags by Ultrasac - (VALUE 50 PACK /w TIES), 42 Gallon, 2'9"" X 4' - 3 MIL Thick Large Black Industrial Garbage Trashbags for Construction and Commercial use",24
"Carefree Acti-Fresh Body Shaped Panty Liners, Flexible Protection That Molds to Your Body, Long, 112 Count",5
"OGX Renewing + Argan Oil of Morocco Conditioner, 13 Ounce",5
"Power Crunch Protein Energy, Peanut Butter Fudge Butter Fudge, 1.4 Ounce, 12 pack",16
"Amazing Herbs Premium Black Seed Oil Soft-Gels, 60 Count",18
"Gillette SkinGuard Men's Razor Blade Refill for Sensitive Skin, 8 Blade Refill",23
"Tide to Go Instant Stain Remover Pens 3 ea (Pack of 1), White",8
"Colgate 360 Toothbrush with Tongue and Cheek Cleaner - Soft (6 Count), Compact Head",10
"Medline Softnit 300 Washable Underpads, Pack of 4 Large Bed Pads, 34"" x 36"", For use as incontinence bed pads, reusable pet pads, great for dogs, cats, and bunny",25
Under Eye Mask Gold Eye Mask Anti-Aging Hyaluronic Acid 24k Gold Eye Patches Under Eye Pads for Moisturizing & Reducing Dark Circles Puffiness Wrinkles,12
"Vitafusion Omega-3 Gummies, 120 Count",9
"ACT Restoring Anticavity Fluoride Mouthwash, Mint Burst, 33.8 Fl Oz",173
"Sensodyne Sensitive Teeth Whitening, True White Mint, Sensitivity Toothpaste, 3 ounce",5
"Night Cream by Olay Total Effects Anti-Aging Night Firming Cream & Face Moisturizer, 1.7 Fluid Ounce",5
"600 Clear Plastic Silverware Set | Disposable Plastic Utensils | 300 Plastic Forks, 200 Plastic Spoons, 100 Plastic Knives | Plastic Cutlery Set | Heavy Duty Bulk Flatware Set",19
"Plant Therapy Lavender Essential Oil 100% Pure, Undiluted, Therapeutic Grade 10 mL (1/3 oz)",19
"Garden of Life Vegetarian Multivitamin Supplement for Kids - Vitamin Code Kids Chewable Raw Whole Food Vitamin with Probiotics, 60 Chewable Bears",7
"Ankle Brace for Plantar Fasciitis and Ankle Support - Ankle Wrap for Sprain, Tendonitis & Heel Pain Relief for Women & Men",19
Orabrush Tongue Cleaner | Helps Fight Bad Breath | 4 Tongue Scrapers,13
"Sonic Electric Toothbrush Rechargeable for Adults - 4 Replacement Heads Orthodontic Cleaning for Braces with 2 Minutes Timer, USB Fast Charging Portable Teeth Whitening Toothbrush Black by Fairywill",10
Septic Tank Treatment - 1 Year Supply of Dissolvable Easy Flush Live Bacteria Packets (12 Count) - Best Way to Prevent Expensive Sewage Backups - Made in USA,22
The First Years American Red Cross Deluxe Nail Clipper with Magnifier,21
"Aveeno Ultra-Calming Foaming Cleanser and Makeup Remover for Dry, Sensitive Skin, 6 fl. oz",6
L-Carnitine 1000mg Servings 120 Tablets – Carnitine Amino Acid - Arazo Nutrition USA,19
"Proactiv Deep Cleansing Face Wash, 6 Oz",30
"NOW Supplements, Super Primrose 1300 mg with Naturally Occurring GLA (Gamma-Linolenic Acid), 120 Softgels",13
"Doctor's Best Extra Strength Ginkgo, Non-GMO, Gluten Free, Vegan, Soy Free, Promotes Mental Function and Memory, 120 mg, 120 Veggie Caps",6
"Everyone 3-in-1 Soap for Every Kid Safe, Gentle and Natural Shampoo, Body Wash, and Bubble Bath, Lavender Lullaby, 32 Fl Oz (Pack of 2)",23
"Cirepil Blue Wax, 14.11 Ounce Tin",22
"Medline Bed Assist bar With Storage Pocket, Height Adjustable Bed Rails for Elderly Adults, Assistance for Getting In & Out of Bed At Home",29
"EARTHLITE Disposable Face Cradle Covers – Medical-Grade, Ultra Soft, Luxurious, Non-Sticking Massage Face Covers/Headrest Covers for Massage Tables & Massage Chairs",14
The Ordinary Azelaic Acid Suspension 10% 30ml,19
"Amazon Brand - Solimo Potassium 99 mg, 120 Caplets, Four Month Supply (Packaging may vary)",4
Campbell Posture Cane Foldable Walking Cane for Men and Women,39
"Neutrogena Sport Face Oil-Free Lotion Sunscreen with Broad Spectrum SPF 70+, Sweatproof & Waterproof Active Sunscreen, 2.5 fl. oz",8
Honeydew Best Scar Cream for Face - Vitamin E Oil for Skin After Surgery - Stretch Mark Remover for Men & Women - Anti Aging Lotion - Acne Scar Removal for Old Scars on Body - Scar Treatment for Cuts,9
Cushion Grip - a Soft Pliable Thermoplastic for Refitting and Tightening Dentures 1 Oz (28 Grams),14
"Professional Stainless Steel Tweezers Set (4-Piece) – Precision Tweezers for Ingrown Hair, Facial Hair, Splinter, Blackhead and Tick Remover",5
DenTek Fresh Clean Floss Picks | Silky Comfort Floss | 75 Count | 3 Pack,8
Habitrol Novartis Nicotine Transdermal System Stop Smoking Aid Patches - 28 Each (Step 1 - 21 Mg),32
"Metamucil Fiber, 4-in-1 Psyllium Fiber Supplement Powder with Real Sugar, Orange Smooth Flavored Drink, 114 Servings (Packaging May Vary)",21
"Mantello Hard Bristle Pipe Cleaners, 4 Bundles, 176 Count",6
"Botanic Hearth Tea Tree Shampoo and Conditioner Set - with 100% Pure Tea Tree Oil, for Itchy and Dry Scalp, Sulfate Free, Paraben Free - for Men and Women - 2 bottles 16 fl oz each",24
"Dove Exfoliating Body Polish Body Scrub, Macadamia & Rice Milk, 10.5 oz",5
"Waterpik Sensonic Toothbrush Standard Brush Head, SRRB-3W, 3 count",18
Swiffer Dusters (Pack of 2),12
"Wet Brush Pro Flex Dry, Ombre",5
"Cartridge Carbon Filter Kit for SoClean 2, CPAP Filter Replacement Includes 4 Cartridge Filters and 4 Check Valve (4 Set)",22
Equinox Professional Straight Edge Razor with 100 Single Edge Derby Blades - Close Shaving Men's Manual Shaver Safety,10
"Puracy Natural Dish Soap Refill, Green Tea & Lime, Hand Dishwashing Liquid Detergent, 64 Ounce",19
Hada Labo Tokyo Skin Plumping Gel Cream 1.76 FL OZ - with Super Hyaluronic Acid & Collagen - 24 Hour Moisture & Visible Line Plumping fragrance & paraben free non-comedogenic (Packaging May Vary),19
"HSI PROFESSIONAL Argan Oil Heat Protector | Protect up to 450º F from Flat Irons & Hot Blow Dry | Sulfate Free, Prevents Damage & Breakage | Made in the USA | 2 Ounce, Packaging May Vary",9
Oral-B Pro-Health Stages Disney Princess Power Kid's Toothbrush 1 Count,4
20 Mule Team Borax Laundry Booster 65oz (Pack of 4),17
"Waterpik Cordless Freedom ADA Accepted Oral Irrigator, Battery Operated and Portable for Travel and Home, WF-03",39
"BioOptimal Collagen Powder, Collagen Peptides Grass Fed, Non-GMO Premium Quality Hydrolyzed Collagen Protein, Pasture Raised, Dissolves Easily, 300 Grams",19
"Dry Body Brush - 100% Natural Bristles - Cellulite Treatment, Increase Circulation and Tighten Skin. (Pack of 1)",6
"Jack Black - Pit Boss Antiperspirant & Deodorant 2.75 oz - Sensitive Skin Formula, for Maximum Odor and Sweat Control",19
"Changing Lifestyles Safe-er-Grip 11.5"" Balance Assist Bar",7
"Green Works Multi-Surface Cleaner, Cleaning Spray - Original Fresh, 32 Ounces (Pack of 3)",8
Chattanooga ColPac - Black Polyurethane - Oversize - 12.5 in x 18.5 in,20
"all Powder Laundry Detergent, Free Clear for Sensitive Skin, 52 Ounces, 40 Loads",4
"Hyaluronic Acid Serum 1 oz, 100% Pure Organic HA, Anti Aging Anti Wrinkle, Original Face Moisturizer for Dry Skin and Fine Lines, Leaves Skin Full and Plump ASTERWOOD NATURALS Dropper Bottle",10
"Wet Ones Fresh Scent Anti-Bacterial Wipes, 5-Canister 48 Wipes",13
"OLLY Probiotic + Prebiotic Gummy, 30 Day Supply (30 Gummies), Peachy Peach, Probiotics, Live Cultures, Prebiotic Fiber, Chewable Supplement",13
"NOW Supplements, Ashwagandha (Withania somnifera)450 mg  (Standardized Extract), 90 Veg Capsules",7
Alipotec Raiz de Tejocotes 3 Month Supply 90 Days 100% Authentic Mexican Version,24
Summer's Eve Cleansing Cloths | Lavender | 32 Count | Pack of 1 | pH-Balanced | Dermatologist & Gynecologist Tested,4
"Advanced Collagen Supplement, Type 1, 2 and 3 with Hyaluronic Acid and Vitamin C - Anti Aging Joint Formula - Boosts Hair, Nails and Skin Health - 120 Veggie Capsules - by ForestLeaf",17
"Head and Shoulders Shampoo, Anti Dandruff Treatment and Scalp Care, Classic Clean, 32.1 fl oz, Twin Pack",19
"Medline Toilet Safety Rails, Safety Frame for Toilet with Easy Installation, Height Adjustable Legs, Bathroom Safety",27
"Nature Made Vitamin C 1000mg, 300 Tablets",23
Dickinson’s Original Witch Hazel Pore Perfecting Toner 16 oz,3
"Puracy Natural Dishwasher Detergent Packs, Enzyme-Powered Autodish Tabs, Free & Clear, 50 Count",15
"Herbal Essences Hello Hydration Moisturizing Conditioner with Coconut Essences, 33.8 fl oz (Packaging May Vary)",5
"PhosphatidylSerine 300mg Per Serving, Made in The USA, 120 Capsules (Phosphatidyl Serine Complex) by Double Wood Supplements",19
"Quest Nutrition Vanilla Milkshake Protein Powder, High Protein, Low Carb, Gluten Free, Soy Free, 1.6 Pound",29
"Unisom Sleep Tabs, Nighttime Sleep-Aid, 25 mg Doxylamine Succinate, 48 Tablets",11
"Tom’s of Maine Ice Wicked Fresh! Paste, Natural Toothpaste, Toms Toothpaste, Spearmint, 4.7 Ounce, 2 Pack",10
It's a 10 Haircare (Pack of 1),11
"HUGGIES Refreshing Clean Scented Baby Wipes, Hypoallergenic, 3 Refill Packs (624 Total Wipes)",14
"Philips Sonicare HX6042 Kids Brush Head, Standard",18
"Align DualBiotic Prebiotic + Probiotic Supplement for Adult Men & Women, Digestive Health Gummies in Natural Fruit Flavors, 60 ct",21
"Bronson Vitamin A 10,000 IU Premium Non-GMO Formula Supports Healthy Vision & Immune System and Healthy Growth & Reproduction, 250 Softgels",9
Crest 3D White Professional Effects Whitestrips Teeth Whitening Strips Kit (Pack of 1),38
"Jarrow Formulas Curcumin 95, Provides Antioxidant Support, 500 mg, 120 Veggie Caps",17
"Hear Earwax Remover Kit, Includes: Ear Drops to Soften Ear Wax, Wash Basin, 3 Soft Disposable Tips, Irrigation System to Clean Outer Ear",29
"GLOVEWORKS HD Industrial Black Nitrile Gloves - 6 mil, Latex Free, Powder Free, Diamond Texture, Disposable, Xlarge, GWBN48100-BX, Box of 100",11
"Vive Sock Aid - Easy On and Off Stocking Slider - Donner Pulling Assist Device - Compression Sock Helper Aide Tool - Puller for Elderly, Senior, Pregnant, Diabetics - Pull Up Assistance Help",9
The Body Wipe by ShowerPill - No Shower Wipes for Adults for Post-Workout or Camping Bathing - 10 Individually Wrapped Wipes,9
"PURA D’OR Carrier Oil: Organic Fractionated Coconut Oil 16 oz - USDA Certified Organic 100% Pure & Natural Moisturizing Carrier Oil For Face, Skin, and Hair",12
"Wet Brush Multi-Pack Squirt Detangler Hair Brush with Soft IntelliFlex Bristles, Mini Travel Detangler - Pack of 3 (Pink, Purple, Blue)",12
"Johnson's Baby Oil, Mineral Oil Enriched With Shea & Cocoa Butter to Prevent Moisture Loss, Hypoallergenic, 20 fl. oz",4
"Shut Eye Sleep Aid | Natural Herbal Sleep Supplement Made with Valerian Root, Melatonin, Chamomile, Magnesium | Insomnia and Anxiety Relief | Adult Extra Strength Sleeping Pills | 60 Vegan Capsules",21
"Ever Ready Titanium Bonded Bandage Shears 7 1/4"" Bent, Tactical Stealth Black",6
"Veggie Wash Natural Fruit & Vegetable Wash, 16-Ounce Spray",3
"Always Discreet Incontinence Pads, Extra Heavy Long, 45 Count Pack of 2 (90 Count Total)",37
"Balanced Femme - Herbal PMS and Menopause Support - All-Natural Liquid for 2X Absorption - Vitex, Dong Quai, Maca Root and More",34
"Ambi Skincare Fade Cream, Normal Skin, 2 oz (56 g)",4
"Febreze Plug In Air Freshener Scented Oil Warmer, 4 Count (Oil Not Included)",11
"Cetaphil Pro Eczema Soothing Moisturizer, 10 Ounce",14
"Physix Gear Compression Socks for Men & Women (20-30 mmHg) Best Graduated Athletic Fit for Running, Nurses, Shin Splints, Flight Travel & Maternity Pregnancy - Boost Stamina, Circulation & Recovery",12
"Hefty Ultra Strong Multipurpose Large Black Trash Bags - White Pine, 30 Gallon, 25 Count",31
SEXYHAIR Style Hard Up Hard Holding Gel,7
Trojan Extended Climax Control Lubricated Condoms,28
"Vitamin C Serum for Face 20% with Hyaluronic Acid & Vitamin E, 1 fl. oz.",17
"Vitafusion Extra Strength Vitamin D3 Gummies, 120 Count",10
"Purely Inspired Organic Protein Shake Powder, 100% Plant Based with Pea & Brown Rice Protein (Non-GMO, Gluten Free, Vegan Friendly), French Vanilla, 1.5lbs",169
URPOWER Essential Oil Diffuser 150ml Wood Grain Ultrasonic Aromatherapy Oil Diffuser with Adjustable Mist Mode Waterless Auto Shut-off Humidifier and 7 Color Changing LED Lights for Home Office Baby,19
"Garden of Life Multivitamin for Men - Vitamin Code Men's Raw Whole Food Vitamin Supplement with Probiotics, Vegetarian, 240 Capsules",19
"Centrum Women (250 Count) Multivitamin / Multimineral Supplement Tablet, Vitamin D3",51
"NOW Supplements, Zinc 50 mg, 250 Tablets",19
"Pacific Blue Basic Recycled Hardwound Paper Towel Rolls by GP PRO (Georgia-Pacific), Brown, 26301, 800 Feet Per Roll, 6 Rolls Per Case",7
"Neutrogena Naturals Purifying Daily Facial Cleanser with Natural Salicylic Acid from Willowbark Bionutrients, Hypoallergenic, Non-Comedogenic & Sulfate-, Paraben- & Phthalate-Free, 6 fl. oz",30
"Copper Compression Arthritis Gloves - Guaranteed Highest Copper Content. Best Copper Infused Fit Glove for Women and Men. Carpal Tunnel, Computer Typing, and Everyday Support for Hands (1 Pair)",6
"Mack's Slim Fit Soft Foam Earplugs, 50 Pair - Small Ear Plugs for Sleeping, Snoring, Traveling, Concerts, Shooting Sports & Power Tools",23
"Granite Gold Daily Cleaner Spray And Refill Value Pack - Streak-Free Stone Cleaning Formula, Made In The USA",10
Active Wow Teeth Whitening Charcoal Powder Natural,19
"Proactiv Revitalizing Toner, 6 Ounce (90 Day)",24
"Keto Cheesecake - Delicious Low Carb, Ketogenic Diet Gluten Free Shake Mix – New York Style - 20 Servings",29
TagBand Skin Tag Removal Device for Medium to Large Skin Tags,19
"Curved and Rounded Facial Hair Scissors for Men - Mustache, Nose Hair & Beard Trimming Scissors, Safety Use for Eyebrows, Eyelashes, and Ear Hair - Professional Stainless Steel",8
The Honest Company Purely Simple Fragrance-Free Shampoo + Body Wash | Tear-Free Baby Shampoo with Naturally Derived Ingredients | Sulfate- & Paraben-Free Baby Bath | 10.0 Fl. Ounces,8
"Reusable Straws Telescopic Metal Travel Straws - Anpro Stainless Steel Drinking Straws, Portable Collapsible Straw with Case & Key chain & Cleaning Brush, 2 Pack",11
Vaseline 100% Pure Petroleum Jelly Skin Protectant 3.75 oz (Pack of 2),5
"Majestic Pure Peppermint Essential Oil, Pure and Natural, Therapeutic Grade Peppermint Oil, 4 fl. oz.",17
BulkSupplements CLA Softgels (1000mg) (Conjugated Linoleic Acid) (300 Softgels),20
Colgate Optic White Express White Whitening Toothpaste - 3 ounce (3 Pack),14
"Tampax Pearl Plastic Tampons, Regular Absorbency, Unscented, 50 Count",9
Nature's Bounty B-Complex with Folic Acid Plus Vitamin C,7
"Chemex Bonded Coffee Filter, Circle, 100ct - Exclusive Packaging",171
"GiGi All Purpose Honee Hair Removal Soft Wax for All Skin and Hair Types, 14 oz",12
"Special K Protein Meal Bars, Strawberry, Value Pack, 12 Count",9
"Johnson & Johnson Reach Mint Waxed Dental Floss, 5 Count",10
"1875W Infrared Professional Salon Hair Dryer, Negative Ionic Blow Dryer for Fast Drying, AC Motor Light Weight Hair Blow Dryer with Diffuser & Concentrator & Comb",11
OXO Good Grips Palm Brush Storage Set,39
"Seventh Generation Baby Diapers for Sensitive Skin, Animal Prints, Size 4, 135 Count (Packaging May Vary)",9
"Realistic Ultra-soft Dildo for Beginners with Flared Suction Cup Base for Hands-free Play, PALOQUETH Flexible Dildo with Curved Shaft and Balls for Vaginal G-spot and Anal Prostate Play 6.7 Inch",49
"Nature's Way Dandelion Root; 1,575 mg per Serving, Non-GMO Project Verified Gluten Free Vegetarian; 180 Count",12
"Energizer Rechargeable AA and AAA Battery Charger (Recharge Pro) with 4 AA NiMH Rechargeable Batteries, Auto-Safety Feature, Over-charge Protection - Packaging May Vary",9
"Denman 9 Row Styling Brush, Black, Medium",13
"Radha Beauty Aromatherapy Top 8 Essential Oils 100% Pure & Therapeutic Grade - Basic Sampler Gift Set & Kit (Lavender, Tea Tree, Eucalyptus, Lemongrass, Orange, Peppermint, Frankincense and Rosemary)",18
"CeraVe Baby Cream | 5 Ounce | Gentle Moisturizing Cream with Hyaluronic Acid | Paraben, Sulfate, & Fragrance Free",9
Ms.Remi Deluxe Extra Jumbo Day and Night Cap,5
15 PCS Pearls Hair Clips-Cehomi Fashion Korean Style Acrylic Resin Hair Barrettes Hair Clip Hairpins for Women and Ladies Girls Headwear Styling Tools Hair Accessories,8
"Focus Factor Kids Extra Strength Complete Vitamins: Multivitamin & Neuro Nutrients (Brain Function), Vitamin B12, C, D3, 120 Count, 60 Day Supply",29
"BUG HULL Pill Organizer 2 Times a Day, Arthritis Friendly Twice a Day Weekly Pill Box with Push Open Button, 7 Day AM PM Med Case, Supplement Organizer for Vitamins Fish Oils",10
"Renzo's Iron Strong, Dissolvable Vegan Vitamins for Kids, Zero Sugar, Oh-Oh-Oh Orange Flavor, 90 Melty Tabs",18
"Life Extension Super Bio-Curcumin Turmeric Extract 400mg, 60 Vegetarian Capsules",21
"Babyganics Baby Bubble Bath, Fragrance Free, 20oz Bottle, (Pack of 2)",16
"Nature Made Vitamin D3 2000 IU Softgels, 250 Ct (Package May Vary)",17
Scala Cellulite Massager and Remover Brush Mitt,7
"Dixie Bath Cups Coordinating Designs, 3 oz, 600Count",17
"Wahl Stainless Steel Lithium Ion+ Beard Trimmer for Men, Hair Clippers, Shavers, Nose Ear Trimmers, Rechargeable All in One Men's Grooming Kit - Model 9818",59
"12"" Styrofoam Wig Head - Tall Female Foam Mannequin Wig Stand and Holder - Style, Model And Display Hair, Hats and Hairpieces - For Home, Salon and Travel - by Cantor",7
New York Biology Anti Cellulite Treatment Massage Oil - All Natural Ingredients – Infused with Essential Oils - Penetrates Skin and Targets Unwanted Fat Tissues - 8 oz,14
"Light Face Moisturizer with SPF 25 by Olay Regenerist Whip with Collagen Peptides, Anti-Aging Face Cream, 1.7 Oz",27
Nature's Bounty Cranberry with Vitamin C 4200 mg,10
"Aliceva Black Mask, Blackhead Remover Mask, Charcoal Peel Off Mask, Charcoal Mask, Charcoal Face Mask for All Skin Types with Brush - 50 Gram Pack",237
Acne Pimple Patch Absorbing Cover Blemish (XL Square / 8 PATCHES),15
"Dr. Bronner’s - Pure-Castile Liquid Soap (Baby Unscented, 32 Ounce, 2-Pack)",8
"Ensure Plus Nutrition Shake with Fiber, 13g High-Quality Protein, Meal Replacement Shakes, Vanilla, 8 fl oz, 24 count",29
"Pure Kojic Acid Skin Lightening Soap For Hyperpigmentation, Dark Spots, Sun Damage, Uneven Skin Tone (2.82 oz / 2 Bars)",39
"TIGI Catwalk Curls Rock Amplifier, 5.07 Oz",9
"Sunwarrior - Warrior Blend, Plant Based, Raw Vegan Protein Powder with Peas & Hemp, Vanilla, 30 Servings",8
"Earth's Natural Alternative ECOP001pk50 Disposable Plates, 50 count, Light Brown",3
"Swiffer Sweeper Dry Mop Pad Refills for Floor Mopping and Cleaning, All Purpose Floor Cleaning Product, Lavender Vanilla and Comfort Scent, 52 Count",11
O-Cedar Easywring Microfiber Spin Mop & Bucket Floor Cleaning System with 3 Extra Refills,39
"Zarbee's Naturals Baby Multivitamin with Iron, Natural Grape Flavor, Contains vitamins A, C, D for Babies Ages 2 Months and Up, 2 Ounce Bottle",5
"Aveeno Positively Nourishing Antioxidant Infused Body Wash with White Peach & Ginger, Lightly Scented Daily Nourishing Body Wash, 16 fl. oz",5
"Doctor's Best Curcumin from Turmeric Root, Non-GMO, Gluten Free, Soy Free, Joint Support, 500mg Caps with C3 Complex & BioPerine, 120 Capsules",23
"Yes To Cucumbers Soothing Hypoallergenic Facial Wipes for Sensitive Skin, 30 Count (Pack of 2)",7
Blackhead Remover Mask Activated Charcoal Peel Off Black Mask for All Skin Types Deep Cleansing Pore & Acne by Nimiah,8
"Medline Skin integrity Wound Cleansers, 16 fl oz.",11
L'Oreal Paris Skincare Men Expert VitaLift Anti-Wrinkle & Firming Face Moisturizer with Pro-Retinol 1.6 fl. oz.,8
Gillette Venus Extra Smooth Sensitive Women's Razor Blades - 6 Refills,24
"RENPHO Bluetooth Body Fat Scale, Weight Scale Digital Bathroom Smart Body Composition Analyzer Wireless BMI Scale Health Monitor with Smartphone APP, 396 lbs/180kg",19
"Gillette Mach3 Men's Razor Blades, 4 Blade Refills",7
"Neutrogena Clear Face Liquid Lotion Sunscreen for Acne-Prone Skin, Broad Spectrum SPF 55, Oil-Free and Fragrance-Free, 3 fl. oz",10
"TheraBand FlexBar, Tennis Elbow Therapy Bar",12
"BlenderBottle Classic Loop Top Shaker Bottle, 28-Ounce 2-Pack, Colors May Vary",15
"Softsoap(TM) Moisturizing Liquid Soap with Aloe Vera, 1 Gallon",10
"Withings | Body+ - Smart Body Composition Wi-Fi Digital Scale with smartphone app, Black",99
Hiware Window Blind Cleaner Duster Brush with 5 Microfiber Sleeves - Blind Cleaner Tools for Window Shutters Blind Air Conditioner Jalousie Dust,7
"Listerine Smart Rinse Kids Alcohol-Free Fluoride Mouthwash, Incredibles 2, Bubble Gum, 500 mL",3
"Neutrogena Ultra Gentle Hydrating Daily Facial Cleanser for Sensitive Skin, Oil-Free, Soap-Free, Hypoallergenic & Non-Comedogenic Creamy Face Wash,12 fl. oz",8
"It's A 10 Miracle Leave-In Product, 10 fl oz",23
Silk18 Natural Hair Conditioner Argan Oil Sulfate Free Treatment for Dry and Damaged Hair Silk Amino Acids Jojoba & Keratin All Hair Types Women & Men & Teens Safe for Color Treated Hair 8 Ounce,9
Duracell – AAAA 1.5V Specialty Alkaline Battery – long-lasting battery – 2 count,4
ULG Hair Thinning Scissors Cutting Teeth Shears Professional Barber Hairdressing Texturizing Salon Razor Edge Scissor Japanese Stainless Steel with Detachable Finger Ring 6.5 inch,10
"Cottonelle Ultra GentleCare Toilet Paper with Gentle CleaningRipples, 24 Family Mega Rolls, Sensitive Bath Tissue with Aloe & Vitamin E",29
"Gain Smart Pouch Liquid Laundry Detergent, Original, 48 Fluid Ounce (Pack of 3)",19
"Natrogix Nirvana Essential Oils - Top 18 Essential Oil Set 100% Pure Therapeutic Grade 18/10ml Incl. Lavender, Moroccan Rosemary, Tea Tree, Eucalyptus, Lemongrass and 13 More w/Free E-Book",34
"Woolite Clean & Care Liquid Laundry Detergent, 66 Loads, 100oz, Regular & HE Washers, Gentle Cycle, sparkling falls scent, packaging may vary",14
OXO Good Grips Stainless Steel Squeegee,13
"Power Crunch Protein Energy Bar, Chocolate Mint, 1.4-Ounce Bars, 12 Count",16
"Centrum Men (250 Count) Multivitamin / Multimineral Supplement Tablet, Vitamin D3",20
"SlimFast Keto Meal Replacement Shake Powder, Vanilla Cake Batter, 12.2 Ounce, Pack of 1",16
"Puritans Pride Qsorb Co Q10 100 mg Rapid Release Softgels, 240 Count",17
Johnny B Mode Styling Gel (16 ounce),12
Hair Scrunchies Velvet Elastic Hair Bands Bobbles Scrunchy Ties Ropes Scrunchie Accessories Ponytail Holder for Women or Girls,9
Hair Scrunchies Velvet Elastic Hair Bands Bobbles Scrunchy Ties Ropes Scrunchie Accessories Ponytail Holder for Women or Girls,9
Kyolic Garlic Formula 100 Original Cardiovascular Formula (300 Capsules),22
"Clorox Automatic Toilet Bowl Cleaner Tablets, Bleach & Blue - Rain Clean - 4 Count",8
Dove Men+Care Hair Styling Sculpting Paste 1.75 oz,4
"KEYLOR NUTRITION Premium Hemp Gummies – 30000 MG – All Natural Ingredients - Relief for Stress, Inflammation, Sleep, Anxiety, Depression – Vitamins & Omega 3,6,9 – Made in the USA - 90 pcs",30
"Eye Mask for Dry Eyes, Moist Heat Eye Compress Pad for Pink Eye, Blepharitis, Puffy Eyes, MGD, Stye Treatment Relief | Microwaveable Warm Compress for Eyes | Washable & Reusable with Storage Pouch",15
"Cetaphil Baby Gentle Wash with Organic Calendula, 7.8 Oz",4
"Garnier Fructis Pure Clean Shampoo, Paraben-Free Silicone-Free with Aloe Extract and Vitamin E, 12.5 Ounce Bottle",2
"NOW Supplements, 5-HTP 100 mg, 120 Veg Capsules",15
"[TashiBox] 3 oz white paper bath cups, 200 count (200)",10
"Simple Sensitive Skin Experts Kind To Skin Cleansing Facial Wipes, Waterproof Mascara Remover, Even Softer, 25 Count, (4 Pack)",13
"Georgia-Pacific Professional Series Premium 1-Ply Multifold Paper Towels by GP PRO (Georgia-Pacific), White, 2212014, 250 Towels Per Pack, 8 Packs Per Case",23
"POWERLIX Compression Knee Sleeve - Best Knee Brace for Men & Women – Knee Support for Running, Basketball, Weightlifting, Gym, Workout, Sports – Please Check Sizing Chart",17
"Waterpik Whitening Water Flosser Refill Tablets (Only compatible with Waterpik Whitening Flosser), 30 Count",18
"PURELL Hand Sanitizing Alcohol Formula Wipes, Fragrance Free, 300 Count Individually Wrapped Portable Wipes Packets (Pack of 300) – 9020-06-EC",7
"#LubeLife Strawberry Flavored Oral Use Personal Lubricant, 8 oz Sex Lube for Men, Women and Couples",14
"Goworth Large Bath Shower Sponge Pouf Loofahs 4 Packs 60g Each Eco-friendly Exfoliating Mesh Brush Pouf Bath Shower Ball Sponge 4 Colors-Exfoliate, Cleanse, Soothe Skin",8
Body Glide Original Anti-Chafe Balm,5
Nerdwax Stop Slipping Glasses as Seen on Shark Tank,14
"Coppertone Ultra Guard Sunscreen Lotion Broad Spectrum SPF 70, 8 Fluid Ounces",10
"Clorox Handi Wipes Multi-use Reusable Cloths, 72 Ct",7
"Parodontax Bleeding Gums and Gingivitis Toothpaste, Whitening, 3.4 Ounce (Pack of 3)",13
Dove Purely Pampering Coconut Milk with Jasmine Petals Body Wash 500ML (3 pack) International Version ,16
"K-Y Jelly Premium Water Based Lube- Personal Lubricant Safe To Use With Latex Condoms, Devices, Sex Toys and Vibrators, 4 oz.",14
"Prime Beard Beard Growth Vitamins Supplement for Men - Thicker, Fuller, Manlier Hair - Scientifically Designed Pills with Biotin, Collagen, Zinc & More! - for All Facial Hair Types - Veggie Capsules",22
"Always Ultra Thin Feminine Pads with Wings for Women, Size 2, Super Absorbency, Unscented, 42 Count - Pack of 3 (126 Count Total)",19
"Hallmark All Occasion Reversible Wrapping Paper (Modern Metallics, Pack of 3, 120 sq. ft. ttl.) for Birthdays, Bridal Showers, Baby Showers, Christmas, Friendsmas and More",7
Feather Styling Razor Disposal Case,3
"Windex Outdoor Glass & Patio Concentrated Cleaner, 2 ct, 32 fl oz",16
"Genuine Philips Sonicare DiamondClean replacement toothbrush heads, HX6062/65, BrushSync technology, White 2-pk",26
"NOW Supplements, MSM (Methylsulfonylmethane)1000 mg, 240 Veg Capsules",14
