product_description,product_price
"RespLabs CPAP Hose, Black-Out Tubing — The Original Universal 6 ft. Tube | Compatible with Respironics and ResMed Devices",9
Phillips' Laxative Caplets (100-Count Box),15
"The Laundress - Delicate Wash, Lady Scented, Laundry Detergent for Delicates, Care for Fabric, Silk, Synthetics and Blends, Allergen-Free, 16 fl oz, 32 washes",18
"21st Century Vitajoy Melatonin Gummies, Strawberry, 120 Count",7
"Clairol Nice 'n Easy Root Touch-Up 4 Matches Dark Brown Shades 1 Kit, (Pack of 2)",9
"NOW Supplements, Certified Organic and Non-GMO, Inulin Powder, 8-Ounce",6
"Palmer's Coconut Oil Formula with Vitamin E Body Lotion, 13.5 Ounces",4
"Barlean’s Seriously Delicious Omega-3 Fish Oil, Mango Peach Smoothie, 16oz",20
"AXE  Phoenix Antiperspirant Deodorant Stick for Men 2.7 oz, 4 count",15
"INFINITIPRO BY CONAIR Curl Secret, Purple",48
"Flex Menstrual Discs - Customer Choice for Uncomfortable Periods - 12 Hour Wear, No Wash - Reduces Waste vs Tampons - Prevents Leaks and Odor - Hypoallergenic - Body Safe - Not Linked to TSS",19
"3M Steri-Strip reinforced Skin Closures - 1/2"" x 4"" - 10 pack of 6 strip envelope (60 strips)",5
Mederma Scar Cream Plus SPF 30 (20 g),16
"Nutricost Tudca 250mg, 60 Capsules (Tauroursodeoxycholic Acid) - Premium Quality",29
"Nobi Nutrition Night Time Fat Burner, Sleep Aid an Appetite Suppressant - Stimulant-Free PM Weight Loss Pills & Metabolism Booster for Men and Women - Healthier Diet Pills - 60 Capsules",17
"Focus Factor Extra Strength - Memory, Concentration & Focus - DMAE, Vitamin D, DHA, Bacopa & Much More - Trusted Clinically Tested Brain Health Supplement (120 Count)",29
"Pink Stork Fertility Tea: Sweet Mint Tea, USDA Organic Loose Leaf in Biodegradable Sachets, Hormone Balance, and Cycle Regulation -Support Fertility Naturally, Drug-Free -30 Cups, Caffeine Free",11
Biore UV Aqua Rich Watery 85 g (1.7 times the normal product) Sunscreen SPF 50 + / PA ++++【Large capacity】,13
"Palmer's Cocoa Butter Formula Moisturizing Skin Therapy Oil for Face with Vitamin E, Rosehip Fragrance ,1 Ounce",7
"Nature's Bounty Vitamin D3 Pills and Supplement, Supports Bone Health and Immune System, 2000iu, 350 Softgels",11
"Mario Badescu Skin Care Facial Spray with Aloe,Cucumber And Green Tea",7
Shea Moisture African Black Soap With Shea Butter 8 oz,4
"IF YOU CARE Unbleached Sandwich Bags, 48 Count",3
"Aveeno Skin Relief 24-Hour Moisturizing Lotion for Sensitive Skin with Natural Shea Butter & Triple Oat Complex, Unscented Therapeutic Lotion for Extra Dry, Itchy Skin, 18 fl. oz",8
"Free & Clear Set, includes Shampoo-12 Oz and Conditioner-12 Oz - One each.",21
"Nicorette Nicotine Gum to Quit Smoking, 2 mg, White Ice Mint Flavored Stop Smoking Aid, 160 Count",52
Med Spec ASO Ankle Stabilizer,19
"NOW Supplements, Ultra Omega-3 Molecularly Distilled and Enteric Coated, 180 Softgels",123
Ultra High Purity Resveratrol Capsules - 98% Trans-Resveratrol - Support for Anti Aging and Immune Health - 60 Caps Reservatrol Supplement,21
"Bona Multi-Surface Floor Microfiber Cleaning Pads, 3 Pack",12
"ASUTRA Natural & Organic Yoga Mat Cleaner (Peaceful Lavender Aroma), 4 fl oz | Safe for All Mats & No Slippery Residue | Cleans, Restores, Refreshes | Comes w/ Microfiber Cleaning Towel",10
"Dreft Stage 1: Newborn Liquid Laundry Detergent (HE),Natural for Baby, Newborn, or Infant, 50 oz, 32 loads",10
IT JUST Works! Grout-EEZ Super Heavy Duty Tile & Grout Cleaner and brightener. Quickly Destroys Dirt & Grime. Safe for All Grout. Easy to Use. 2 Pack with Free Stand-Up Brush. The Floor Guys,39
"Hicarer Pack of 1000 Mini Rubber Bands Soft Elastic Bands for Kids Hair, Braids Hair, Wedding Hairstyle and More (Black)",5
"COSRX Advanced Snail 96 Mucin Power Essence (Renewal), 100ml / 3.38 fl.oz",16
"Scott Shop Towels Original (75147), Blue, 55 Sheets/Standard Roll, 12 Rolls/Case, 660 Towels/Case",26
"DIM Supplement 300mg - Extra Strength DIM (Diindolylmethane) + 5mg BioPerine 60-Day Supply Provides Estrogen Balance, Hormone Menopause Relief, Treatment of Acne & PCOS",19
"JINRI 1875W Professional Salon Grade Hair Dryer,DC Motor Negative Ionic Blow Dryer with 2 Speed 3 Heat Settings Cool Button,Concentrator & Diffuser Attachments",31
"Dawn Pure Essentials Dishwashing Liquid Dish Soap (3x24oz) + Non-Scratch Sponge (2ct), Lemon Essence, 1 Set",15
"D&H Medical 24 Bulk Pack Gauze Stretch Bandage Roll, 4 Inch X 4 Yards FDA Approved, Used for Wound Care, Easy To Use Cotton Ply Rolled Hand Wrap Dressing Ankles & Knees. Add To First Aid Supplies.",14
"Slimfast Keto Meal Replacement Powder Fudge Brownie Batter Canister, 13.4 oz, Pack of 1",18
"Hair Spray Bottle, Segbeauty Continuous Water Mister for Curly Hair Empty Ultra Fine Aerosol Water Mist Trigger Sprayer for Taming Hair in Morning, Hairstyling, Plants, Cleaning- 5.4oz/160ml",14
"iLC RGB LED Light Bulb, Color Changing Light Bulb Dimmable 3W E26 Screw Base RGBW, Mood Light Flood Light Bulb - Dual Memory - 12 Color Choices - Timing Infrared Remote Control Included (4 Pack)",17
Evolve Exotics Satin Sunset Bonnet,3
60 Pcs Silk Satin Hair Scrunchies Set for Women Strong Elastic Hair Bobbles for Ponytail Holder Colorful Hair Accessories Ropes Scrunchy Solid Color Traceless Hair Ties,16
"Dr Teal's Epsom Salt Bath Soaking Solution, Eucalyptus and Lavender, 2 Count, 3lb Bags - 6lbs Total",16
"Dove Beauty Bar, White 4 oz, 2 Bar",2
"NOW Supplements, L-Arginine 500 mg, Amino Acid, 250 Capsules",12
"Garden of Life Vegetarian Omega 3 6 9 Supplement - Raw CoQ10 Chia Seed Oil Whole Food Nutrition with Antioxidant Support, 60 Capsules",26
MARLOWE. No. 102 Men's Body Scrub Soap 7 oz | Best Exfoliating Bar for Men | Made with Natural Ingredients | Green Tea Extract | Amazing Scent,7
"Australian Gold Moisture Lock Tan Extender Moisturizer Lotion, Enriched with Aloe & Vitamin E, 16 Ounce",7
"Amazon Brand - Solimo Body Wash, Cool Mist Scent, 21 Fl Oz (Pack of 1)",3
DivaCup Model 2 Menstrual Cup,26
DevaCurl Wave Maker 5oz,20
"Gillette SkinGuard Men's Razor for Sensitive Skin, Handle + 4 Refills",19
"HoMedics Percussion Action Massager with Heat | Adjustable Intensity , Dual Pivoting Heads | 2 Sets Interchangeable Nodes , Heated Muscle Kneading for Back , Shoulders , Feet , Legs , & Neck",36
Gillette Venus ComfortGlide plus Olay Coconut Women's Razor Blades - 4 Refills,19
"Emergen-C (30 Count, Pink Lemonade Flavor, 1 Month Supply) Dietary Supplement Fizzy Drink Mix with 1000mg Vitamin C, 0.33 Ounce Powder Packets, Caffeine Free",9
Microfiber Glass Cleaning Cloths - 8 Pack | Lint Free - Streak Free | Quickly and Easily Clean Windows & Mirrors Without Chemicals,13
"[KLAIRS] Supple Preparation Facial Toner, toner, moisturizer, without paraben and alcohol, 180ml, 6.08oz",15
"Loofah Bath and Shower Sponge Pouf,Mesh Brush Ball Exfoliating Body Scrubber Ball Pack of 4（60g/pcs）",6
"Gillette Fusion ProGlide Men's Razor Blade Refills, 4 Count, Mens Razors/Blades",16
"Fresh Wave Odor Removing Spray, 8 fl. oz. (Pack of 2) …",15
"Zero Glow Teeth Whitening Kit Carbamide Peroxide Syringes, Light, Trays",5
"Finish Jet-Dry Rinse Aid, 32oz, Dishwasher Rinse Agent & Drying Agent",13
"Tide Free and Gentle HE Liquid Laundry Detergent, 2 Pack of 50 oz., Unscented and Hypoallergenic for Sensitive Skin, 64 Loads",12
"GoGirl Female Urination Device + Germ Resistant Portable Urinals for Women, Camping, Hiking, Outdoor Activities & More with Medical Grade Silicone (Reusable) - Pink/Lavender",9
"Joico Color Balance Purple Shampoo, 10.1 Ounce",9
"TechWare Pro Knee Brace Support - Relieves ACL, LCL, MCL, Meniscus Tear, Arthritis, Tendonitis Pain. Open Patella Dual Stabilizers Non Slip Comfort Neoprene. Adjustable Bi-Directional Straps - 4 Sizes",21
"Scivation Xtend BCAA Powder, 7g BCAAs, Branched Chain Amino Acids, Keto Friendly, Watermelon Explosion, 30 Servings. Packaging May Vary",27
"Goody Hair Women's Ouchless 2 mm Hair Elastics, Black, 29 Count",24
"Redken Brews Molding Paste For Men, High Hold, Natural Finish , 3.4 fl. oz",3
"Tart Cherry Extract Capsules with Celery Seed - Advanced Uric Acid Cleanse for Joint Comfort, Healthy Sleep Cycles & Muscle Recovery - Potent Polyphenols Supplement - 60 Veggie Capsules.",14
"Maybelline New York Baby Lips Moisturizing Lip Balm, Cherry Me, 0.15 oz.",14
"X3 Industrial Black Nitrile Gloves - 3 mil, Latex Free, Powder Free, Textured, Disposable, Large, BX346100-BX, Box of 100",2
AXE  Phoenix Body Wash for Men 16 Fl Oz (4 Count),8
"Replacement Toothbrush Heads Compatible with Philips Sonicare DiamondClean, FlexCare, HealthyWhite Electric Toothbrush, 10 Pack",11
"Replacement Toothbrush Heads Compatible with Philips Sonicare DiamondClean, FlexCare, HealthyWhite Electric Toothbrush, 10 Pack",12
FANDAMEI 4 pieces Light Brown Stocking Wig Caps Stretchy Nylon Wig Caps for Women,4
"Carpet Miracle - Concentrated Machine Shampoo, Deep Stain and Odor Remover Solution, Deodorizing Formula (32FL OZ)",19
"Ed Hardy Coconut Kisses Golden Tanning Lotion, 13.5 oz",17
"DUDE Face & Body Wipes (3 Packs, 30 Wipes Each) Energizing & Refreshing Scent Infused with Pro Vitamin B-5, Face Cleansing Cloths for Men, Lightly Scented, Hypoallergenic, Alcohol Free",14
Gillette Sensor Razor Refill Cartridges 20 count (2x10 Pack),22
"Divine Derriere Intimate Skin Lightening Gel for Body, Face, Bikini and Sensitive Areas - Skin Whitening Cream Contains Mulberry Extract, Arbutin, B-White Peptide 30ml / 1 oz.",23
"U By Kotex Cleanwear Ultra Thin Pads with Wings, Heavy Flow, 64 Count",13
"BagDream Gift Bags 8x4.25x10.5 50Pcs Paper Bags, Shopping Bags, Kraft Bags, Retail Bags, Party Bags, Brown Paper Gift Bags with Handles Bulk",14
"Diapers Size 4, 128 Count - Pampers Baby Dry Disposable Baby Diapers, Giant Pack",39
NAD's Nose Wax for Men & Women 1.6 oz,17
Energizer A23 12v Alkaline Batteries (Pack of 5),4
"Cottonelle Flushable Wet Wipes, 42 Wipes per Pack",12
Cora Organic Cotton Tampons with BPA-Free Plastic Compact Applicator; Chlorine & Toxin Free - Variety Pack - Regular/Super (36),15
"Baseboard Buddy – Baseboard & Molding Cleaning Tool! Includes 1 Baseboard Buddy and 3 Reusable Cleaning Pads, As Seen on TV",13
"Amope Pedi Perfect Electronic Foot File Dry Foot File, Callous Remover for Feet, Hard and Dead Skin- Regular Coarse, Blue. Battery Operated.  Batteries Included. Baby Smooth Feet in Minutes.",19
AZO Bladder Control with Go-Less® & Weight Management Dietary Supplement |  Safely Helps Reduce Occasional Urgency* | Promotes Healthy Metabolism* | Supports a Good Night’s Sleep* | 48 Capsules,16
"Arm & Hammer Clean Scentsations In-Wash Freshness Booster, Odor Blaster, 37.8 Ounce",6
"Remington HC4250 Shortcut Pro Self-Haircut Kit, Beard Trimmer, Hair Clippers for Men (13 pieces)",47
"Simba Baby Safety Nail Scissors, Yellow",6
"Peter Rabbit Organics Strawberry and Banana  Pure Fruit Snack, 4 Ounce Squeeze Pouch (Pack of 10)",15
"Clitoral Sucking Vibrator with 10 Intensities Modes for Women, Adorime Waterproof Rechargeable Quiet Clitoris Nipples Suction Stimulator Adult Sex Toys for Couples or Solo",24
"JEFlex Natural Silk Sleep Mask Blindfold, Super-Smooth Eye Mask",5
"OLLY Kids Multi + Probiotic Gummy Multivitamin, 35 Day Supply (70 Gummies), Yum Berry Punch, Vitamins A, C, D, E, B, Zinc, Probiotics, Chewable Supplement",12
"NOW Sports Nutrition, ZMA (Zinc, Magnesium and Vitamin B-6), 180 Capsules",18
Wahl Professional Five Star Series #7031-100 Replacement Foil and Cutter Bar Assembly – Red & Gold – Super Close,18
"UNNI ASTM D6400 100% Compostable Trash Bags, 3 Gallon, 11.35 Liter, 100 Count, Extra Thick 0.71 Mils, Food Scrap Small Kitchen Trash Bags, US BPI and Europe OK Compost Home Certified, San Francisco",12
Caffeine with L-Theanine for Smooth Energy & Focus - Focused Energy for Your Mind & Body - No Crash ▫ No Jitters - #1 Nootropic Stack for Cognitive Performance - Veggie Capsules,10
10 Pack - Easy@Home Marijuana (THC) Single Panel Drug Tests Kit - Individually Wrapped Single Panel THC Screen Urine Drug Test Kit with 50 ng/ml Cutoff Level - EDTH-114,7
"Gillette Daisy Womens Disposable Razor, 18 Count",12
250 Clear Plastic Cups | 9 oz Plastic Cups | Clear Disposable Cups | PET Cups | Clear Plastic Party Cups | Crystal Clear Plastic Cups,16
"Fractionated Coconut Oil - 16oz (Ounce) Bottle (100% Pure & Natural) - Perfect Carrier Oil for Diluting Essential Oils - Work Great as a Massage Oil, Skin Moisturizer, and More!",9
TYME Iron Pro 2- in -1 Hair Curler and Straightener,169
"Etekcity High Precision Digital Body Weight Bathroom Scale with Ultra Wide Platform and Easy-to-Read Backlit LCD, 440 Pounds",26
"Heliocare Skin Care Dietary Supplement: 240mg Polypodium Leucotomos Extract Pills - All Natural, Antioxidant Rich Formula Derived from Nature with Fernblock and PLE Technology - 60 Veggie Capsules",27
"Evlution Nutrition Mens Multivitamin, VitaMode, High Performance Daily Vitamin Support (60 Servings)",19
"PURELL Hand Sanitizing Wipes, Clean Refreshing Scent, 20 Count Non-Alcohol Sanitizing Wipes Resealable Travel Pack (Pack of 6) – 9124-09-EC",11
"Nature's Bounty Absorbable Calcium 1200mg, Plus 1000IU Vitamin D3",17
"Heritage Store Rosewater with Glycerin | No Alcohol, 100% Pure Vegan | Benefits Skin, Hair & More | Facial Toner & Moisturizer | Mist Spray | 8 ounces",185
"Qunol Liquid CoQ10 100mg, Superior Absorption Natural Supplement Form of Coenzyme Q10, Antioxidant for Heart Health, Orange Pineapple Flavored, 60 Servings, 20.3 oz Bottle",8
"Arm & Hammer Odor Busterz Balls, 3 Pack",22
"Jarrow Formulas Magmind, Supports Cognition, 90 Count",5
"Panasonic Electric Body Hair Trimmer  and Groomer for Men ER-GK60-S, Cordless, Wet/Dry with 3 Comb Attachments, Washable",26
Opalescence Go 15%,65
Energizer 377/376 Silver Oxide 10 Batteries,67
"Vive Loofah Sponge Back Scrubber - Men & Women Long Handled Exfoliating Bath & Shower Body Brush - Handheld Luffa Pouf on a Stick for Body, Face Washing - Spa Wash Lufa",5
"Cetaphil Pro Soothing Wash, 10 Ounce",12
"NOW Supplements, Omega 3-6-9 1000 mg with a blend of Flax Seed, Evening Primrose, Canola, Black Currant and Pumpkin Seed Oils, 250 Softgels",13
"NOW Supplements, Omega 3-6-9 1000 mg with a blend of Flax Seed, Evening Primrose, Canola, Black Currant and Pumpkin Seed Oils, 250 Softgels",11
[Upgraded 2019 Algorithm] iProven Oral Thermometer for Fever - Adult Fever Thermometer - Readings in 20 Seconds - Flexible and Hygienic Waterproof Tip - Smileys for Fever Indication,12
"Neutrogena Hydro Boost Hydrating Hyaluronic Acid Serum, Oil-Free and Non-Comedogenic Formula for Glowing Complexion, 1 fl. oz",14
Glad OdorShield Small Drawstring Trash Bags - Febreze Beachside Breeze - 4 Gallon - 80 Count,11
"Huggies Little Snugglers Baby Diapers, Size Newborn (up to 10 lb.), Big Pack, 72 Count (Packaging May Vary)",19
New Chapter Joint Supplement + Herbal Pain Relief - Zyflamend Whole Body for Healthy Inflammation Response - 120 ct,42
"Always Xtra Protection Daily Liners, Long, 40 Count",3
Crave Naturals Glide Thru Detangling Brush - Pink/Black,10
Gillette Venus Extra Smooth Green Women's Razor  - 1 Handle + 2 Refills (Packaging May Vary),10
"L'Oréal Paris Elvive Extraordinary Clay Rebalancing Shampoo, 12.6 fl. oz. (Packaging May Vary)",2
"Bissell Destroyer Pet Plus, 1773, 22 oz Oxy Stain Pretreat, 22 Fl Oz",5
"Now Supplements, DHA-500, Molecularly Distilled, 180 Softgels",22
"Bioré Blackhead Removing and Pore Unclogging Deep Cleansing Pore Strip with Natural Charcoal, 18 Count",13
"[2019] One-Step Hair Dryer & Volumizer Hot Air Brush, 3-in-1 Hair Dryer Brush Styler for Straightening, Curling, Salon Negative Ion Ceramic Lightweight Blow Dryers Straightener Curl Hair Brush",39
CHI Air Spin N Curl Products,109
"PURA D’OR Advanced Therapy System - Biotin Shampoo & Conditioner Increases Volume, Strength & Shine, Sulfate Free, Made with Argan Oil, All Hair Types, Men & Women, 16 fl oz (Packaging may vary)",39
MITCH Clean Cut Styling Hair Cream,18
"The Doctor's BrushPicks Interdental Toothpicks, Helps Fight Gingivitis, 275 Count, Pack of 4",13
Moroccanoil Moisture Repair Shampoo,24
"Duracell - Rechargeable AAA Batteries - long lasting, all-purpose Triple A battery for household and business - 4 count",10
"Dynarex Disposable Underpad, 17 X 24 Inches, 100 Count",15
Summer's Eve Cleansing Wash | Blissful Escape | Gynecologist Tested | 15 fl oz,4
"Gillette Mach3 Turbo Men's Razor Blades, 15 Blade Refills (Packaging May Vary)",24
"Secret Antiperspirant and Deodorant for Women, Fresh Clear Gel, Summer Berry Scent, 5.2 Ounce (Pack of 1)",8
"NOW Supplements, Bromelain (Natural Proteolytic Enzyme)500 mg, 120 Veg Capsules",16
"Suave Essentials Body Wash, Ocean Breeze 15 Fl Oz (Pack of 6)",9
"Green Works Toilet Bowl Cleaner, Toilet Gel Cleaner - 24 Ounces (Pack of 4)",11
"Majestic Pure Himalayan Salt Body Scrub with Lychee Essential Oil, All Natural Scrub to Exfoliate & Moisturize Skin, 10 Ounce (Pack of 1)",13
"Always Ultra Thin Feminine Pads for Women, Size 2, Super Absorbency, Unscented, 40 Count - Pack of 3 (120 Count Total) (Packaging May Vary)",16
"Aveeno Baby Eczema Therapy Moisturizing Cream with Natural Colloidal Oatmeal for Eczema Relief, 7.3 oz",11
"Neutrogena Oil Free Daily Long Lasting Facial Moisturizer & Neck Cream - Oil Free Moisturizer Won't Clog Pores with SPF 35 Sunscreen, Glycerin, 2.5 Fl. Oz",8
"High Absorption Magnesium for Leg Cramps and Sore Muscles, Restless Leg Syndrome Relief (RLS), Muscle Relaxer with Vitamin B6, D and E, 380mg Magnesium Oxide Monohydrate, 60 Servings",14
"BISSELL DeepClean + Refresh with Febreze Freshness Spring & Renewal Formula, 1052A, 60 ounces",17
Meihejia 6 Pack Automatic Bathroom Toilet Bowl Cleaner Tablets,11
"Handcraft Fractionated Coconut Oil - 100 Percent Pure and Natural - Premium Therapeutic Grade Carrier Oil for Aromatherapy, Massage, Moisturizing Skin and Hair - 16 oz",13
"Neutrogena Age Fighter Anti-Wrinkle Face Moisturizer for Men, Daily Oil-Free Face Lotion with Retinol, Multi-Vitamins, and Broad Spectrum SPF 15 Sunscreen, 1.4 oz",9
"Barlean’s Omega Pals Fish Oil, Chirpin’ Slurpin’ Lemonade, 8-oz, Packaging may Vary",11
LiCB 40 Pack LR44 AG13 357 303 SR44 Batteries 1.5V Button Coin Cell Battery,6
"Green Gobbler SYNCHKG121210 BIO-Flow Strips-12 (Drain Cleaner & Deodorizer), 12 Pac",5
"Medpride Disposable Underpads 17'' x 24'' (100-Count) Incontinence Pads, Bed Covers, Puppy Training | Thick, Super Absorbent Protection for Kids, Adults, Elderly | Liquid, Urine, Accidents",15
"Ice Cold Pack Ohuhu Reusable Ice Bag Hot Water Bag for Injuries, Hot & Cold Therapy and Pain Relief, 3-Pack, 3 Sizes (6""/9""/11"")",11
"DuraComfort Essentials Super Absorbent Anti-Frizz Microfiber Hair Towel, Large 41 x 19-Inches",10
"Collagen Peptides Hydrolyzed Protein Powder 18oz - Supplement for vital Joint & Bone Support, Glowing Skin, Strong Hair & Nails, Digestive Health - Unflavored, Hormone-free, Grass Fed & Pasture Raised",27
CeraVe Vitamin C Serum with Hyaluronic Acid | Skin Brightening Serum for Face with 10% Pure Vitamin C | Fragrance Free | 1 Fl. Oz,19
"Colgate Kids Toothpaste with Anticavity Fluoride, Minions, 4.6 ounces (4 Pack)",8
"Beard Straightener for men, Multifunctional Hair Styler Electric Hot Comb and Beard Straightening Brush Hair Straightening Comb with Dual Voltage 110-240V Great for Travel & Mens Stocking Stuffers",19
Bariatric Once-A-Day Multivitamin 90 Ct Capsule-45mg Iron Made for Gastric Bypass Sleeve WLS Surgery,45
"Scrubbing Bubbles Toilet Cleaning Gel Starter Kit, Glade Rainshower, 2 Pack, 6 ct, 1.34 oz",7
DivaCup DivaWash® Natural DivaCup Cleaner -- 6 fl oz,8
"Garden of Life Iron Supplement - Vitamin Code Healthy Blood Raw Whole Food Vitamin, Vegan, 60 Capsules",11
"Tweezerman, Tweezers Mini Slanted Flamingo Pink, 1 Count",9
"Carpe Underarm Antiperspirant and Deodorant, Clinical strength with all-natural eucalyptus scent, Manage hyperhidrosis and combat excessive sweating without irritation, Stay fresh and dry all day long",19
"Diapers Newborn / Size 1 (8-14 lb), 140 Count - Pampers Swaddlers Disposable Baby Diapers, Giant Pack",33
Certain Dri Everyday Strength Clinical Antiperspirant Deodorant | Effective All Day Protection Against Odor and Sweat | Solid | 2.6 Ounces,6
"Pur360 Tamanu Oil - Pure Cold Pressed - Best Treatment for Psoriasis, Eczema, Acne Scar, Foot Fungus, Rosacea - Relief for Dry, Scaly Skin, Scalp and More",14
"Finishing Touch Flawless Body Rechargeable Ladies Shaver and Trimmer, White/Rose Gold",29
"RENPHO Shiatsu Foot Massager Machine with Heat, Deep Kneading Therapy, Air Compression, Relieve Foot Pain from Plantar Fasciitis, Improve Blood Circulation, Fits feet up to Men Size 12- Panel Control",103
"Howard Products BBB012 Cutting Board Oil, 12 oz",6
"One A Day for Her VitaCraves Teen Multivitamin Gummies, 60 Count",7
"RMS 2-Pack 32 Inches Long Grabber Reacher - Magnetic Tip Helps Pick Up Small Objects - Fitted with Post to Assist with Dressing - Mobility Aid Reaching Assist Tool, Arm Extension (32-inch)",19
"RMS 2-Pack 32 Inches Long Grabber Reacher - Magnetic Tip Helps Pick Up Small Objects - Fitted with Post to Assist with Dressing - Mobility Aid Reaching Assist Tool, Arm Extension (32-inch)",19
"The Laundress - Signature Laundry Detergent Liquid, Classic, Preserves Color, Fights Stains, Allergen-Free Clothes Detergent, 33.3 fl oz, 64 washes",19
"DraMedic Disposable Earloop Face Mask-Dental, Surgical, Medical, Allergy, Pollen, Antiviral, Flu, Cleaning, Painting, Mouth, Cover, Travel, Dust 100 pcs / 2 Boxes Blue",9
"SofPull 9” Paper Towel Roll by GP PRO (Georgia-Pacific), White, 26610, 400 Feet Per Roll, 6 Rolls Per Case",28
"UltraSwim Dynamic Duo Repair Shampoo and Conditioner, 7 Fluid Ounce Each",11
"SmartyPants Adult Complete Daily Gummy Vitamins: Gluten Free, Multivitamin & Omega 3 DHA/EPA Fish Oil, Methyl B12, Vitamin D3, Non-GMO, 180 count (30 Day Supply)",21
"Electrolyte Mix Supplement Powder, 72 Trace Minerals, Potassium, Sodium, Electrolyte Replacement Keto Drink | Raspberry 30 Packets | Dr. Price's Vitamins, No Sugar, Vegan, Non-GMO, Gluten-Free",16
Best Microfiber Cleaning Cloths – Pack of 50 Towels,17
LiCB 20 Pack LR1130 AG10 Battery 1.5V Alkaline Button Cell Batteries for Watch,5
Carex Bed Buddy Heat Pad and Cooling Neck Wrap - Microwave Heating Pad for Sore Muscles - Cold Wrap Pack for Aches and Pain,9
Keto BHB Exogenous Ketone Supplement - Beta Hydroxybutyrate Ketone Salt Pills - 30 Servings,19
"Pacifica Beauty Underarm Deodorant Wipes, Coconut Milk & Essential Oils",8
"Ankle Brace Compression Support Sleeve (1 Pair) - BEST Ankle Compression Socks for Plantar Fasciitis, Arch Support, Foot & Ankle Swelling, Achilles Tendon, Joint Pain, Injury Recovery, Heel Spurs",15
"Zazzee Myo-Inositol 120 Veggie Capsules, 2000 mg per Serving, 100% Pure, Pharmaceutical Grade, Vegan, Non-GMO and All Natural",17
"Fiber Choice Fruity Bites Daily Prebiotic Fiber Gummies, #1 Gastroenterologist Recommended*, Helps Support Regularity, Gelatin Free, 90 Count Assorted Fruit",10
"Schick Hydro 5 Disposable Razor for Men with Hydrating Gel Reservoir, 3 Count (Pack of 1)",6
"Natural Aluminum-Free Deodorant Stick (That Works) Jasmine/Rose - Stay Fresh All Day - Underarmed for Women & Men - Organic, Healthy, Safe, Non Toxic - Phthalate, Paraben, Gluten & Cruelty Free",15
"Natural Organic Moroccan Argan Oil Shampoo and Conditioner Set Sulfate Free - Best for Damaged, Dry, Curly or Frizzy Hair - Thickening for Fine/Thin Hair, Safe for Color-Treated, Keratin Treated Hair",24
Coenzyme Q10 Serum 1 oz,16
"Plantar Fasciitis Feet Insoles Arch Supports Orthotics Inserts Relieve Flat Feet, High Arch, Foot Pain",9
Ettore 8-Inch All Purpose Window Squeegee with Lifetime Silicone Rubber Blade,18
Wet Brush Disney Princess Hair Brush Detangler - Ariel,4
"FantaSea Non Woven Facial and Body Wax 100 Strips, 50 small 50 large",14
"Bior&eacute; Daily Deep Pore Cleansing Cloths, 60 Count",3
"Bior&eacute; Daily Deep Pore Cleansing Cloths, 60 Count",9
"Vive Folding Cane - Foldable Walking Cane for Men, Women - Fold-up, Collapsible, Lightweight, Adjustable, Portable Hand Walking Stick - Balancing Mobility Aid - Sleek, Comfortable T Handles (Black)",16
"Self Adherent Cohesive Wrap Bandages 2inch-Wide (12-Pack) Bundle, 5 yds Self Adhesive Non Woven Bandage Rolls, Brown Athletic Tape for Wrist, Ankle, Hand, etc. Premium-Grade Medical Stretch Wrap",11
"Biotin Hair Growth Serum Advanced Topical Formula To Help Grow Healthy, Strong Hair Suitable for Men and Women of All Hair Types Hair Loss Support By Pureauty Naturals",16
Rayovac Size 312 Extra Advanced Mercury Free Hearing Aid Batteries (80 Batteries),24
"o.b. Applicator Free Digital Tampons, Super Plus - 40 Count, saSAXDS",4
Lobe Wonder Support Patches for Earrings 60 ea (Pack of 1),6
"Sani Sticks Drain Cleaner and Deodorizer | Non-Toxic, Enzyme Formula to Eliminate Odors and Prevents Clogged Drains | Septic Tank Safe | 48 Pack, Lemon",14
"Move Free Schiff Type II Collagen, Boron & HA Ultra Triple Action Tablets 60 count in a value pack",29
Mary Kay TimeWise Age Fighting Moisturizer combination/oily,20
"Pure Creatine Monohydrate – 200 Servings - 1,000 Grams, 2.2lb Bulk, Vegan, Non-GMO, Gluten Free, Soy Free. Aid Strength Gains, No Artificial Ingredients - NAKED CREATINE",20
Lauricidin®- The Original Monolaurin Supplement- 3000mg per Serving- 227g per Jar,40
"CHARMKING Compression Socks for Women & Men 7/8 Pairs 15-20 mmHg is Best Graduated Athletic,Running,Flight,Travel,Nurses",15
Tweezerman Slant Tweezer - Black Model No. 1230-BR,28
"DiamondSmile Replacement Toothbrush Heads Compatible with Sonicare Plaque Control HX9028/64 8 Pack,fits 2 Series,Gum Health,DiamondClean,FlexCare,HealthyWhite Sonic Snap-On Brush Handles",13
"PureBeets | 100% Organic Pure Beet Root Powder | Best Value Beetroot Nitric Oxide Supplement | Beets Support Faster Recovery & Total Body Health - Viva Deo (17.5 oz, 78 Servings)",15
Thayers Rose Petal Witch Hazel with Aloe Vera - 12 oz.(2 pack),28
