InvoiceNo,StockCode,Description,Quantity,InvoiceDate,UnitPrice,CustomerID,Country
572763,21586,"Highpot Burrito Baby Blanket Hat Set, Novelty Flour Tortilla Newborn Receiving Sleeping Blanket Swaddle Wrap Hat for Girls Boys (A)",1,26-10-2011 09:54,8,12812.0,Japan
571360,22722,Land of Luna Unicorn Baby Mobile for Girl Nursery Decor (2019 New Design),6,17-10-2011 11:51,22,16563.0,United Kingdom
550911,20725,"HK 56in Bed Rail Swing Down Safety Bed Rails Hide Away(HA) Bedrail Assist Extra Long BedRails, Mesh Guard Rails for Convertible Crib(1 Pack)",24,21-04-2011 13:11,42,12354.0,Spain
539280,22417,Simple Joys by Carter's Baby Boys' 2-Pack Plush Blankets,2,16-12-2010 15:40,25,14373.0,United Kingdom
538510,22114,"aden + anais Disney, Swaddle Blanket | Boutique Muslin Blankets for Girls & Boys | Baby Receiving Swaddles | Ideal Newborn & Infant Swaddling Set | Perfect Shower Gifts, 4 Pack, Winnie the Pooh",1,12-12-2010 13:47,96,18004.0,United Kingdom
569849,72802C,"Gyro Bowl, McoMce 360 Degree Rotate No Spill Bowls for Toddlers, Spill Proof Baby Bowls with Lid for Toddlers Baby Kids, Creative Snacks Bowl Practice Feeding Bowl, Universal Rotating Bowl, Blue",1,06-10-2011 13:49,6,15264.0,United Kingdom
544692,22960,"Large Premium Knit Baby Swaddle Receiving Lavendar Blanket""Lily"" by Copper Pearl",2,23-02-2011 09:14,24,17499.0,United Kingdom
563022,22979,"Baby Lounger, Portable Super Soft and Breathable Newborn Infant Bassinet, Newborn Cocoon Snuggle Bed",1,11-08-2011 13:34,57,17248.0,United Kingdom
567175,22813,decalmile Snow White and The Seven Dwarfs Wall Decals Princess Wall Stickers Peel and Stick Removable Vinyl Wall Art for Kids Bedroom Nursery Girls Room,12,18-09-2011 13:38,11,13067.0,United Kingdom
577477,21864,"OXO Tot Fork and Spoon Set, Pack of 2 (Pink)",2,20-11-2011 11:32,15,14157.0,United Kingdom
560807,47566,"EZOWare Extra Large [3-Pack] Linen Fabric Foldable Storage Cubes Bin Box Containers with Lid and Handles - Light Gray for Home, Office, Nursery, Closet, Bedroom, Living Room (24x12x12inch)",4,21-07-2011 10:44,44,18143.0,United Kingdom
575655,35646,"Jay Franco Harry Potter Draco Dormiens 5 Piece Twin Bed Set, Blue",6,10-11-2011 14:28,50,16434.0,United Kingdom
542258,84347,BirdRock Home Single Laundry Hamper with Lid and Removable Liner - Linen - Easily Transport Laundry - Foldable Hamper - Cut Out Handles,3,26-01-2011 17:08,31,17372.0,United Kingdom
536823,22553,"Know How Organizers Laundry Basket, Toy Bin, Dog Toy Basket, Cotton Woven Rope Basket, XXL Blanket Basket, Long Handles, Decorative Nursery Hamper, Grey White 20'' x 13'' Wide Extra Large",10,02-12-2010 17:22,35,13011.0,United Kingdom
545431,21211,"Jumbo Toy Hammock for Stuffed Animals, 59 inch Extra Large Mesh Toy Hammock 2 Pack, Small Hanging Bathtub Storage Net Organizer, Durable Mesh Toy Organizers for Kids",2,02-03-2011 14:58,12,12873.0,United Kingdom
577148,23191,Step2 Hot Wheels Toddler to Twin Bed with Lights Vehicle,6,18-11-2011 09:43,16,13941.0,United Kingdom
557743,21428,Koala Kare 889-KIT Strap for KB101 Baby Changing Station,2,22-06-2011 11:59,14,18155.0,United Kingdom
560366,85039A,"Cartoon Network Powerpuff Girls, ""Day Saved"" Micro Raschel Throw Blanket, 46"" x 60""",2,18-07-2011 12:19,48,16859.0,United Kingdom
568062,23109,"Lush Decor Whale Kids Reversible 4 Piece Quilt Bedding Set with Sham and Decorative Throw Pillows, Twin, Navy",4,23-09-2011 13:18,23,14014.0,United Kingdom
553896,22993,"Delta Children Soft Area Rug with Non Slip Backing, DC Comics Batman",32,19-05-2011 17:22,149,13887.0,United Kingdom
537593,23078,Guidecraft See and Store Dress Up Center - Pink G98403,10,07-12-2010 12:21,9,14282.0,United Kingdom
C562117,84931A,"Dog and Puppies Flexible Gel Clings –Removable and Reusable Window Clings for Kids and Adults – Great Gel Decals for Home, Cars, Plane Travel and More",1,02-08-2011 16:20,18,16628.0,United Kingdom
537421,20726,"Best NON-SLIDE Bamboo Changing Pad Liners - 3-Pack, Thicker & Highest Quality Fabric - 26.5” x 13” – Waterproof, Antibacterial, Hypoallergenic, Machine Wash & Dry – Nursery Necessities",24,06-12-2010 15:25,14,17218.0,United Kingdom
575847,23205,Decowall DWG-707WY Sun and Clouds Graphic Kids Wall Stickers Wall Decals Window Stickers Peel and Stick Wall Stickers for Kids Nursery Bedroom Living Room (White_707WY),5,11-11-2011 12:07,26,18209.0,United Kingdom
569845,23493,"Moon Lamp,Rechargeable 3D Printing Moon Light Lamp,Remote&Touch Control with Wooden Stand,16 Colors Lunar Night Light for Kids Women Birthday Gifts (Diameter 6.2 inch)",1,06-10-2011 13:41,26,14819.0,United Kingdom
566438,84077,"Viviland Baby Muslin Swaddle Blanket for Newborn Girls | 70% Bamboo 30% Cotton Receiving Blanket Swaddle Wrap with Gift Box | 4 Packs 47 X 47 inch Muslin Towel | Bunny, Pineapple, Dandelion, Flamingo",9,12-09-2011 15:14,21,15996.0,United Kingdom
560975,23189,talever Kid Blanket Super Plush Throw Blanket Cartoon Print Kids Adults Character Lightweight Coral Fleece Blanket Size 59x78 inches (Frozen),1,22-07-2011 11:56,29,14426.0,United Kingdom
575654,22413,"Cher Bébé Oval Bassinet Wedge Pillow for Acid Reflux | High Incline for Colic | Cotton & Waterproof Covers | Baby Sleep Positioner for 15"" Wide Mattress Pads | Your Newborn Sleep Solution",12,10-11-2011 14:28,10,15238.0,United Kingdom
567294,22457,"Ely's & Co Swaddle Blanket Adjustable Infant Baby Wrap Set 2 Pack (0-3 Months, Grey Chevron and Polka Dots)",12,19-09-2011 12:06,16,13774.0,United Kingdom
549574,84279B,"LA Baby Waterproof Contour Changing Pad, 30"" - Made in USA. Easy to Clean Quilted Cover W Non-Skid Bottom, Safety Strap, Fits All Standard Changing Tables/Dresser Tops for Best Infant Diaper Change",72,10-04-2011 16:02,25,18226.0,United Kingdom
556439,23376,"Play Platoon Kids Activity Table Set - 3 in 1 Round Water Table, Craft Table and Building Brick Table with Storage - Includes 2 Chairs and 25 Jumbo Bricks - Primary Colors",6,10-06-2011 14:46,55,18061.0,United Kingdom
553856,16235,"Parker Baby Muslin Blanket - 100% Soft Cotton Baby Quilt and Kids Blanket - Unisex, Gender Neutral -""Gray Buffalo""",8,19-05-2011 13:28,39,16813.0,United Kingdom
549592,22738,"Jumbo 19092 Jan Van Haasteren-The Library 1000 Piece Jigsaw Puzzle, Multi",16,11-04-2011 10:14,12,14311.0,United Kingdom
573408,22998,Shark Tail Blanket Sleeping Bag for Boys Girls and Kids  Age 3-12 Years. Soft Fleece Fabric. Best and Super Cuddly Gift for Christmas and Birthday,2,30-10-2011 15:59,29,16190.0,United Kingdom
539314,22810,"Delta Children Upholstered Twin Bed, JoJo Siwa",1,16-12-2010 18:20,231,13874.0,United Kingdom
563906,22578,"Kids Toddler Pillow, Mkicesky Neck Support Pillow (13 x 18 - inch) with Hypoallergenic Organic Pillowcase, Machine Washable for School, Travel, Napping & Reading Bed Pillow",12,21-08-2011 11:50,19,14246.0,United Kingdom
571743,21059,"RAINBEAN Perfectly Round Novelty Blanket,Tortilla Throw Comfort Food Creation Burrito Wrap Blanket,Kids Super Soft Warm Swaddling Blankets Throw Rug Sofa and Bed,Yoga Mat,Picnic Blanket-4' Diameter",-720,19-10-2011 10:38,3,15853.0,United Kingdom
554868,84378,"Disney Minnie Mouse Fork and Spoon Set, Pink, 6 Count",8,27-05-2011 10:52,24,13135.0,United Kingdom
580848,22156,"2-in-1 Pikachu & Eevee 3D Lamps Nightlight for Kids,7 Colors Touch Switch & Remote Control Table Desk Lamps Holiday Xmas Gifts Room Decor for Nursery Baby Toddler",8,06-12-2011 11:51,23,18005.0,United Kingdom
560232,82613C,"MAYbabe Child Safety Net-10ft x 2.6ft,Rail Balcony Banister, Stair Net, Safety for Kids/Toys/Pets.Patios or Balcony Use.Safety for Indoor&Outdoor.White/Brown/Black.",48,17-07-2011 11:08,12,14810.0,United Kingdom
543190,85034A,Lambs & Ivy Signature Montana Blue/Gray/Brown Bear Changing Pad Cover,72,04-02-2011 11:52,7,17226.0,United Kingdom
555157,84050,"UooMay Window Film 3D Privacy Decorative - Static Cling Non Adhesive Glass No Glue Heat Control Anti UV Light Blocking Window Sticker(17.7""x78.7"")",24,01-06-2011 07:38,18,15643.0,United Kingdom
574740,22411,"Large Foldable Storage Basket Bin Set - 3 Pack Collapsible Linens Storage Shelf Canvas Organizer Storage Basket with Sturdy Rod for Nursery Home Shelves and Office(Black, 15”L x 10.6” W x 9.4” H)",12,06-11-2011 16:07,15,12357.0,Switzerland
555127,21989,"Elf Star Cotton Bamboo Fiber Breathable Waterproof Underpads Mattress Pad Sheet Protector, Elephant and Giraffe Print, 1 Pad 27""X47""",12,31-05-2011 15:30,14,15241.0,United Kingdom
C558897,84596B,"ARTSCAPE Drift Window Film, 24 x 36",3,04-07-2011 15:55,4,12619.0,Germany
577756,17012F,Kids Wall Decals Stickers Nursery Decor Baby Room Decor Nursery Wall Stickers Safari Woodland Scene for Baby Toddler Boys & Girls Rooms Peel and Stick Jungle Animal Stickers Elephant Baby Gift,10,21-11-2011 14:59,41,15115.0,United Kingdom
568104,21172,Kid Duvet Cover Queen Sonic Bedding 3 Piece Duvet Covers for Children/Adult,4,23-09-2011 15:50,12,16485.0,United Kingdom
559951,23076,Baby Monthly Milestone Blanket Woodland Animals Personalized Photography Props Backdrop Blankets for Infant Newborn Swaddling Boy Girl Baby Shower Gifts,6,14-07-2011 10:52,39,14847.0,United Kingdom
576538,22686,"Jay Franco Harry Potter Witchcraft & Wizardry Twin/Full Comforter, Gray",2,15-11-2011 12:42,24,14725.0,United Kingdom
552442,21845,"Crib Sheets, 2 Pack Pink Quatrefoil & Floral Fitted Soft Jersey Cotton Cover",5,09-05-2011 13:03,34,14667.0,United Kingdom
560562,22380,Disney's Paw Patrol Pals Pillow and Throw  2 pieces Blanket Set,1,19-07-2011 13:34,28,15713.0,United Kingdom
C561596,22089,"SANNIX Swaddle Blankets Muslin Cotton Baby Swaddle Wrap, Cactus Floral Print Burping Cloth & Stroller Cover Baby Blanket",6,28-07-2011 11:23,11,16558.0,United Kingdom
554269,21239,"Disney Dumbo Wearable Blanket, Grey, Medium",96,23-05-2011 13:03,13,13223.0,United Kingdom
543641,22748,Jay Franco Minecraft Survive Twin Sheet Set - Super Soft and Cozy Kid’s Bedding - Fade Resistant Polyester Microfiber Sheets (Official Minecraft Product),2,10-02-2011 17:19,24,14555.0,United Kingdom
578685,22457,"Baby Toy Basket/Large Woven Storage Basket/Blanket Basket 17"" X 15"" / Laundry Basket/Nursery Hamper/Living Room Bin Organizer, Off White Cotton Rope Storage Baskets with Handle by Buddy Pro",12,25-11-2011 09:07,27,16779.0,United Kingdom
560101,23188,"Ewong 3D Butterfly Wall Stickers Arts Decor Crafts for Kids Girls, 60PCS Home Decorations for Living Room Baby Bedroom Bathroom Nursery Classroom Office Decals - Pink",2,14-07-2011 18:08,8,14891.0,United Kingdom
559357,23099,"NTBAY Cotton Cable Knit Toddler Blanket, Super Soft Warm Multi Color Baby Blanket, 30""x 40"", White",3,07-07-2011 18:56,19,17107.0,United Kingdom
569005,23285,"Pack n Play Fitted Pack n Play Playard Sheet Set-2 Pack Portable Mini Crib Sheets,Playard Mattress Cover,Super Soft Material, Cute Monsters",5,29-09-2011 18:30,15,16268.0,United Kingdom
561689,21218,"Cuddles & Cribs Nursery Bedding Crib in a Bag - 100% Organic Cotton Crib Sheets, 100% Polyester Reversible Comforter and Shaped Cushion - 4 Piece, Happy Giraffe",4,29-07-2011 09:01,39,15942.0,United Kingdom
C543632,20984,"Hudson Baby Multi-Fabric 12-Panel Blanket, Blue",50,10-02-2011 16:22,14,14842.0,United Kingdom
567195,21471,"Aden by aden + anais Disney Swaddle Blanket | Muslin Blankets for Girls & Boys | Baby Receiving Swaddles | Ideal Newborn Gifts, Unisex Infant Shower Items, Wearable Swaddling Set, Graphic Mickey",24,19-09-2011 09:30,36,17451.0,United Kingdom
574086,21933,"Tadpoles Organics Set of 3 Flannel Receiving Blankets, White",4,03-11-2011 08:39,8,15651.0,United Kingdom
544177,22090,"Baby Feeding Set,Including Bowl with Suction, Dish, Bendable Fork and Spoon, Adjustable Baby bib, and Snack Cups. Harmless, Silicone, Easy to Clean Again, Perfect Infant Baby Shower Gift - Green",1,16-02-2011 14:27,19,13001.0,United Kingdom
579179,21015,"Large Premium Knit Baby Swaddle Receiving Blanket""Midway"" by Copper Pearl",24,28-11-2011 15:02,24,17237.0,United Kingdom
540970,23328,Baby Fanatic Security Bear - New York Yankees Team Colors,2,12-01-2011 13:52,11,14185.0,United Kingdom
541792,16161U,Garden Flowers Baby Nursery Peel & Stick Wall Sticker Decals,12,21-01-2011 13:09,45,17094.0,United Kingdom
566976,23265,"QuickZip Crib Sheet Set - Faster, Safer, Easier Baby Crib Sheets - Includes 1 Wraparound Base & 1 Zip-On Crib Sheet - White 100% Cotton - Fits All Standard Crib Mattresses",1,16-09-2011 09:27,24,15382.0,United Kingdom
550150,21749,Toddlers and Baby Quilt Lightweight Blanket Embossed Cotton Quilt 4 Seasons Scalloped Newborn Baby Boy/Girl (Pink),1,14-04-2011 14:39,9,15230.0,United Kingdom
568131,21991,"Puzzled Sky Blue Whale Plush, 7 Inch Collectible Decorative Fluffy Stuffed Animal Soft Take A Long Plushie Pillow Squishes Washable Cushy Mini Doll Ocean Sea Life Themed Kids Toddlers Toy & Games",12,23-09-2011 16:05,64,16872.0,United Kingdom
562032,20914,"Snuggle Pro Weighted Blanket for Kids - 7 lbs Heavy Blanket for Sleeping, 41''x60'' - Set with Cool Bamboo & Minky Reversible Cover - Great Comfort for Children - Sensory Calming Weighted Blanket",12,02-08-2011 08:48,20,12347.0,Iceland
556112,21137,"Building Block Bricks Fabric Wall Decals, Set Of 16 Blocks In 4 Colors - Removable, Reusable, Respositionable",16,09-06-2011 09:28,10,13265.0,United Kingdom
580645,70007,"Toddlers Kids Utensils Silverware Set, E-far 9-Piece Stainless Steel Baby Preschooler Cutlery Set of 3, Include Fork/Spoon/Knife, Training & Transition, Cute Animals Pattern - Dishwasher Safe",1,05-12-2011 13:11,48,17857.0,United Kingdom
561095,22244,"Mi-Zone Elliot Full/Queen Comforter Set Teen Boy Bedding - Navy, Plaid – 4 Piece Bed Sets – Peach Skin Fabric Bed Comforter",1,25-07-2011 10:19,19,17040.0,United Kingdom
562523,21257,"Fantasy Fields - Sunny Safari Animals Thematic Set of 2 Wooden Bookends for Kids | Imagination Inspiring Hand Crafted & Hand Painted Details   Non-Toxic, Lead Free Water-based Paint",3,05-08-2011 13:26,6,16174.0,United Kingdom
549286,21903,"FDW Chair Set with Storage Study Child School Adjustable Height Children's Table Desk Kids, Pink",1,07-04-2011 18:03,84,17928.0,United Kingdom
C569951,21333,"Bedtime Originals Roar Dinosaur Wall Appliques, Blue/Gray",4,06-10-2011 18:29,16,16394.0,United Kingdom
577169,21993,Pillow Pets Sleeptime Lites Green Dinosaur Stuffed Animal Plush Night Light,12,18-11-2011 10:42,25,14641.0,United Kingdom
548716,21090,"Gender Neutral Baby Monthly Milestone Blanket – Large Wrinkle-Free Professional Photo Background for Boy & Girl – Fleece Photography Props for Mom Newborn Baby Shower Gifts by Cute ‘n More, 40x60”",36,03-04-2011 15:50,17,14023.0,United Kingdom
548005,22413,"ECR4Kids Children's Naptime Cot, Stackable Daycare Sleeping Cot for Kids, 52"" L x 23"" W, Ready-to-Assemble, Blue (Set of 6)",1,29-03-2011 10:49,149,14128.0,United Kingdom
537265,21166,"8"" x10"" Gold Heart Nursery Prints for Baby Girl & Children Room Decor & Decorations Perfect for Baby Shower Gift Ideas …",6,06-12-2010 11:26,14,15919.0,United Kingdom
558687,22908,GEENNY OptimaBaby Pink Grey Elephant Musical Mobile,5,01-07-2011 11:43,32,12598.0,France
C562915,21932,Kids Toddler Flatware Set | Children Tableware Set | Stainless Steel Child Tableware Set | Kids Training Chopsticks + Flat Edge Spoon + Grooved Fork Set with Case For Kids Cutlery Set (3PCS)(Yellow),-1,10-08-2011 13:35,14,13388.0,United Kingdom
572461,22399,"Large Premium Knit Baby Swaddle Receiving Blanket""London"" by Copper Pearl",3,24-10-2011 12:56,24,17344.0,United Kingdom
559922,22701,"DEKOSH Baby Nursery Animal Alphabet Peel & Stick ABC Kids Wall Decals - Colorful Educational Wall Stickers for Kids Playroom, Classroom Décor",2,13-07-2011 15:50,10,14400.0,United Kingdom
578078,21202,"Summer HOT - Designthology (U.S.) Changing Pad Cover Set 100% Cotton Muslin 2 Pack, Peachy Pink & Lt Green - Soft & Breathable for Boys and Girls",1,22-11-2011 16:24,16,12586.0,Italy
559979,85123A,KidKraft Farmhouse Table and Chair Set,12,14-07-2011 11:20,99,14862.0,United Kingdom
569685,22190,"Jay Franco Nickelodeon Teenage Mutant Ninja Turtles I Love TMNT Throw Pillow, Donatello",6,05-10-2011 14:47,19,16758.0,United Kingdom
572212,22722,"New Baby Changing Station Sign, 8 x 3 in with English and Symbol, Black for Men, Women, Unisex",-5,21-10-2011 12:25,8,13918.0,United Kingdom
559330,23202,Toddler Utensils Baby Spoons and Forks Set- Includes Baby Utensils Case | Toddler Spoon | Toddler Fork - Bpa Free (4 Pieces),2,07-07-2011 15:44,7,17696.0,United Kingdom
543116,22348,"Jomolly Baby Sleeping Sack, 2 Pack Wearable Blanket (Mint & Elephant) (6-12 Months)",5,03-02-2011 13:29,24,17672.0,United Kingdom
545797,21063,100% Organic Muslin Swaddle Blanket by ADDISON BELLE - Oversized 47 inches x 47 inches - Best Baby Shower Gift - Premium Receiving Blanket (Mermaid Print),6,07-03-2011 12:17,19,16225.0,United Kingdom
552652,23100,"Yoga Sprout Baby Safe Wearable Sleeping Bag/Sack/Blanket, Mountain Range Muslin 1-Pack, 12-18 Months",2,10-05-2011 14:09,16,14591.0,United Kingdom
545182,23198,"HOME BI Wide Drawer Storage Dresser, Entertainment Unit Center Cabinet, Storage Organizer Unit for Bedroom, Living Room, Office, Entryway",1,28-02-2011 14:48,59,14046.0,United Kingdom
567172,22381,"2Pack Plug in LED Night Light w/Auto Dusk to Dawn Sensor,AUSAYE 0.5W Energy Saving Lamp Dream Nightlight Rose Flower Mushroom Night Lights for Kids Adults Bedroom,Bathroom,Living Room,Kitchen,Hallway",-2,18-09-2011 13:29,7,18194.0,United Kingdom
572392,22979,"Gunapod Sleep Sack Unisex Fleece Wearable Blanket Baby Sleeping Bag, Charcoal Grey",1,24-10-2011 11:54,25,14764.0,United Kingdom
580731,22589,PECO Pecoware Thomas The Tank Engine Spoon & Fork Set,2,05-12-2011 17:36,12,17383.0,United Kingdom
566851,23020,"Flamingo P 100% Blackout Curtains Waterproof Fabric Curtains with White Thermal Insulated Liner, Rod Pocket Cotton Finishing Curtains for Bedroom 2 Bonus Tie-Backs, (2 Panels W52 x L96 inches, White)",12,15-09-2011 12:16,36,15573.0,United Kingdom
537176,22570,"Baby Basket – Jeneric Design’s Woven Rope Portable Light Weight White Nursery Caddy Basket with Handles for Storage and Organization of Diapers, Toys, Baby Laundry Clothes, Towels, Blankets",1,05-12-2010 13:26,19,16411.0,United Kingdom
551003,20778,"Mommy's Helper Step Up Non-Slip Stepstool Froggie Collection, Green",1,26-04-2011 09:44,9,16456.0,United Kingdom
561967,22171,XMWEALTHY Baby Girls Boys Wrap Swaddle Blankets Newborn Infant Knit Plush Receiving Blankets Sleeping Sack Pink,2,01-08-2011 13:11,17,12844.0,United Kingdom
559922,23127,"Blackout Curtain 63 inches Long for Living Room Room Darkrning Window Curtain Panel for Bedroom Triple Weave Drape Grommet Top,52"" W x 63"" L,1 Panel, Black",1,13-07-2011 15:50,12,14400.0,United Kingdom
571945,22114,GULIGULI Paint Splatter Wall Decal-Ink Splotch Vinyl Stickers for Toddler Boys Girls Kids Room Bedroom Playroom Decor,2,20-10-2011 10:34,12,17354.0,United Kingdom
565471,22996,Magicteam Sleep Sound White Noise Machine with 40 Natural Soothing Sounds and Memory Function 32 Levels of Volume Powered by AC or USB and Sleep Timer Sound Therapy for Baby Kids Adults,6,05-09-2011 10:12,24,13931.0,United Kingdom
541795,21240,"Butterfly Craze Mermaid Tail Blanket for Women, Teen and Kids, Medium, Blue",12,21-01-2011 13:47,7,14692.0,United Kingdom
580278,22082,"Marshmallow Furniture, Children's Foam High Back Chair, Disney Mickey Mouse Roadsters High Back Chair",1,02-12-2011 13:11,29,13560.0,United Kingdom
551986,22948,LUSH HOME Kids Double Ply Throw Blanket 40 x 50 inches (Unicorn),1,05-05-2011 14:41,24,13888.0,United Kingdom
580733,82484,Muslin Swaddle Blankets Large Size-SUPER Soft Breathable Bamboo Cotton Prevents Overheating-Multi-Use Set of 2 Gender Neutral Design Nursing Cover-Swaddling Blanket Feather Print Boy Girl-Burp Cloth,1,06-12-2011 08:37,22,16929.0,United Kingdom
537248,22710,Baby Changing Table Horizontal Wall Mounted- White,3,06-12-2010 10:36,129,15899.0,United Kingdom
C571927,23389,Bedtime Originals Lavender Woods 3 Piece Bedding Set,4,19-10-2011 16:41,40,13109.0,United Kingdom
566231,21922,"Jay Franco Marvel Spiderman Classic Saving The Day 63"" Decorative Curtain/Drapes 4-Piece Set (2 Panels, 2 Tiebacks)",1,11-09-2011 10:58,19,14837.0,United Kingdom
537963,20685,"Bucky Heartwarmer, Soothing, Hot & Cold Therapy Pillow, All Natural Buckwheat Seed Filling, Extra Soft Machine Washable & Removable Cover - Large",-12,09-12-2010 11:30,19,13369.0,United Kingdom
544805,22892,"Supernatural Collectibles Scooby Multi-Character Fleece Blanket | 45"" x 60”",3,23-02-2011 14:50,32,18068.0,United Kingdom
575734,48187,"YBLNTEK 24 Pieces Safety Shower Treads, Non-Slip Bath Treads Bathtub Stickers with Scraper for Tubs Bath",1,11-11-2011 08:39,8,12384.0,Switzerland
545470,22411,"Lambs & Ivy Disney Baby Minnie Mouse Fleece Baby Blanket, Gray/White",2,03-03-2011 10:26,18,14483.0,United Kingdom
550184,21755,Badger Basket Three Bin Storage Cubby - White,6,14-04-2011 18:02,74,17601.0,United Kingdom
569631,22961,Trend Lab Dr. Seuss Friends 5Piece Crib Bedding Set,2,05-10-2011 11:53,65,13483.0,United Kingdom
559504,22193,"SUNYAO Kids Kitchen Step Stool with Safety Rail Solid Bamboo Construction. Perfect for Toddlers Up 18 Months , Natural Color",48,08-07-2011 15:16,81,15920.0,United Kingdom
563252,22895,ufengke Dinosaur Forest Wall Stickers 3D Smashed Wall Decals Art Decor for Boys Kids Bedroom Nursery DIY,1,15-08-2011 11:59,9,17655.0,United Kingdom
560994,22356,"Mistakes are Proof that you are Trying School Nursery Education Teacher Classroom Mural DIY Quote Saying Inspirational Vinyl Wall Sticker Decals Transfer Removable Words (Size3: 23.2"" x 14.1"")",2,22-07-2011 13:35,5,15704.0,United Kingdom
C538749,22092,"Personalized Baby Blankets Newborn Gifts for Boys, Girls Nursery Décor with Your Text 3 Different Color Options D9",1,14-12-2010 11:28,12,15713.0,United Kingdom
551332,85049F,Kids and Toddler Utensils Silverware Set –12-Piece Toddler Silverware Includes 3 Forks 3 Spoons and 3 Kid-Friendly Knives - Kids Cutlery Metal Flatware Set for Preschooler Baby Child Toddler,4,27-04-2011 16:23,12,13078.0,United Kingdom
568104,22699,"LOL Surprise Sling Bag Slumber Set, Pink",1,23-09-2011 15:50,17,16485.0,United Kingdom
577733,22247,"Extra Large Cotton Rope Basket – Neutral White and Gold Hamper 20""x15"" – Woven Laundry Storage Basket with Decorative Handles - Perfect Organizer for Blankets, Nursery, Bedroom, Linen, Pillows, Toys",12,21-11-2011 13:10,28,15163.0,United Kingdom
C546517,23301,"Woodland Nursery, Collection Inspirational Animals 8x10"" Print, Nursery Decor, Kids Decor, Animals Decor for Kids, Motivational Art, Inspirational Art",1,14-03-2011 12:24,18,15308.0,United Kingdom
575125,21824,"Costzon 6-Cubby Kids Bookcase w/Cushioned Reading Nook, Multi Purpose Storage Organizer Cabinet Shelf with Soft Cushion and Thick Wood Board for Children Girls & Boys Bedroom Decor Room (Modern White)",2,08-11-2011 14:26,99,15043.0,United Kingdom
580088,22659,"aden + anais Classic Crib Sheet, Twinkle Silver Star",4,01-12-2011 14:30,18,17115.0,United Kingdom
577039,22382,Baobe Kids Deluxe Wooden Chair for Toddlers - Sturdy Hardwood Seat for Daycare/Preschool/Home Furniture - Natural Finish,6,17-11-2011 13:30,12,12539.0,Spain
544797,22650,"Square Natural Linen & Cotton Fabric Storage Bin Shelves Storage Basket with Handles-for organizing Baby Toys Bins,Kids Toys,Baby Clothing,Children Books, Gift Baskets(15×10×9"")(Panda)",1,23-02-2011 13:43,10,13489.0,United Kingdom
538886,22087,"VASAGLE Industrial Side Table, End Table with 1.2 Inch Thick Table Top, Easy Assembly, Accent Table with Iron Pipe Legs, for Living Room, Office, Hallway, Rustic Brown ULET45X",3,14-12-2010 16:07,61,13846.0,United Kingdom
572241,21990,EZOWare Natural Handwoven Braided Seagrass Rustic Round Nesting Wicker Shelf Baskets with Handles - Set of 3,1,21-10-2011 15:20,19,12712.0,Germany
576791,22989,Universal Jurassic World 3 Pc Table and Chair Set,16,16-11-2011 13:59,39,17896.0,United Kingdom
577542,23322,"Simmons Kids Silent Auto Gliding Elite Bassinet, Basketweave",12,20-11-2011 14:33,109,13565.0,United Kingdom
546686,22287,"KidKraft Wooden Bookcase with Reading Nook, Storage & Gray Cushion - Natural",1,16-03-2011 09:52,99,14636.0,United Kingdom
541523,22188,Confetti Fox Elephant Dream Big Baby Nursery Wall Art Decor - 8x10 Unframed Set of 4 Prints - Gender Neutral Boy Girl Lullaby Twinkle Star Moon Quotes,6,19-01-2011 10:09,16,17708.0,United Kingdom
562583,37476,"GEENNY 13 Piece Boutique Baby Nursery Crib Bedding Set, Woodland Deer Arrow, Multi-Colors, Crib",-1,07-08-2011 13:54,101,15831.0,United Kingdom
562427,22722,Kute Kids Super Soft Sheet Set - Fire Trucks - Brushed Microfiber for Extra Comfort (Twin),3,04-08-2011 17:19,22,17267.0,United Kingdom
559062,82551,"Jay Franco Harry Potter Whimsical Witch 7 Piece Queen Bed Set, Purple",2,06-07-2011 10:09,59,13253.0,United Kingdom
575972,22606,"Marvel Avengers Upholstered Storage Bench for Kids | Perfect for Bedrooms/Playrooms/Living Rooms | Features Fun Graphics of Hulk, Iron Man, Captain America, Thor",5,13-11-2011 13:01,89,14499.0,United Kingdom
574942,20973,"Glow in The Dark Wall Stickers, Benbo Stars Harry Potter Peel Vinyl Luminous Gifts Wall Decals for DIY Boys Girls Nursery Bedroom Mural Home Decor",2,07-11-2011 17:50,7,15330.0,United Kingdom
551595,21231,"LifeTree Muslin Swaddle Blankets Girl, Bunny Print Baby Girls Blanket, 70% Bamboo 30% Cotton, 47""x47"" Breathable, Soft Nursing Cover, Wrap, Burp Cloth",6,03-05-2011 11:33,12,12891.0,United Kingdom
563104,20758,Light Green 5-Position Folding Chair with Adjustable Strap for Kids and Adults Comfortable Seat for Ground and Floor 20''L x 9.5''H,20,12-08-2011 10:13,31,13888.0,United Kingdom
574951,22082,Cinder Black Bear Blanket for Boys and All Kids - Wearable and Hooded Fleece Blankets - Gifts by Wild Things,3,08-11-2011 09:44,24,15763.0,United Kingdom
