InvoiceNo,StockCode,Description,Quantity,InvoiceDate,UnitPrice,CustomerID,Country
548899,23422,Home & Kitchen,1,04-04-2011 16:31,13,15838.0,United Kingdom
578997,22726,"Little One's Pad Pack N Play Crib Mattress Cover - 27"" X 39"" - Fits Most Baby Portable Cribs, Play Yards and Foldable Mattresses - Waterproof, Dryer Safe - Comfy and Soft Fitted Crib Protector",4,27-11-2011 16:02,19,18001.0,United Kingdom
567197,22470,"Kids Star Night Light, 360-Degree Rotating Star Projector, Desk Lamp 4 LEDs 8 Colors Changing with USB Cable, Best for Children Baby Bedroom and Party Decorations",1,19-09-2011 10:10,13,14934.0,Channel Islands
540460,21172,"400-Thread-Count 100% Cotton Sheet Pure White Queen-Sheets Set, 4-Piece Long-staple Combed Cotton Best-Bedding Sheets For Bed, Breathable, Soft & Silky Sateen Weave Fits Mattress Upto 18'' Deep Pocket",4,07-01-2011 12:44,39,15607.0,United Kingdom
544650,85152,"Ubbi Steel Odor Locking, No Special Bag Required Money Saving, Awards-Winning, Modern Design Registry Must-Have Diaper Pail, Gray",1,22-02-2011 12:40,69,16349.0,United Kingdom
568529,23108,Munchkin 6 Piece Lift Infant Spoons,8,27-09-2011 13:38,5,16181.0,United Kingdom
541276,20972,Mirari OK to Wake! Alarm Clock & Night-Light,3,17-01-2011 11:34,27,15316.0,United Kingdom
551543,21329,Ultra Glow in the Dark Stars; 200 Count w/ Bonus Moon,12,03-05-2011 09:26,11,16055.0,United Kingdom
563022,20971,"GORILLA GRIP Slip-Resistant Leak Proof Mattress Pad Protector, 52x34, Absorbs 8 Cups, Oeko Tex Certified, Waterproof Bed Wetting Incontinence Cover, Washable Hospital Grade Pads for Toddlers, Elderly",96,11-08-2011 13:34,18,17248.0,United Kingdom
562769,21445,"Carters Waterproof Fitted Quilted Crib and Toddler Protective Mattress Pad Cover, White",12,09-08-2011 10:52,12,14409.0,United Kingdom
570598,22413,"Star Night Light for Kids, Universe Night Light Projection Lamp, Romantic Star Sea Birthday New Projector lamp for Bedroom - 3 Sets of Film",2,11-10-2011 11:55,16,14175.0,United Kingdom
571685,22210,2 Step Stool for Kids (Gray 2 Pack) | Toddler Stool for Toilet Potty Training | Slip Resistant Soft Grip for Safety as Bathroom Potty Stool,4,18-10-2011 14:15,28,12863.0,United Kingdom
537668,82494L,"Burt's Bees Baby - Fitted Crib Sheet, Solid Color, 100% Organic Cotton Crib Sheet for Standard Crib and Toddler Mattresses (Heather Grey)",6,08-12-2010 08:43,13,14821.0,United Kingdom
571496,22508,AmazonBasics Portable Baby Travel Window Blackout Blind Shades with Suction Cups,24,17-10-2011 15:02,25,13265.0,United Kingdom
552696,22598,"Love To Dream Swaddle UP, Gray, Small, 7-13 lbs, Dramatically Better Sleep, Allow Baby to Sleep in Their Preferred arms up Position for self-Soothing, snug fit Calms Startle Reflex",1,10-05-2011 15:48,29,13592.0,United Kingdom
547122,20676,2 PK - Simplehouseware Stuffed Animal Jumbo Toy Storage Hammock,12,21-03-2011 11:52,10,17678.0,United Kingdom
569846,22847,"SwaddleMe Original Swaddle 3-PK, Superstar (LG)",6,06-10-2011 13:42,19,13422.0,United Kingdom
561063,21326,"Toddler Pillow with Pillowcase - 13X18 Soft Organic Cotton Baby Pillows for Sleeping - Washable and Hypoallergenic - Toddlers, Kids, Infant - Perfect for Travel, Toddler Cot, Bed Set (Kea Safari)",2,24-07-2011 14:12,18,12763.0,Japan
538155,22977,"Munchkin Secure Grip Waterproof Diaper Changing Pad, 16"" x 31""",1,09-12-2010 16:52,29,16907.0,United Kingdom
565087,22219,[2-Pack] Celeep Baby Toddler Pillow Set - 13 x 18 Inches Toddler Bedding Small Pillow - Baby Pillow with 100% Cotton Cover,12,01-09-2011 10:03,18,13276.0,United Kingdom
556781,22557,"VAVA VA-CL006 Night Lights for Kids with Stable Charging Pad, ABS+PC Bedside Lamp for Breastfeeding, Touch Control&Timer Setting, White",1,14-06-2011 12:47,19,13384.0,United Kingdom
549307,22545,"Skip Hop Explore and More Baby's View 3-Stage Interactive Activity Center, Multi-Color, 4 Months",3,08-04-2011 09:08,103,15119.0,United Kingdom
569336,21257,[1-Pack Toddler Bed Rail Bumper | Bed Bumpers for Toddlers | Kids Foam Safety Guard for Bed - Side Rail with Waterproof Cover,2,03-10-2011 14:05,24,15088.0,United Kingdom
556128,23209,"Rabbitgoo Window Privacy Film Non-Adhesive, Frosted Window Glass Films for Home Bathroom Office, Removable Opaque Window Sticker, Self Static Cling Window Covering (Matte White, 17.5 x 78.7 inches)",1,09-06-2011 10:31,7,13038.0,United Kingdom
C578259,22890,"Goodpick Large Cotton Rope Basket 15.8""x15.8""x13.8""-Baby Laundry Basket Woven Blanket Basket Nursery Bin",4,23-11-2011 13:02,19,16660.0,United Kingdom
563754,22079,"Jumbo Toy Hammock, White - Organize Stuffed Animals and Children's Toys with this Mesh Hammock. Great Decor while Neatly Organizing Kid's Toys and Stuffed Animals. Expands to 5.5 feet. (2-Pack)",1,19-08-2011 10:56,7,15396.0,United Kingdom
569918,21240,"CASOFU Burritos Blanket, Burritos Tortilla Blanket, Food Flour Tortilla Throw Blankets, Soft and Comfortable Giant Round Taco Blanket for Kids. (Burrito-a, 60inches)",1,06-10-2011 17:03,22,15766.0,United Kingdom
568780,21034,"LA Baby Waterproof Contour Changing Pad, 32"" - Made in USA. Easy to Clean w/Non-Skid Bottom, Safety Strap, Fits All Standard Changing Tables/Dresser Tops for Best Infant Diaper Change",5,29-09-2011 08:27,17,18235.0,United Kingdom
574937,22766,"2in1 Stationary&Rock Mode Bassinet One-Second Fold Travel Crib Portable Newborn Baby,Gray",12,07-11-2011 17:08,84,15344.0,United Kingdom
538078,85183B,"Mika Micky Bedside Sleeper Easy Folding Portable Crib,Grey",3,09-12-2010 14:25,149,16255.0,United Kingdom
547420,23226,Galabloomer Newborn Receiving Blanket Headband Set Flower Print Baby Swaddle Receiving Blankets,1,23-03-2011 10:43,10,15449.0,United Kingdom
554498,23148,"LittleHippo Mella Ready to Rise Children's Trainer, Alarm Clock, Night Light Sleep Sounds Machine (Arctic Blue)",10,24-05-2011 14:39,49,15314.0,United Kingdom
562894,22178,"Hudson Baby Unisex Baby Security Blanket, Gray Elephant, One Size",6,10-08-2011 12:35,8,12571.0,France
545408,37342,"Regalo Swing Down Bed Rail Guard, with Reinforced Anchor Safety System",10,02-03-2011 12:10,22,15067.0,United Kingdom
544160,22423,"Windsor Glider and Ottoman, White with Gray Cushion",1,16-02-2011 12:49,129,16494.0,United Kingdom
578044,22371,BreathableBaby Classic Breathable Mesh Crib Liner - White,1,22-11-2011 14:41,8,13488.0,United Kingdom
578813,20838,"Rabbitgoo 3D Decorative Window Film, Non-Adhesive Privacy Films - Frosted Window Glass Film for Home Office, Removable Rainbow Window Tint Film, Mosaic Patterns, 17.5 x 78.7 inches",2,25-11-2011 13:33,12,14946.0,United Kingdom
559202,23225,"Graco Pack 'n Play Quilted Playard Sheet, Stone Gray",3,07-07-2011 10:40,30,13583.0,United Kingdom
571202,22150,Milliard Memory Foam Pack N ' Play Mattress Topper,12,14-10-2011 12:29,14,14937.0,Channel Islands
571418,22860,Olababy 100% Silicone Soft-Tip Training Spoon Teether for Baby Led Weaning 2pack,8,17-10-2011 12:35,15,16412.0,United Kingdom
546769,23152,"Stretchy Fitted Crib Sheets Set-Brolex 2 Pack Portable Crib Mattress Topper for Baby Boys Girls,Ultra Soft Jersey,Full Standard,Elephant & Whale",8,16-03-2011 14:57,24,17504.0,United Kingdom
561042,21243,"TILLYOU Baby Safe Crib Bumper Pads for Standard Cribs Machine Washable Padded Crib Liner Thick Padding for Nursery Bed 100% Silky Soft Microfiber Polyester Protector de Cuna, 4 Piece/Gray",1,24-07-2011 12:18,42,16305.0,United Kingdom
C567643,22148,"Milliard 2-Inch Ventilated Memory Foam Crib/Toddler Bed Mattress Topper with Removable Waterproof 65-Percent Cotton Non-Slip Cover - 51.5"" x 27"" x 2""",-323,21-09-2011 14:16,10,12409.0,Switzerland
580126,82486,"Kids Best Friend Boys Blue Step Stool, Take It Along in Bedroom, Kitchen, Bathroom and Living Room. Great For potty Training!",10,01-12-2011 17:20,21,12562.0,France
C576866,21232,Dual Height 2 Step Stool for Kids | Toddler's Stool for Potty Training and Use in The Bathroom or Kitchen | Wide Two-Step Design for Growing Children | BPA Free Soft-Grip Steps for Comfort and Safety,10,16-11-2011 16:09,25,16278.0,United Kingdom
578359,23184,"Regalo My Cot Portable Toddler Bed, Includes Fitted Sheet, Royal Blue",2,24-11-2011 10:35,34,14607.0,United Kingdom
572065,21984,"Dreamegg D1 Sound Machine - White Noise Machine with Baby Night Light for Sleeping, High Fidelity Sounds, Timer & Memory Feature, Sound Machine for Baby Adults, Home, Office, Travel (White)",6,20-10-2011 13:06,13,12556.0,Spain
553900,21035,"Baby Pillow for Newborn Infant(0-12months),Flat Head Syndrome Prevention 3D Memory Foam Can Support Head & Neck Pillow,Head Shaping Pillow,Heart Shaped",2,19-05-2011 17:47,15,12353.0,Bahrain
561638,20685,"The First Years Take & Toss Flatware for Kids, 16 pieces",24,28-07-2011 14:54,2,15118.0,United Kingdom
553005,23328,Newborn Receiving Blanket Headband Set Flower Print Baby Swaddle Receiving Blankets Galabloomer,2,12-05-2011 16:29,10,14651.0,United Kingdom
569325,23101,"INDRESSME XXXLarge Cotton Rope Basket 21.7"" x 21.7"" x 13.8"" Woven Baby Laundry Basket for Blankets Toys Storage Basket with Handle Comforter Cushions Storage Bins Thread Laundry Hamper-Black Stitch",12,03-10-2011 12:41,21,16774.0,United Kingdom
577506,23191,Simple Joys by Carter's Baby 7-Pack Flannel Receiving Blankets,48,20-11-2011 12:40,15,13212.0,United Kingdom
538648,21709,"Baby Swaddle Blanket Upsimples Unisex Swaddle Wrap Soft Silky Bamboo Muslin Swaddle Blankets Neutral Receiving Blanket for Boys and Girls, Large 47 x 47 inches, Set of 4-Arrow/Feather/Tent/Crisscross",12,13-12-2010 14:56,21,17937.0,United Kingdom
536616,23177,"Baby Einstein Sea Dreams Soother Musical Crib Toy and Sound Machine, Newborns +",24,02-12-2010 10:10,199,17925.0,United Kingdom
566027,23490,Click to see price,1,08-09-2011 12:57,10,15618.0,United Kingdom
551412,16169K,Baby Delight Beside Me Dreamer Bassinet & Bedside Sleeper,12,28-04-2011 13:31,10,15508.0,United Kingdom
552280,84032A,Funko Pop! Television: Stranger Things - Steve with Hat & Ice Cream,1,08-05-2011 12:39,39,13561.0,United Kingdom
572910,23040,L.O.L. Surprise! Soft Cotton Hooded Bath Towel Wrap 24” x 50” Pink,10,26-10-2011 15:58,9,15990.0,United Kingdom
545937,21934,Advent Calendar: Fortnite,12,08-03-2011 12:05,35,12758.0,Portugal
568828,21080,"TILLYOU Jersey Knit Ultra Soft Changing Pad Cover Set-Cradle Sheet Unisex Change Table Sheets for Baby Girls and Boys-32""/34'' x 16""- Comfortable Cozy Hypoallergenic-2 Pack Peachy Pink & Lt Gray",13,29-09-2011 11:31,17,15175.0,United Kingdom
549591,20973,"Douni Sleep Sound Machine - White Noise Machine with 24 Non-Looping Soothing Sounds for Sleeping & Relaxation, Timer & Memory Function,Sleep Therapy for Kid, Adult, Home,Office,Travel.Wood Grain",7,11-04-2011 10:10,4,18080.0,United Kingdom
562157,22386,XMWEALTHY Newborn Baby Wrap Swaddle Blanket Knit Sleeping Bag Receiving Blankets Stroller Wrap for Baby(Dark Gray) (0-6 Month),5,03-08-2011 11:44,24,16012.0,United Kingdom
547558,23245,"Gerber Graduates Kiddy Spoons, Neutral Colors, 3pk",2,23-03-2011 17:25,24,17966.0,United Kingdom
538510,21172,"hiccapop Nursery Organizer and Baby Diaper Caddy | Hanging Diaper Organization Storage for Baby Essentials | Hang on Crib, Changing Table or Wall",24,12-12-2010 13:47,29,18004.0,United Kingdom
550318,84247L,LectroSound White Noise Machine for Sleep and Relaxation,24,17-04-2011 12:25,9,16085.0,United Kingdom
551834,23215,Dekor Classic Hands-Free Diaper Pail | White | Easiest to Use | Just Step – Drop – Done | Doesn’t Absorb Odors | 20 Second Bag Change | Most Economical Refill System,10,04-05-2011 13:13,12,16610.0,United Kingdom
547801,22723,"MIBOTE Baby Growth Chart Handing Ruler Wall Decor for Kids, Canvas Removable Height Growth Chart 79"" x 7.9""",5,25-03-2011 12:57,15,14107.0,United Kingdom
564532,22792,"Realistic 3D Domed Glow in The Dark Stars,606 Dots for Starry Sky, Perfect for Kids Bedding Room Gift(606 Stars) (Green)",2,25-08-2011 15:04,31,14055.0,United Kingdom
549924,22962,Simple Joys by Carter's Baby Girls' 7-Pack Flannel Receiving Blankets,2,13-04-2011 10:10,27,16837.0,United Kingdom
540362,23076,"Delta Children Chair Desk With Stroage Bin, Disney Minnie Mouse",1,06-01-2011 15:42,24,13656.0,United Kingdom
572763,22417,"Moredig Night Light Projector Remote Control and Timer Design Projection lamp, Built-in 12 Light Songs 360 Degree Rotating 8 Colorful Lights for Children Kids Birthday, Parties - Black White",1,26-10-2011 09:54,34,12812.0,Japan
579132,22297,"AIRSEE White Noise Machine - Portable Sound Machine with 24 Non-Looping Soothing Sounds for Sleeping, Sleep Sound Therapy for Kids, Adults and Travel",8,28-11-2011 12:35,23,15022.0,United Kingdom
C578239,22047,Great Explorations Wonder Stars Super Kit Glow In The Dark Ceiling Stars 150Piece In 4 Sizes Reusable Adhesive Putty & Constellation Star Map Lifetime Glow Guarantee,1,23-11-2011 12:29,8,14912.0,Italy
538816,22697,"Munchkin Brica Fold N' Go Travel Bassinet, Grey",3,14-12-2010 12:35,39,16812.0,United Kingdom
557743,22698,"Summer Waterproof Changing Pad Liners, 3 Count",12,22-06-2011 11:59,9,18155.0,United Kingdom
548400,23344,"ECR4Kids My First Meal Pal Stainless Steel Forks - Safety Utensils for Toddler and Children - 3-Pack, White/Light Grey",2,30-03-2011 17:33,3,17400.0,United Kingdom
570452,21181,SwaddleMe By Your Side Sleeper,8,10-10-2011 15:15,42,12427.0,Germany
570250,22646,Mangohood Potty Training Toilet Seat with Step Stool Ladder for Boy and Girl Baby Toddler Kid Children’s Toilet Training Seat Chair with Soft Padded Seat and Sturdy Non-Slip Wide Step (Blue Green),2,10-10-2011 09:01,35,14027.0,United Kingdom
540017,22147,"Baby Relax Hunter 3 Piece Kiddy Table and Chair Set, Gray",3,04-01-2011 11:48,45,13963.0,United Kingdom
570076,22662,"Putska Baby Diaper Caddy Organizer: Portable Holder Bag for Changing Table and Car, Nursery Essentials Storage bins gifts with 2 Pacifier Clips, 2 Bibs",2,07-10-2011 11:17,19,15738.0,United Kingdom
550277,22570,"Tundras Boys Blue Step Stool - Great for Potty Training, Bathroom, Bedroom, Toy Room, Kitchen, and Living Room. Perfect for Your House",36,15-04-2011 12:48,10,12639.0,Sweden
547555,22502,"Kids Carpet Playmat Rug City Life Great for Playing with Cars and Toys - Play, Learn and Have Fun Safely - Kids Baby, Children Educational Road Traffic Play Mat, for Bedroom Play Room Game Safe Area",1,23-03-2011 16:35,19,14075.0,United Kingdom
C553866,22906,"Stretchy Fitted Pack n Play Playard Sheet Set-Brolex 2 Pack Portable Mini Crib Sheets,Convertible Playard Mattress Cover,Ultra Soft Material,Pink & White Arrow Design",12,19-05-2011 14:14,15,14620.0,United Kingdom
556112,22735,"Wildkin Nap Mat with Pillow for Toddler Boys and Girls, Perfect Size for Daycare and Preschool, Designed to Fit on a Standard Cot, Patterns Coordinate with Our Lunch Boxes and Backpacks",1,09-06-2011 09:28,39,13265.0,United Kingdom
546774,21156,"Fisher-Price Soothing Motions Bassinet, Windmill",12,16-03-2011 15:45,114,14505.0,United Kingdom
C573760,85150,XMWEALTHY Cute Newborn Baby Boys Girls Blankets Plush Swaddle Blankets Baby Shower Gifts White,1,01-11-2011 09:52,16,16648.0,United Kingdom
C577360,23243,"American Baby Company Printed 100% Natural Cotton Jersey Knit Fitted Pack N Play Playard Sheet, Grey Stars and Moon, Soft Breathable, for Boys and Girls",5,18-11-2011 16:12,8,13012.0,United Kingdom
571461,22090,"Tot Tutors WO701 Springfield Collection Supersized Wood Toy Storage Organizer, Extra Large, Grey/White",6,17-10-2011 14:12,59,16932.0,United Kingdom
561803,22107,Big Red Rooster BRRC105 Sleep Training Alarm Clock for Kids | Plug in Kids Alarm Clock | Toddler Clock | Boy Or Girls Alarm Clock | Childrens Alarm Clock | Time to Wake Clock,16,29-07-2011 14:39,24,17926.0,United Kingdom
559894,82616B,"Milliard Quilted, Waterproof Crib and Toddler Mattress Protector Pad, Premium Hypoallergenic Fitted Cover with Extra Padding 28x52x6",6,13-07-2011 12:06,15,14159.0,United Kingdom
555517,22436,Fisher-Price Music & Lights Elephant,2,05-06-2011 10:54,14,13131.0,United Kingdom
549026,47504H,Skip Hop Cry-Activated Baby Sleep Soother & Nursery Sound Machine - Plush Sloth,144,05-04-2011 16:42,39,17409.0,United Kingdom
549243,85099C,"Boppy Noggin Nest Head Support, Gray Elephants, Head Support for Infants",24,07-04-2011 11:47,14,16043.0,United Kingdom
552467,85014A,"NODNAL CO. Bassinet Fitted Sheet Set 3 Pack 100% Jersey Gray Cotton for Baby Girl/Boy - Grey Chevron, Polka Dot and Stripe 160 GSM Sheets",6,09-05-2011 15:29,21,15249.0,United Kingdom
546117,22086,"Swaddle Blanket, Adjustable Infant Baby Wrap, Soft Cotton in Ultra Grey",1,09-03-2011 13:56,21,16771.0,United Kingdom
541435,22908,"Jay Franco Marvel Spiderman Ultimate 26"" Pillowtime Pal, Blue,",1,18-01-2011 10:28,15,13898.0,United Kingdom
556817,84884A,"[3Pack] Vintar Motion Sensor Dimmable LED Night Light, Plug-in Nightlight with Auto Dusk to Dawn Sensor, Adjustable Brightness Warm White Lights for Hallway, Kids Room, Kitchen, Stairway, Bathroom",3,15-06-2011 09:33,17,14609.0,United Kingdom
540984,23209,"SonWave - White Noise Sound Machine - 10 Natural Soothing Sound Tracks Home, Office, Travel, Baby – Multiple Timer Settings - Battery or Adapter Charging Options",1,12-01-2011 15:44,15,14167.0,United Kingdom
547370,23581,"VASAGLE Industrial Shoe Bench, 3-Tier Shoe Rack, Storage Organizer with Seat, Industrial, Wood Look Accent Furniture with Metal Frame, for Entryway, Living Room, Hallway ULBS73X",4,22-03-2011 13:32,59,14711.0,United Kingdom
555555,15036,"Disney Minnie Mouse Toddler Rolled Nap Mat, Sweet as Minnie",4,05-06-2011 13:48,19,16963.0,United Kingdom
581404,22651,Moon Boat 120PCS Fall Leaves Window Clings - Thanksgiving Maple Decorations Autumn Decals Party Decor Ornaments,24,08-12-2011 13:47,10,13680.0,United Kingdom
C539251,21355,"Roore 5 lb Weighted Blanket for Kids I 36""x48"" I Weighted Blanket with Plush Minky Blue Removable Cover I Weighted with Premium Glass Beads I Perfect for Children from 40 to 60 lb",10,16-12-2010 14:15,44,17213.0,United Kingdom
576696,22423,"Disney Toy Story Power Up 2 Pack Fitted Sheet and Pillowcase Toddler Sheet Set, Blue/Green",1,16-11-2011 12:26,16,16669.0,United Kingdom
C561232,84988,"American Baby Company Waterproof Quilted Cotton Bassinet Size Fitted Mattress Pad Cover, White",4,26-07-2011 10:21,11,16133.0,United Kingdom
543612,82482,"MyBaby, SoundSpa Lullaby - Sounds & Projection, Plays 6 Sounds & Lullabies, Image Projector Featuring Diverse Scenes, Auto-Off Timer Perfect for Naptime, Powered by an AC Adapter",2,10-02-2011 14:46,24,16711.0,United Kingdom
546243,22329,"Dreambaby Step Stool, Aqua Dots",24,10-03-2011 13:08,9,15308.0,United Kingdom
571622,22112,"Halo Sleepsack 100% Cotton Swaddle, Heather Gray, Small",6,18-10-2011 10:58,26,14798.0,United Kingdom
559201,85186C,hiccapop Convertible Crib Toddler Bed Rail Guard with Reinforced Anchor Safety,1,07-07-2011 10:39,37,14217.0,United Kingdom
568223,22900,"Summer Double Safety Bedrail, Grey",2,26-09-2011 10:16,40,12412.0,Denmark
575843,23413,Upsimples Newborn Baby Girl Blanket Soft Plush Sleeping Sack Unicorn Baby Swaddle Blanket Baby Girl Clothes Receiving Blankets for Girls 0-6 Months-Unique Baby Shower Gifts for Girls,12,11-11-2011 12:02,14,14446.0,United Kingdom
C577345,23110,"TILLYOU 3-Piece Padded Baby Crib Rail Cover Protector Set from Chewing, Safe Teething Guard Wrap for Standard Cribs, 100% Silky Soft Microfiber Polyester, Fits Side and Front Rails, Pale Gray",14,18-11-2011 15:16,24,15563.0,United Kingdom
542254,22501,"Munchkin 6 Piece Raise Toddler Forks and Spoons, Blue, 12+",1,26-01-2011 16:41,9,14733.0,United Kingdom
C555268,23077,VELIMAX Static Cling Total Blackout Window Film Privacy Room Darkening Window Tint Black Window Cover Removable 100% Light Blocking No Glue (17.7 x 78.7 inches),10,01-06-2011 16:17,9,18257.0,United Kingdom
574698,22578,Nested Bean Zen Sack Classic - Adjustable Cotton Wearable Blanket | Baby Sleeping Bag,1,06-11-2011 13:48,37,14039.0,United Kingdom
C577323,22418,"SwaddleMe Original Swaddle 3PK, Criss Cross Polka Dot, Small (0-3 Months, 7-14 lbs)",2,18-11-2011 13:57,42,17904.0,United Kingdom
549964,85202,"Luvable Friends Unisex Baby Flannel Receiving Blankets 7-Pack, Basic Elephant, One Size",1,13-04-2011 14:12,26,13122.0,United Kingdom
C577362,21218,"Boon Pulp Silicone Feeder, Green/Blue",12,18-11-2011 16:14,13,14073.0,United Kingdom
580848,21355,"2 Sheets Large Size Unicorn Wall Decor,Removable Unicorn Wall Decals Stickers Decor for Gilrs Kids Bedroom Nursery Birthday Party Favor（Neasyth Store 9.99 $） (2 PCS)",1,06-12-2011 11:51,4,18005.0,United Kingdom
544108,22544,Toddler Pillow - Organic Cotton Made in USA - Washable Unisex Kids Pillow - 13X18,1,16-02-2011 10:53,9,12653.0,Israel
567701,22382,"TILLYOU Microfiber Silky Soft Crib Sheet Navy, Hypoallergenic Breathable Fitted Toddler Mattress Sheets, 28""x 52""x 8'' Baby Sheet for Boys Girls, Navy Blue",2,22-09-2011 09:36,7,17172.0,United Kingdom
562136,85014B,Baby Nest Designs Closet Dividers for Baby Clothes [Unisex Boho] - 7x Baby Clothing Size Age Dividers from Newborn Infant to 24 Months - Boho Baby Clothes Dividers and Nursery Closet Organizer,12,03-08-2011 09:59,9,15374.0,United Kingdom
557672,22662,"TomCare Cube Storage 6-Cube Bookshelf Closet Organizer Storage Shelves Shelf Cubes Organizer Plastic Square Book Shelf Bookcase DIY Closet Cabinet Organizer Shelving for Home Office Bedroom, White",2,22-06-2011 10:13,26,16114.0,United Kingdom
C559533,22630,"Sweet Jojo Designs Blush Pink, Grey and White Baby or Toddler Fitted Crib Sheet for Watercolor Floral Collection",1,10-07-2011 12:10,19,17126.0,United Kingdom
559629,21026,Baby Einstein Star Bright Symphony Toy,12,11-07-2011 11:58,9,14690.0,United Kingdom
538625,23344,Rubbermaid RM-P2 2-Step Molded Plastic Stool with Non-Slip Step Treads 300-Pound Capacity,1,13-12-2010 12:50,9,14544.0,United Kingdom
C543760,18097C,RoomMates Toy Story 3 Glow In The Dark Peel and Stick Wall Decals,4,11-02-2011 15:12,13,15638.0,United Kingdom
575886,22969,"Utopia Bedding Toddler Pillow - Pack of 2 Baby Pillows for Sleeping - 100% Cotton Cover - Kids Pillows, Snow White - 13 x 18 Inches",1,11-11-2011 13:57,11,12517.0,Germany
559032,21700,"Stretchy Changing Pad Covers-BROLEX 2 Pack Jersey Knit Change Pad Covers for Girls Boys,Pink & White Arrow",3,05-07-2011 14:53,14,17511.0,United Kingdom
580905,22189,"Inflatable Travel Foot Rest Pillow | Kids Airplane Bed | Adjustable Height Leg Pillow | Make a Flat Bed for Kids and Toddlers | Great for Airplane, Train, car (Grey, 1-Pack)",12,06-12-2011 13:02,20,16313.0,United Kingdom
571557,23197,"Kids Carpet Playmat City Life Extra Large - Learn & Have Fun Safe, Children's Educational, Road Traffic System, Multi Color Activity Centerp Play Mat! Great For Playing With Cars For Bedroom Playroom",3,18-10-2011 09:25,13,15678.0,United Kingdom
563689,35961,Glow in The Dark Stars for Ceiling or Wall Stickers - Glowing Wall Decals Stickers Room Decor Kit - Galaxy Glow Star Set and Solar System Decal for Kids Bedroom Decoration,1,18-08-2011 12:43,16,15743.0,United Kingdom
576251,POST,"BROLEX Stretchy Fitted Crib Sheets Set 2 Pack Portable Crib Mattress Topper for Baby Girls Boys,Ultra Soft Jersey,Full Standard,Pink & White Arrow",1,14-11-2011 13:51,13,16207.0,United Kingdom
566271,23266,Gila Privacy Black Static Cling Residential DIY Window Film No Glue No Adhesive 3ft x 6.5ft (36in x 78in),1,11-09-2011 13:44,20,14250.0,United Kingdom
570665,21128,"Acko 16 Inches Super Strong Folding Step Stool for Adults, Kitchen Stepping Stools, Garden Step Stool Black",25,11-10-2011 14:22,9,16120.0,United Kingdom
558096,79066K,"Ultra Brighter Glow in the Dark Stars; Special Deal 200 Count w/ Bonus Moon, Amazing for Children and Toddler Decorations Wall Stickers for Boys! FREE Constellation Guide",24,26-06-2011 13:24,13,15532.0,United Kingdom
540518,23230,"Graco Pack 'n Play Playard Sheet, Dark Gray/Pale Gray, 2 Count",6,09-01-2011 12:03,64,14761.0,United Kingdom
543808,90041,Munchkin Step Diaper Pail Powered by Arm & Hammer,2,13-02-2011 13:22,17,17454.0,United Kingdom
561393,22904,"iLuvBamboo Crib Mattress Pad Protector - Waterproof Cover - Soft Natural Bamboo Jacquard Fitted Topper - Noiseless, Breathable & Hypoallergenic – Best Baby Gifts for Potty Training Toddlers & Infants",2,27-07-2011 10:10,9,18241.0,United Kingdom
C559808,22895,ONTEL Dream Tents Space Adventure,1,12-07-2011 14:49,36,13743.0,United Kingdom
570983,35933,"AVANTEK White Noise Sound Machine for Sleeping, 20 Non-Looping High Fidelity Soothing Sounds with 30 Levels of Volume, 7 Timer Settings and Memory Function",2,13-10-2011 11:57,13,14963.0,United Kingdom
548327,23268,"SwaddleMe Pod 2-PK, Baby Bows (NB)",24,30-03-2011 13:05,28,16788.0,United Kingdom
C567940,21873,"SOAIY Aurora Night Light Projector and Sleeping Soothing White Noise Sound Machine for Baby, Kids, Adults with Bluetooth 4.1, Timer, Remote, 6 Soother Sounds, 7 Lighting Modes for Kids Room",1,22-09-2011 18:21,39,16984.0,United Kingdom
554808,23101,"Margaux & May Crib Mattress Protector Pad - Waterproof, Ultra Soft - Dryer Friendly - Deluxe Bamboo Rayon - Fitted Quilted Mattress Protector Pad for Crib - Absorbent Stain Protection Baby Cover",24,26-05-2011 13:01,17,17059.0,United Kingdom
544328,20972,Super Soft and Comfy Changing Pad Cover for Baby by BlueSnail (Gray),1,17-02-2011 16:35,11,14371.0,United Kingdom
547064,22588,Utopia Home Foldable Step Stool for Kids - 11 Inches Wide and 9 Inches Tall - White and Black - Holds Up to 300 lbs - Lightweight Plastic Design,12,20-03-2011 13:38,9,16096.0,United Kingdom
580279,84997a,"Super Strong Folding Step Stool - 11"" Height - Holds up to 300 Lb - The lightweight foldable step stool is sturdy enough to support adults & safe enough for kids. Skid resistant and open with one flip",24,02-12-2011 13:12,14,15123.0,United Kingdom
580678,22109,Barbie Fashionistas Ultimate Closet Accessory,12,05-12-2011 14:49,14,18015.0,United Kingdom
