InvoiceNo,StockCode,Description,Quantity,InvoiceDate,UnitPrice,CustomerID,Country
C544665,84926F,"White Noise Sound Machine with Night Lights | 6 Relaxing & Soothing Nature Sounds and Auto-Off Timer | Portable Noise Machine Baby & Kids Sleep Therapy for Home, Office, Travel",8,22-02-2011 14:56,62,12852.0,United Kingdom
554070,21851,AeroBed Air Mattress for Kids,12,22-05-2011 11:06,22,13555.0,United Kingdom
539859,23174,"Dinosaur Toys - 3D Dinosaur Night Lights for Kids, 7 Colors Changing Decor Lamp with 3 Dinosaur Stickers, Christmas and Birthday Gifts for Boys Girls",4,22-12-2010 16:23,39,17905.0,United Kingdom
543587,21945,Urban Infant Tot Cot Modern Preschool/Daycare Toddler Nap Mat with Elastic Corner Straps | 52 x 22 Inches - Bunnies,1,10-02-2011 11:39,7,12561.0,Germany
550921,23118,"EasyPouch Independence - The No Squeeze, No Mess, self feeding utensil for baby food pouches. [2 Pack]",96,21-04-2011 14:21,19,14770.0,United Kingdom
543191,22568,Make Lemonade 9.5 Minute Hourglass Sand Timer with Nightlight for Kids | 7 Color Bedside Lamp,2,04-02-2011 11:54,21,13137.0,United Kingdom
558098,47590A,"Little Seeds Changing Table Topper, White",3,26-06-2011 13:31,25,18044.0,United Kingdom
539752,22767,"lulujo Baby First Year Milestone Blanket and Cards Set, I Will Move Mountains",6,21-12-2010 15:43,31,12515.0,Italy
C580740,21210,"Halo 100% Cotton Muslin Sleepsack Wearable Blanket, Grey Tree Leaf, Extra-Large",10,06-12-2011 09:25,8,12479.0,Germany
C537824,20914,"Parker Baby Swaddle Blankets - 3 Pack of 100% Cotton Muslin Swaddle Blankets for Baby Boys and Girls - Unisex/Gender Neutral -""Classics Set""",10,08-12-2010 14:27,28,12870.0,United Kingdom
580050,22049,"TL Care 100% Cotton Jersey Knit Fitted Crib Sheet for Standard Crib and Toddler Mattresses, Pink, 28 x 52, for Girls",6,01-12-2011 12:54,22,14960.0,United Kingdom
574880,51014A,"White Noise Machine - Sound Machine for Sleeping & Relaxation w/Timer - 38 Soothing Natural Sounds Noise Maker - Portable Sleep Sound Therapy for Home, Office or Travel - Built in USB Output Charger",10,07-11-2011 13:25,19,18016.0,United Kingdom
C550814,22139,JoJo Unicorn Stick Lamp,6,20-04-2011 16:41,36,16611.0,United Kingdom
568662,22960,"Summer Slumber Buddies Projection and Melodies Soother Dozing Hippo, Pink",12,28-09-2011 12:36,26,16764.0,United Kingdom
558635,22726,"Baby Shark 4 Piece Toddler Bedding Set - Includes Quilted Comforter, Fitted Sheet, Top Sheet, and Pillow Case",24,30-06-2011 19:52,19,16498.0,United Kingdom
538513,21982,"XXXLarge Cotton Rope Basket - 22""x22""x14"" – Woven Hamper Basket with Solid Handles – Use for Towels or Sofa Throws in The Living Room - Ideal for Baby Laundry, Toy Storage & Decorative Blankets",2,12-12-2010 14:21,26,15454.0,United Kingdom
C546885,22429,"Jay Franco Sesame Street Plus Stuffed Red Elmo Pillow Buddy - Super Soft Polyester Microfiber, 20"" Inches",12,17-03-2011 18:11,8,15671.0,United Kingdom
568155,85123A,"Fisca Baby Musical Crib Mobile, Infant Bed Decoration Toy Hanging Rotating Bell with Melodies Dual Purpose (Mobile & Bath Toy)",3,25-09-2011 12:15,9,17006.0,United Kingdom
569823,23350,Bendy and the Ink Machine : Bendy Plush Pillow,1,06-10-2011 12:15,14,16895.0,United Kingdom
556969,22288,"Jay Franco Harry Potter Spellbound 3 Piece Twin Sheet Set, Gray",10,16-06-2011 10:11,19,16257.0,United Kingdom
541884,22386,"mDesign Baby Food Kitchen Refrigerator Cabinet or Pantry Storage Organizer Bin with Handles for Breast Milk, Pouches, Jars, Bottles, Formula, Juice Boxes - BPA Free, 10"" x 4"" x 3"", 2 Pack - Clear",12,24-01-2011 11:12,15,14782.0,United Kingdom
570213,21733,Carter's Jungle Collection Musical Mobile,12,09-10-2011 11:32,35,16248.0,United Kingdom
548256,22597,"Uiter One Way Window Film- Anti UV Static Cling Window Film 100% Light Blocking for Privacy Removal Decorate Heat Control Glass Tint Home Office Windows.(17.5’’ x 78.7”, Silver)",48,30-03-2011 10:50,12,17775.0,United Kingdom
568320,22726,Kidkraft Sling Bookshelf - Natural,4,26-09-2011 13:35,39,17674.0,United Kingdom
550819,22288,"Jay Franco Cars 3 High Tech Twin 3 Piece Sheet Set, Red",6,20-04-2011 17:37,29,17530.0,United Kingdom
556121,22633,Bambusi Natural Bamboo Baby Spoons - First Stage Weaning Feeding Spoons with Soft Silicone Tips for Babies or Toddler | Gum-Friendly BPA-Free and Lead-Free | Great Infant Gift Idea (Set of 5),1,09-06-2011 10:09,14,15855.0,United Kingdom
562574,20725,"Regalo HideAway Double Sided Bed Rail Guard, with Reinforced Anchor Safety System",3,07-08-2011 12:42,43,14903.0,United Kingdom
C576072,20996,Woodland Animals Pack n Play Playard Sheet Compatible with Graco | Pure Jersey Cotton Unisex Mini Portable Crib Sheet,4,13-11-2011 16:05,14,18069.0,United Kingdom
569522,20679,"Bearington Baby Wee Lamby, Small Lamb Stuffed Animal Lovey Security Blanket, 8"" x 7""",2,04-10-2011 14:41,8,12664.0,Finland
559888,21949,"Tot Tutors Kids 2-in-1 Plastic Building Blocks-Compatible Activity Table and 2 Chairs Set, Square, Primary Colors",1,13-07-2011 11:47,37,16450.0,United Kingdom
562125,21718,Sesame Street Elmo Upholstered Chair,2,02-08-2011 17:29,67,17887.0,United Kingdom
559091,22859,GrowthPic Musical Mobile Baby Crib Mobile with Hanging Rotating Toys and Music Box,1,06-07-2011 10:47,29,17905.0,United Kingdom
562045,23475,Funko POP! Movies: Cast Away - Chuck with Wilson,96,02-08-2011 10:33,9,12644.0,Germany
575003,48185,"Changing Pad Liners Waterproof Washable (5 Count), Flannel Portable & Durable Extra Large 27"" X 14"" Travel Bassinet Waterproof Pad Liners, White",2,08-11-2011 11:09,15,15950.0,United Kingdom
572058,23125,"BaeBae Goods Black and White Swaddle Blankets, Adjustable Infant Baby Wrap Set of 4, Baby Swaddling Wrap Blankets Made in Soft Cotton",1,20-10-2011 12:43,24,18252.0,United Kingdom
537693,22195,"HIYAGON Storage Baskets,Cotton Foldable Round Home Organizer Bin for Baby Nursery,Toys,Laundry,Baby Clothing,Gift Baskets(Elephant)",2,08-12-2010 10:45,14,12441.0,France
C570005,22383,Baby Head Shaping Pillow - Flat Head & Reflux Prevention for Newborn Infants – Organic Cotton Hypoallergenic – 3D Breathable Air Mesh Neck Support – Machine Washable & Dry-able – Bib Shower Gift Set,2,07-10-2011 09:22,19,14462.0,United Kingdom
554632,DOT,Sweet Jojo Designs Baby or Toddler Fitted Crib Sheet for Bear Mountain Watercolor Collection,1,25-05-2011 11:41,16,14287.0,United Kingdom
574480,22522,ChooMee SoftSip Food Pouch Tops | 4 CT | Swirl Colors,2,04-11-2011 12:42,27,15010.0,United Kingdom
548862,21232,"Set of 2 Decorative Throw Pillows for Baby Girls, Kids. Star Furry White w/ Cute Embroidered Sleeping Face and Fluffy Pink Faux Fur, Soft and Plush - For Crib - Nursery Toddler or Teen Bedroom Décor",12,04-04-2011 13:47,38,17956.0,United Kingdom
539351,22579,A Nice Night Galaxy Bedding Sets Outer Space Comforter 3D Printed Space Quilt Set Full Size,-1,17-12-2010 11:23,14,12551.0,Spain
561033,22411,Changing Pad Cover Set | Cradle Bassinet Sheets/Change Table Covers for Boys & Girls | Super Soft 100% Jersey Knit Cotton | Grey and White | 150 GSM | 3 Pack,12,24-07-2011 11:40,19,14443.0,United Kingdom
539867,22093,"TILLYOU Premium Egyptian Cotton Crib Sheet Gray, Soft Hypoallergenic Fitted Toddler Sheets, Breathable Comfortable Cozy Baby Sheets, 28""x52"" Fits Standard Crib and Toddler Mattress, Charcoal Gray",48,23-12-2010 10:38,9,13922.0,United Kingdom
571360,21363,Picniva This Kitchen is Seasoned with Love Wall Quote Sticker,1,17-10-2011 11:51,6,16563.0,United Kingdom
577301,21213,"Stuffed Animal Toy Hammock - Best for keeping rooms clean, organized and clutter-free - Comes with BONUS FREE E-Book, Toy Organizer Storage Net is Durable and Easy to Install",2,18-11-2011 12:53,10,12498.0,Germany
540187,21034,"Skip Hop Baby Explore and More Musical Instrument Accordion Toy, Multi, Hedgehog",12,05-01-2011 13:53,12,15358.0,United Kingdom
549206,22106,"Floral Bassinet Sheets, Momcozy 2 Pack Waterproof Sheet Set for Baby Girls, Fit for Bassinet Mattress Pad Cover, Like Oval Halo, Chicco Lullago, Arms Reach, Ingenuity",12,07-04-2011 10:38,18,15281.0,United Kingdom
536535,47590B,Bassinet Wedge Pillow for Baby - Universal - 3 Elevation Options for Better Sleep | Aids in Relieving Reflux | Nasal Congestion | Feeding - Happy Baby and Happy Parents - Cotton Fabric w/Carry Case,4,01-12-2010 13:38,34,15605.0,United Kingdom
554515,21947,"The Orb Factory Sticky Mosaics Unicorns Arts & Crafts, Pink/Teal/Blue/Purple, 12"" x 2"" x 10.75""",2,24-05-2011 16:25,14,15042.0,United Kingdom
547488,21014,Toys & Child Mainstays Student Desk (White) (White),1,23-03-2011 11:30,93,13821.0,United Kingdom
C575171,23144,Bavilk Kids Children Hooded Poncho Dinosaur Swim Beach Bath Towel for Girls / Boys,10,08-11-2011 17:49,19,18164.0,United Kingdom
567329,22322,144 x PCS 3D Colorful Butterfly Wall Stickers DIY Art Decor Crafts for Nursery Classroom Offices Kids Girl Boy Baby Bedroom Bathroom Living Room Magnets and Glue Sticker Set,1,19-09-2011 14:43,14,13416.0,United Kingdom
C558882,22999,Bible Verse Baby Quilt – Beautiful Cotton Blanket Embroidered with Scriptures – Unique Christian Gifts for Baptism or Baby Shower - Boy,2,04-07-2011 14:47,45,13767.0,United Kingdom
574302,48138,Pillow Pets Elmo Sleeptime Lite - Sesame Street Plush,2,03-11-2011 16:28,24,13914.0,United Kingdom
572071,21928,"7 Navy Pink Gold Baby Nursery Closet Organizer Dividers For Girl Clothing, Floral Flower Age Size Hanger Organization For Kid Toddler Infant Newborn Clothes, Shower Registry Gift Supplies, 0-24 Months",20,20-10-2011 13:37,11,13366.0,United Kingdom
552646,21071,"Baby Beach Tent, Portable Pop Up Tent, UPF 50+ Sun Shelters, Baby Shade with Mosquito Net, Sun Shade for Girls Boys, Beach Umbrella for Infant",12,10-05-2011 13:26,25,14078.0,United Kingdom
566055,22427,Funko Pocket Game of Thrones - Drogon Pop Keychain,2,08-09-2011 15:05,5,15453.0,United Kingdom
574909,22555,"Nuby Step Up Stool, Gray",1,07-11-2011 15:40,19,13673.0,United Kingdom
557787,22692,Funko Pop! Animation: My Hero Academia - Deku with Helmet,12,22-06-2011 16:16,19,15041.0,United Kingdom
558861,71053,IKEA Children's Kids Table & 2 Chairs Set Furniture (1),25,04-07-2011 12:19,10,13373.0,United Kingdom
559199,84879,"Munchkin Sleep Toddler Bed Rail, Fits Twin, Full and Queen Size Mattresses, Grey",48,07-07-2011 10:28,49,15288.0,United Kingdom
548865,23286,"Delta Children MySize 9 Bin Plastic Toy Organizer, Grey",72,04-04-2011 14:09,49,14747.0,United Kingdom
568160,84692,"Kids Best Friend Purple Step Stool, Take It Along In Bedroom, Kitchen, Bathroom And Living Room Toy Room, Great For Potty Training",2,25-09-2011 12:25,48,17498.0,United Kingdom
576373,23192,Jay Franco and Sons Fortnite Boogie Down Emote Twin / Full Comforter Set with Pillow Sham,30,15-11-2011 08:43,9,12640.0,France
571740,23398,Niuniu Daddy 12 inch Avocado Food Plush Toys Shaped Fruit Series Cute Kawaii Stuffed Soft Pillow,1,19-10-2011 10:34,40,17973.0,United Kingdom
559436,23240,TEALBEE BABY: 100% Organic Cotton Fitted Crib Sheet for Standard Crib Mattress - Softest Hypoallergenic Breathable Cribsheet - Gender Neutral Nursery for Boy or Girl (52 x 28 in - New Seamless Design),3,08-07-2011 12:18,18,15901.0,United Kingdom
552255,22382,"Disney Pretty Princess Toddler Bed, 4 Piece Set, Pink",1,08-05-2011 10:33,47,14005.0,United Kingdom
567711,22835,"Jackson Kid Rug Carpet Playmat for Toy Cars and Train,Huge Large 52""x 74"" Play Area Rug with Rubber Backing,Kids Race Track Rug for Toddlers,Baby,and Children Playing and Learning",50,22-09-2011 10:04,54,15603.0,United Kingdom
553676,22113,"100% Organic Cotton Pack n Play Mini Crib Sheet 2 Pack, Grey and White in Modern Bold Designs. Unisex for Both Boys' and Girls Nursery (Clouds and Stripes)",12,18-05-2011 12:57,24,16553.0,United Kingdom
554809,22722,Squishmallow Prince The Pug,1,26-05-2011 13:13,10,16838.0,United Kingdom
578354,22673,"Newborn Baby Head Shaping Pillow,Preventing Flat Head Syndrome(Plagiocephaly),Made of Memory Foam Head and Neck Support Baby 3D Pillow for 0-12 Months Infant",2,24-11-2011 10:12,9,17139.0,United Kingdom
564200,21080,Marvel The Spiderman Webbed Wonder Full Comforter Set with Fitted Sheet,-1,23-08-2011 17:37,57,18018.0,United Kingdom
576512,22086,UBBCARE Memory Foam Toddlers Bed Rails Guard Bumpers Soft Portable Toddler Bed Safety Long Bedside Pillow Pads for Crib Kids Twin Baby Elderly with Machine Washable Cover 1 PC,1,15-11-2011 12:09,24,15524.0,United Kingdom
549577,21181,"Sleepea Swaddle by Happiest Baby - 100% Organic Cotton (Graphite Gray, Small)",1,11-04-2011 08:16,25,14286.0,United Kingdom
573407,23182,"Bed Bumpers for Toddlers & Kids - Premium Foam Bumpers for Queen Bed, Toddler Side Rails for Twin Bed, Full Size Bed - Perfect Toddler Bed Bumper & Bed Rails for Toddlers",12,30-10-2011 15:58,41,18067.0,United Kingdom
579552,85034C,RoomMates Wild Horses Peel and Stick Wall Decals,2,30-11-2011 10:54,9,16210.0,United Kingdom
569126,23352,"Buttons and Stitches Little Beginnings Four Piece Laddered Receiving Blankets, Dots and Flowers",2,30-09-2011 13:28,7,13347.0,United Kingdom
550941,23118,"Biloban Pack N Play Mattress Pad - Comfort Cotton Surface, 100% Waterproof, 39"" x 27"" Fitted for Mini & Portable Playard Crib/Mattress - White",1,21-04-2011 15:46,12,17109.0,United Kingdom
560989,23342,"Play Tailor 19.7""x19.7"" Chunky Knit Blanket for Newborn Photography Props Baby Photo Backdrop Rugs Newborn Basket Filler (White)",4,22-07-2011 13:20,10,15704.0,United Kingdom
545871,22114,"Baby Crib Bumper - Breathable Mesh Crib Liner Anti-Collision Bed Bumper for Full-Size 4 Sides Slatted & Solid-Back Crib,2 Pieces/Set",4,07-03-2011 14:51,23,17092.0,United Kingdom
578098,22380,"PrettyFNT Glow in Dark Stars and Moon Wall Stickers, Glowing Stars for Ceiling and Wall Decals, Perfect for Kids Bedroom Living Room or Birthday Party, Total 206 PCS",6,22-11-2011 17:32,6,12936.0,United Kingdom
566027,20760,"Supersoft 5 Lbs Calming Weighted Blanket for Kids - 36"" x 48"" Children Heavy Blanket for Sleeping with Minky Cover - Pink Kid Comfort Sensory Blankets for Girls",-8,08-09-2011 12:57,65,15618.0,United Kingdom
564643,85123A,"American Baby Company 100% Natural Cotton Muslin Swaddle Blanket, Gray Stars/Moon, 47"" x 47"", Soft Breathable, for Boys and Girls",1,26-08-2011 13:25,8,15356.0,United Kingdom
568713,21507,Funko Pop! Animation: My Hero Academia - All Might (Golden Age),2,28-09-2011 16:04,10,13061.0,United Kingdom
569139,85099B,Shappy 8 Pieces Colorful Closet Dividers Baby Boy Girl Clothing Rack Size Dividers with Sizes Newborn to 18-24 Months,12,30-09-2011 14:55,5,16404.0,United Kingdom
568413,15060B,"Soft Minky Baby Blanket - with Premium Dotted Backing Whale Printed - Unisex - for Stroller, Crib, Newborns, Receiving (30""x40"")",1,27-09-2011 11:01,12,14818.0,United Kingdom
556469,22470,"TL Care 100% Natural Cotton Value Jersey Knit Fitted Pack N Play Playard Sheet, Pink, Soft Breathable, for Girls",10,12-06-2011 11:37,8,12516.0,Germany
C570508,20996,Funko Pop! Animation: My Hero Academia - Yaoyoruzu,12,11-10-2011 10:14,10,15706.0,United Kingdom
554326,23230,"The Northwest Company Pokémon Pikachu Fleece Throw Blanket, 45 x 60-inches",6,23-05-2011 16:32,19,13737.0,United Kingdom
550998,22696,"Carter's Super Soft Changing Pad Cover, Gray",1,26-04-2011 09:12,11,12414.0,Austria
568327,20712,"Graco Solano 4-in-1 Convertible Crib with Drawer, Espresso, Easily Converts to Toddler Bed Day Bed or Full Bed, Three Position Adjustable Height Mattress, Assembly Required (Mattress Not Included)",17,26-09-2011 14:02,199,15492.0,United Kingdom
547207,85150,"Extra Large 79"" x 40""! Kids Carpet Playmat Rug | City Life, Great to Play with Cars & Toys - Have Fun! Safe, Learn, Educational -Ideal Gift for Children Baby Bedroom Play Room Game Play Mat Rugs",2,21-03-2011 14:25,29,17763.0,United Kingdom
576224,21977,"Large Premium Knit Baby Swaddle Receiving Blanket Navy and White Triangles""North"" by Copper Pearl",1,14-11-2011 13:08,9,15458.0,United Kingdom
555496,47593A,"aden by aden + anais Classic Crib Sheet, 100% Cotton Muslin, Super Soft, Breathable, Tailored Snug Fit, Solid White",6,03-06-2011 14:44,9,15405.0,United Kingdom
574690,84597C,"TeamFar Toddler Fork, Stainless Steel Toddler Utensils Forks Set of 6, Non Toxic & Healthy, Cute Animals & Attached Travel Case - Dishwasher Safe",1,06-11-2011 13:11,4,12638.0,Sweden
C550472,85127,"American Baby Company Fleece Blanket 30 X 40 with 2 Satin Trim, Pink, for Girls",25,18-04-2011 13:52,22,18009.0,United Kingdom
C571862,23310,"Kiinde Foodii Baby Food Storage, Reusable Squeeze Spoons, 2 Attachments per Pack",2,19-10-2011 13:45,23,13422.0,United Kingdom
C540152,23411,Funko Pop! Town: Nightmare Before Christmas - Jack Skellington with Jack's House,1,05-01-2011 11:21,36,12395.0,Belgium
549975,20719,"3 Pack Organic Cotton Fitted Bassinet Sheets for Girl, Tiny Tulips, Hearts and Stripes",1,13-04-2011 14:38,59,16175.0,United Kingdom
553894,22617,OldPAPA Kids Bed Canopy with Pom Pom Hanging Mosquito Net for Baby Crib Nook Castle Game Tent Nursery Play Room Decor，White,5,19-05-2011 17:15,39,13658.0,United Kingdom
544611,23318,SONGMICS Bamboo Shoe Bench  Entryway Storage Rack with High and Low Levels for Adult and Child  ULBS120N,5,22-02-2011 10:09,9,16912.0,United Kingdom
580373,84313B,"PUREgrace Crib Mattress Protector (28"" x 52"") Made with All Natural Hypoallergenic Tencel, Soft and Breathable Waterproof Mattress Pad and Fitted Cover in one",1,02-12-2011 17:06,29,14788.0,United Kingdom
556487,22692,ZMOCEN 2 Pack Home Wall Stickers Decor Bedroom Living Room Couch TV Background Funny Sticker Removable Vinyl Art Mural Decals for Girls Boys Kids,25,12-06-2011 13:51,15,17289.0,United Kingdom
545328,20679,"EZOWare [Set of 3] Foldable Fabric Storage Cube Bins with Cotton Rope Handle, Collapsible Resistant Basket Box Organizer for Shelves Closet Toys and More – Gray 13x13x13 inch",4,01-03-2011 15:47,29,16389.0,United Kingdom
577698,22340,Newborn Baby Swaddle Blanket-Truedays Large Swaddle Best Soft for Boys or Girls (Grey),16,21-11-2011 12:05,10,14963.0,United Kingdom
570410,22079,"Vintoys Very Soft Cat Big Hugging Pillow Plush Kitten Kitty Stuffed Animals Gray 23.5""",2,10-10-2011 13:04,37,16776.0,United Kingdom
537754,22485,Bedtime Originals Jungle Buddies Velour Sherpa Blanket,5,08-12-2010 11:16,12,16081.0,United Kingdom
571272,22690,"Jay Franco JoJo Siwa Sweet Life Twin/Full Comforter and Sham Set, 2 Piece",1,16-10-2011 12:19,69,13878.0,United Kingdom
557885,22423,"100% Cotton Fitted Crib Sheet for Boy and Girl, Nursery Bedding Fits Standard Crib or Toddler Bed Mattresses (52x28x9 Inch)",1,23-06-2011 13:37,20,12465.0,Belgium
574481,22548,"Baby Lounger,Baby Nest 100% Organic Cotton Breathable and Hypoallergenic Newborn Lounger Perfect for Co-Sleeping",6,04-11-2011 12:45,99,18022.0,United Kingdom
553896,21790,"[ Newest Vision ] Star Light Rotating Projector, MOKOQI Night Lighting Star Moon Projection Lamp 4 LED Bulbs 4 Modes with Timer Auto Shut-Off & Hanging Strap for Kids Baby Bedroom (Black)",13,19-05-2011 17:22,18,13887.0,United Kingdom
538863,22296,Little Tinkers World Premium Hooded Towel for Kids | Unicorn Design | Ultra Soft and Extra Large | 100% Cotton Bath Towel with Hood for Girls,24,14-12-2010 14:15,21,16919.0,United Kingdom
571404,82494L,"Crayon Fabric Wall Decals - Set of 9 Coloring Crayons in 9 Different Colors - Removable, Reusable, Respositionable",1,17-10-2011 12:04,17,17520.0,United Kingdom
540043,21929,RoomMates Mickey & Friends Peel and Stick Wall Decal,15,04-01-2011 14:21,9,15164.0,United Kingdom
580599,84929,Portable Baby Crib Nursery Travel Folding Baby Bed Bag Infant Toddler Cradle Multifunction Storage Bag for 0-12 MonthBaby Care (Blue),20,05-12-2011 11:11,26,12925.0,United Kingdom
567356,22624,Baby Diaper Caddy Organizer | Large Portable Car Basket for Toys Wipes Diapers | Newborn Storage Bin Changing Table | Baby Shower Gift for Boy Girl | Baby Registry Must Haves | Nursery Tote Bag,3,19-09-2011 16:21,20,16527.0,United Kingdom
540016,23186,"ZIKIMICO Extra Large Cotton Rope Basket – 21.7"" x 13.8"" Woven Laundry Hamper - Baby Toys Storage & Throw Blankets Organizers – Decor Jumbo Size Bin with Handles - Collapsible Bathroom Storage",1,04-01-2011 11:42,25,16282.0,United Kingdom
574949,21930,"Cat Lamp, NeoJoy Remote Control Silicone Kitty Night Light for Kids Toddler Baby Girls Rechargeable Cute Kawaii Nightlight",1,08-11-2011 09:12,18,14360.0,United Kingdom
572679,84997D,"Heritage Kids Kids and Toddler Ultra-Soft Sleepy Unicorn and Rainbow Easy-Wash Microfiber 5-Piece Bed in A Bag Set, Twin, Blue",5,25-10-2011 13:47,53,17024.0,United Kingdom
573863,22716,"TekHome 2019 Top Unicorn Gifts for Girls, Baby Toys for 1 2 3 4 5 Year Old Boys, Christmas Gifts for 6 7 8 9 10 Year Old Kids, Best Toys for 3 6 12 18 Months, Nursery Night Lights for Kids Infant.",2,01-11-2011 11:51,79,16825.0,United Kingdom
546254,22457,"SNOOZ White Noise Sound Machine - Real Fan Inside for Non-Looping White Noise Sounds - App-Based Remote Control, Sleep Timer, and Night Light - Charcoal",6,10-03-2011 14:45,14,14727.0,United Kingdom
549910,22219,Toddler Forks and Toddler Spoon Silverware Set | Toddler Utensils with Toddler Fork and Baby Spoon| Spoon for Toddler | Baby Fork and Baby Spoon Travel Utensils with Case |Toddler Silverware BPA Free,12,12-04-2011 17:12,11,16697.0,United Kingdom
547494,22487,"Delta Children 4 Pocket Over The Door Hanging Organizer, Dove Grey",20,23-03-2011 12:08,49,18191.0,United Kingdom
570000,21034,"Opinel Le Petit Chef Complete Box Set (3 Piece Set) Educational Cooking Equipment for Kids with Stainless Steel Chef Knife, Vegetable Peeler, and Child Safety Finger Guard",2,07-10-2011 08:55,44,12420.0,Cyprus
553034,22630,"Kids Table and Chairs Set - Toddler Activity Chair Best for Toddlers Lego, Reading, Train, Art Play-Room (4 Childrens Seats with 1 Tables Sets) Little Kid Children Furniture Accessories - Plastic Desk",5,12-05-2011 20:03,16,17970.0,United Kingdom
557310,85099B,"Disney Pixar Cars 3 Plush Stuffed Lightning Mcqueen Red Pillow Buddy - Kids Super Soft Polyester Microfiber, 17 inch (Official Disney Pixar Product)",7,19-06-2011 15:33,21,13240.0,United Kingdom
C580698,23057,Little Jump 3 Sets Nerborn Receiving Blanket and Headband Set Flower Print Baby Swaddle Wrap Floral Baby Blankets for Girls and Boys.,24,05-12-2011 16:12,14,17426.0,United Kingdom
558370,21244,"Bumkins Silicone Chewtensils, Baby Fork and Spoon Set, Training Utensils, Baby Led Weaning Stage 1 for Ages 6 Months+ in Dark Blue",1,28-06-2011 15:44,24,17750.0,United Kingdom
574052,22653,"Large Premium Knit Baby Swaddle Receiving Blanket""Chip"" by Copper Pearl",1,02-11-2011 13:50,24,16706.0,United Kingdom
552328,22698,"Muslin Swaddle Blanket Set 'Wanderer' Large 47x47 inch | Super Soft Bamboo Blankets | Arrow, Feather and Stars | 3 Pack Baby Shower Gift Bundle of Swaddles for Boys and Girls | 10,000 Wash Warranty",32,09-05-2011 10:03,11,14188.0,United Kingdom
548912,22385,"(317) Assorted Size Gold Polka Dot Decals - Repositionable Peel and Stick Circle Wall Decals for Nursery, Kids Room, Mirrors, and Doors",4,05-04-2011 09:32,24,16586.0,United Kingdom
562042,23192,Zermätte Bassinet Wedge Pillow for Reflux Baby Sleep- for Infant and Newborn Colic & Congestion - Premium Organic Cotton Cover with Skid-Free Bottom - Waterproof Inner Cover - Bonus Storage Bag,4,02-08-2011 10:19,17,13075.0,United Kingdom
565931,48138,"White Crib Skirt Pleated with Lovely Pompoms, Bedding Dust Ruffle for Baby Girls and Baby Boys, 14"" Drop, Fit All Standard Crib Bed,White, Microfiber.",1,08-09-2011 10:35,11,12683.0,France
C574504,22826,"Hudson Baby Super Plush Blanket, Pink Roses, 30"" x 40""",3,04-11-2011 13:20,49,17434.0,United Kingdom
579124,22383,"Llama Bella Premium Nursery Organizer and Baby Diaper Caddy | Hanging Diaper Organizer for Baby Essentials | Hang on Crib, Changing Table, Playard or Furniture | Portable Storage for Wipes (Pink)",4,28-11-2011 12:14,27,15721.0,United Kingdom
556386,23207,"KC Cubs Playtime Collection ABC Alphabet, Seasons, Months and Days of The Week Educational Learning Area Rug Carpet for Kids and Children Bedrooms and Playroom (5' 0"" x 6' 6"")",12,10-06-2011 11:49,54,16668.0,United Kingdom
568791,84031A,"Glintee Unicorn LED Night Lamp Decorative Marquee Signs Battery Operated Light for Party Supplies -Wall Decoration for Living Room,Bedroom(Pink Unicorn Head)",1,29-09-2011 09:51,12,16650.0,United Kingdom
C557249,71459,"Rev A Shelf Designer Series 14 Inch Metal Adjustable Closet Valet Rod, Chrome",1,17-06-2011 15:34,17,16817.0,United Kingdom
567374,21817,"Disney Winnie The Pooh, Ivory, Yellow And Aqua Super Soft Plush Baby Blanket, Ivory, Yellow, Aqua",6,20-09-2011 09:40,9,15341.0,United Kingdom
569211,23084,"Cotton Rope Storage Basket- Large Woven Baskets with Lid and Handles 15"" x 13"" | for Nursery, Laundry, White Round Hamper, Home Living Room Floor, Toy Organizing bins, Blanket, Pillow and Big",12,02-10-2011 12:04,29,15774.0,United Kingdom
562928,21533,"Jay Franco Warner Brothers Harry Potter Plush Stuffed Pillow Buddy - Kids Super Soft Polyester Microfiber, 17 inch (Official Warner Brothers Product)",5,10-08-2011 15:29,11,15494.0,United Kingdom
542239,22481,BRIGHTWORLD Moon Lamp Moon Night Light 3D Printed 7.1IN Large Lunar Lamp for Kids Gift for Women USB Rechargeable Touch Contral Brightness Warm and Cool White,12,26-01-2011 14:35,29,17786.0,United Kingdom
541256,23268,72 Pieces 3D Butterfly Wall Decals Sticker Wall Decal Decor Art Decorations Sticker Set 3 Sizes for Room Home Nursery Classroom Offices Kids Girl Boy Bedroom Bathroom Living Room Decor (Rose Gold),10,16-01-2011 14:36,11,13048.0,United Kingdom
573282,84380,"Learniture Adjustable-Height Active Learning Stool, Black, LNT-RIA3052BK-SO",12,28-10-2011 13:55,133,18030.0,United Kingdom
C540780,22301,"RoomMates RMK2553GM Wall Decal, Multi",96,11-01-2011 11:19,12,14299.0,United Kingdom
