InvoiceNo,StockCode,Description,Quantity,InvoiceDate,UnitPrice,CustomerID,Country
C570004,22424,"Squishmallow Original Kellytoy 16"" Dino The Green Dinosaur Stuffed Animal Pillow Pet Gift Christmas Holiday",2,07-10-2011 09:21,37,13198.0,United Kingdom
537833,21976,"Delta Children 3D-Footboard Toddler Bed, Disney/Pixar Cars 3",16,08-12-2010 14:53,72,13270.0,United Kingdom
537607,22703,"Finezz Window Film for Privacy and Light Protection | Vinyl Sticker Film Creates a Frosted Glass Look |Static Cling | Perfect for Home and Office (17.7'' x 78.7'', Irregular Stripe)",1,07-12-2010 13:18,10,15965.0,United Kingdom
C568420,22553,Pack N Play - Playpen Netting Fits Most Graco - Jeep - Kolcraft and More!,3,27-09-2011 11:17,8,16573.0,United Kingdom
570724,22725,"Guess How Much I Love You Nutbrown Hare Blanky & Plush Toy, 14""",2,12-10-2011 11:22,10,12602.0,France
577056,20675,Pepe's World Felt Baby Diaper Caddy Storage Organizer and Changing Mat - Baby Shower Gift Idea,2,17-11-2011 14:24,8,17985.0,United Kingdom
544102,21984,ClevaMama ClevaFoam Baby Pillow - Breathable Infant Pillow to Prevent Flat Head Syndrome 0-12 month,1,16-02-2011 10:32,19,14665.0,United Kingdom
562053,20728,"aden by aden + anais Disney Swaddle Blanket | Muslin Blankets for Girls & Boys | Baby Receiving Swaddles | Ideal Newborn Gifts, Unisex Infant Shower Items, Wearable Swaddling Set, Graphic Minnie",12,02-08-2011 12:11,33,16701.0,United Kingdom
C557709,21731,"3D Night Lights for Children, Kids Night Lamp, Monster Trucks for Boys, 7 LED Colors Changing Lighting, Car Shape Acrylic Lighting Table Desk Bedroom Decoration, Cool Gifts Ideas Birthday Xmas",1,22-06-2011 10:39,22,15840.0,United Kingdom
554927,23155,"Simmons Kids Oval City Sleeper Bassinet, Grey Tweed",12,27-05-2011 13:00,118,16726.0,United Kingdom
560262,15056N,Sesame Street Toddler Blanket - Elmo & Friends,4,17-07-2011 13:40,20,14224.0,United Kingdom
558999,72128,"Suck.UK SK BOXDINO1 Suck UK-Kids Lunch Box | Toy Storage | Bedroom Decor & Organization | Dinosaur Case, 9.3 x 4.9 x 6.5 in in, Multicolor",60,05-07-2011 12:15,40,15806.0,United Kingdom
572612,22380,Pillow Pets Colorful Pink Unicorn Sleeptime Lite Plush,2,25-10-2011 11:14,29,16186.0,United Kingdom
561617,85061W,"American Baby Company Knit Fitted Crib Sheet Made with Organic Cotton in Sage Color, Soft Breathable, for Boys and Girls",1,28-07-2011 13:05,8,18237.0,United Kingdom
546769,22969,RoomMates Country Apples Peel and Stick Wall Decals,2,16-03-2011 14:57,9,17504.0,United Kingdom
573915,22804,"Jay Franco Minecraft Plush Stuffed Creeper Pillow Buddy - Super Soft Polyester Microfiber, Measures 16 inches x 8 inches (Official Minecraft Product)",2,01-11-2011 15:55,15,15511.0,United Kingdom
577776,22328,"aden by aden + anais Swaddle Blanket | Muslin Blankets for Girls & Boys | Baby Receiving Swaddles | Ideal Newborn Gifts, Unisex Infant Shower Items, Toddler Gift, Wearable Swaddling Wrap, Swans",1,21-11-2011 16:02,12,12504.0,Germany
C540417,22813,"Lullaby Night Light,Music Star Projector,Night Light for Kids,12 Songs,Kids Gifts for 1 2 3 4 5 Years Old,Christmas Gift for 1-15 Years Old (Music&Star-Blue)",24,07-01-2011 10:56,21,13680.0,United Kingdom
562609,85099C,CORRURE 12 Pack Baby Closet Size Dividers (White) - Complete Unisex Nursery Closet Organizer Set - Clothes Age/Size From Newborn to 24 Months and More With 30pcs Extra Stickers - Best Baby Shower Gift,2,08-08-2011 11:55,8,17331.0,United Kingdom
562804,23497,Fantasy Fields - Magic Garden Wooden Kids Bookcase with Hand Crafted Designs and Toy Storage - Pink,2,09-08-2011 14:48,109,13355.0,United Kingdom
549964,21238,Toy Story 4 Toys in Action Toddler Bedding Set Comforter + Sheets (4 Piece),1,13-04-2011 14:12,52,13122.0,United Kingdom
558765,22267,"Travel Pillow for Kids,Unicorn Neck Pillow,Soft Car Seat Sleeping Head Support,Airplane Travel Accessories,Plush Animal U Shaped Cushion,Perfect Unicorn Christmas Birthday Gift for Kids Child (Pink)",1,03-07-2011 13:12,16,17312.0,United Kingdom
576774,22580,Muslin Swaddle Baby Blankets | 100% Cotton Blanket | Super Soft | Beautiful Gift Box Set | 47 x 47 inches | 3 Pack (Prissy & Pink),2,16-11-2011 13:21,23,13131.0,United Kingdom
555492,85099B,Table Lamp Rose Flower Desk Tree Lamp Gift for Girls Women Teens Home Décor for Wedding Christmas Living Room Bedroom Party with 24 Warm White LED Lights |Two Modes: USB/Battery Powered(Black),24,03-06-2011 14:24,22,16967.0,United Kingdom
558912,22806,"Children’s Factory Cube Chair, 15” by 15” by 15” – Red – Versatile - Use as a Low or High Chair, Table and Adult Seat – Durable and Lightweight – Indoor or Outdoor Use (CF910-008)",300,05-07-2011 09:31,48,17024.0,United Kingdom
573150,23319,"FlyonSea Baby Shark Toys Nightlight,Baby Shark Party Supplies 16 Color Changing Kids Night Light with Touch and Remote Control, Kids Shark Decor Lamp Birthday for Kids Boys Baby",2,27-10-2011 20:07,21,15014.0,United Kingdom
553201,22492,"CLOCOR Toy Large Storage Bin-Cotton Storage Basket-Round Gift Basket with Handles for Toys,Laundry,Baby Nursery(Arrowhead)",1,15-05-2011 15:31,12,17758.0,United Kingdom
568181,21080,"Womdee Newborn Lounger, Baby Bed Bouncer for Co Sleeping, 100% Cotton Breathable Honeycomb Shaped Material, Hypoallergenic Removal Cover, Portable Crib for Bedroom/Travel",6,25-09-2011 13:42,29,17154.0,United Kingdom
C554523,84755,"Mermaid 3D Optical Desk Lamp LED Night Light 7 Colors Change Table Light with USB Cable for Home Decoration Household Accessories,Princess Birthday Christmas Gift for Girl Kids or Adult",12,24-05-2011 17:17,15,12863.0,United Kingdom
557560,22795,"Delta Children Bell Top Changing Table with Casters, Grey",12,21-06-2011 10:37,95,15329.0,United Kingdom
569139,22719,"Baby Musical Crib Mobile with Light and 108 Melodies Music Box,Star Projector Function, Remote Control and Hanging Airplane Rattles Rotating,Gift Toy for Newborn",1,30-09-2011 14:55,29,16404.0,United Kingdom
568902,22909,"Disney's Frozen, ""Nordic Love"" Silk Touch Throw Blanket, 46"" x 60"", Multi Color",72,29-09-2011 13:23,16,13503.0,United Kingdom
549319,22809,"Allo Fitted Crib Sheets, 100% Safe Cotton, Soft Breathable Hypoallergenic Sheets for Baby, Fits Standard Crib Mattress and Toddler Mattress (1-Pack, Planet)",24,08-04-2011 10:09,13,16623.0,United Kingdom
541426,21219,"Franco Kids Bedding Super Soft Reversible Comforter, Twin/Full Size 72” x 86”, PJ Masks",3,18-01-2011 08:44,41,18233.0,United Kingdom
549852,22997,"BABYBJORN Travel Crib Easy Go, Anthracite",3,12-04-2011 15:08,249,14289.0,United Kingdom
561638,23120,"Emma & Noah Muslin Swaddle Blankets, Burp Cloths, 4 Pack, 100% Cotton, 31.5 x 31.5 inch, Pink",3,28-07-2011 14:54,12,15118.0,United Kingdom
548176,46776D,"Delta Children 2-in-1 Changing Table and Storage Unit, Grey",6,29-03-2011 14:20,119,13439.0,United Kingdom
549596,23160,"CLOCOR Rectangular Storage Basket,Collapsible Cute Pattern Storage Bin,Waterproof Coating Storage Box with Handles for Home Organization,Toy Organizer,Shelf Basket (Grey Elephant)",2,11-04-2011 11:06,10,14339.0,United Kingdom
570242,82484,Lovey Chew Blanket Crinkle Toy Tag Square Sensory by Baby Jack (Wizard),12,09-10-2011 15:40,14,16380.0,United Kingdom
555111,21034,"Inuan Storage Basket Bins Set 12.6"" L x 12.6"" W x 12.6"" H Waterproof Cube Cotton Linen Collapsible Organizer Bin 3 Pack with Carry Handles for Home Office Closet",2,31-05-2011 14:37,22,16434.0,United Kingdom
C572027,21671,"SQUISHMALLOW 992056 Hans The Hedgehog Pillow Stuffed Animal, 16"", Brown",4,20-10-2011 11:44,19,15754.0,United Kingdom
550645,22754,UniBetter Baby Food Feeder Pacifier 2 PCs Pacifier Clips 2 PCs Baby Feeding Spoons 3 PCs Replacement Silicone Pouches Baby Fruit Teething Toys for Toddlers Infant (Pink Set),1,19-04-2011 16:30,9,16098.0,United Kingdom
551158,22556,"Burritos Wrap Novelty Blanket, Round Tortilla Novelty Throw Food Blanket for Boys & Girls or Adults (A Soft Plush Blanket, Not Thin Towel) - Roll yourself in the Giant Tortilla Blanket (Y, 60 inches)",12,26-04-2011 15:00,13,16823.0,United Kingdom
C554197,21644,"Leakproof Changing Pad Covers, 2 Pack Mint & Elephant Fitted Soft Cotton Sheets",12,23-05-2011 12:14,19,14573.0,United Kingdom
549561,23204,"Beautiful Sky Blue Baby Shower""Mommy To Be"" Sash with Silver Encased Glitter - Baby Shower, Welcome Baby, Baby Sprinkle, It's a Boy - by Dulcet Downtown",2,10-04-2011 13:36,8,13570.0,United Kingdom
551271,22564,"Delta Children Upholstered Chair, Disney Frozen",2,27-04-2011 12:39,49,17187.0,United Kingdom
574022,84997B,"Amazing Baby Muslin Swaddle Blankets, Set of 4, Premium Cotton, Little Village and Trees, Black",6,02-11-2011 12:20,29,12594.0,Italy
568697,22433,Children's Factory Edutray 1188 - Convenient Tray - Fits onto Cube Chair,1,28-09-2011 14:57,68,16281.0,United Kingdom
572071,22705,My Little Pony Mermaid Blanket - Super Soft My Little Pony Fleece Blanket Featuring Three Favorite Ponies - Kids Size for My Little Pony Fans,3,20-10-2011 13:37,26,13366.0,United Kingdom
571408,21307,DaTong Pop-Up Mosquito Net Tent for Beds Anti Mosquito Bites Folding Design with Net Bottom for Babys Adults Trip (79 x71x59 inch),12,17-10-2011 12:22,36,15012.0,United Kingdom
541484,21721,"Angel Line Rebecca Upholstered Swivel Gliding Recliner, Gray Linen with White Piping",-5,18-01-2011 12:46,10,16814.0,United Kingdom
C575158,23159,Funko Pop! Animation: My Hero Academia - Teacher All Might,2,08-11-2011 16:20,21,15251.0,United Kingdom
545519,22224,"3D Moon Lamp (Diameter 5.9 inch), Keenstone 16 Colors 3D Print Moon Light Home Decorative Lights Night Light with Remote & Touch Control and USB Recharge for Baby Kids Lover",6,03-03-2011 12:27,19,16159.0,United Kingdom
569717,23199,BabyPrem Baby Bedding Bassinet Mattress 30 x 15 Inches Quilted,1,06-10-2011 08:25,65,13845.0,United Kingdom
550308,21889,"Sheepskin Rug for Babies from Woolino, 100% Natural Australian Lambskin, Luxuriously Soft Shorn Lambskin Wool, 2 x 3 Feet, Flax",3,17-04-2011 10:57,183,17029.0,United Kingdom
554765,23087,"Angel Line Monterey Glider and Ottoman Cushion, Espresso/Grey",1,26-05-2011 11:38,23,16837.0,United Kingdom
564666,22518,"Universal Baby Bassinet Wedge for Acid Reflux, Spit ups, Colic Relief | Elevated Incline Pillow for Better Night Sleep for Newborn| Washable Cotton and Waterproof| Nursery Safe |",2,26-08-2011 14:51,59,12492.0,Germany
552642,22551,"Koalaty 3-in-1 Universal Baby Travel Bag: Portable Bassinet Crib, Changing Station, and Diaper Bag for Newborns or Infants. The Best for New mom and dad.",1,10-05-2011 13:22,19,14288.0,United Kingdom
571909,85094,sunduck 3pcs Dinosaur Night Light for Kids Illusion Lamp 3 Pattern and 7 Color Change with Remote Control Birthday Gifts for Boys Girls Kids,24,19-10-2011 15:08,20,15006.0,United Kingdom
580982,22266,"Ollvia Large Cotton Rope Storage Basket,Woven Cotton Laundry Basket with Handles, for Baby Nursery Organizer,Cute Cotton Basket for Toy Storage, 22""X 14"" (22"" X 22” X 14"")",2,06-12-2011 16:21,16,17861.0,United Kingdom
568069,22963,"Baby Height Growth Chart Ruler for Kids Room Decor,3D Movable Giraffe Height Ruler Nursery Animal Wall Decals",2,23-09-2011 14:05,17,13336.0,United Kingdom
571939,21114,"Baby Head Shaping Pillow, Flat Head Syndrome Pillow | Head Support for Newborns with Pillowcase, Made of Memory Foam Sleeping Cushion to Prevent Infant Flat Head (from 0+) -Best for Baby Shower/Regi",12,20-10-2011 09:40,19,16260.0,United Kingdom
543537,23051,Scentco Smillows - Scented Stuffed Plush Accent Throw Pillow - Pineapple,6,09-02-2011 13:50,19,12401.0,Belgium
561634,21484,"TILLYOU Crib Skirt Dust Ruffle Double Layer, Microfiber Nursery Crib Toddler Bedding Skirts for Baby Girls, 14"" Drop, Jade Pink",6,28-07-2011 14:34,9,16912.0,United Kingdom
540979,85048,"JesPlay ABC & 123 Gel Clings - Full Alphabet Letters and Numbers Window Clings for Kids - 36 Removable and Reusable Educational Gel Decals for Home, Airplane, Classroom, Nursery Decoration",4,12-01-2011 15:06,42,15727.0,United Kingdom
568211,22365,KOOLDOO 51 Inches Baby Bed Rail Fold Down Safety Bed Guard for Toddlers with NBR Foam Include 1pcs Safety Strap (White),24,25-09-2011 15:59,14,13429.0,United Kingdom
544809,22537,"Bumkins Silicone Chewtensils, Baby Fork and Spoon Set, Training Utensils, Baby Led Weaning Stage 1 for Ages 6 Months+ in Red",1,23-02-2011 15:41,104,16692.0,United Kingdom
578506,85039A,KidKraft Nantucket Kid's Wooden Table & 4 Chairs Set with Wainscoting Detail - Pastel,2,24-11-2011 13:01,27,17458.0,United Kingdom
566581,21213,"Everything Kids Toddler Bedding Set, Under Construction",2,13-09-2011 13:47,8,16081.0,United Kingdom
543342,35653,"Glow in The Dark Stars Moon and Planet Wall Stickers,Kitmate 232Pcs Glowing Stars Stickers Decals for Wall and Ceiling,Perfect for Kids Bedding Room or Party Birthday Gift",8,07-02-2011 12:27,10,17162.0,United Kingdom
562209,85034B,Org Store Premium Arrows Design Changing Pad Cover Set | 100% Cotton Changing Table Pad Cover 2-Pack,2,03-08-2011 13:06,14,13213.0,United Kingdom
562043,20725,"Heavy Weighted Blanket 15 lbs Adults, Kids (48''x78'' Dark Grey) Cotton Better Deeper Sleep Kawaii_Kids",4,02-08-2011 10:19,49,15342.0,United Kingdom
560447,22588,"Anjee Kids Curtains for Girls Room, Foil Print Star Room Darkening Blackout Curtains Window Drapes for Bedroom, W52 x L63 inches, 2 Panels, Baby Pink",6,19-07-2011 09:24,26,13756.0,United Kingdom
551384,22666,"RawGeneration Woven Cotton Rope Storage Basket 15x15x14 Inches | Organic Nursery Hamper Bin and Organizer for Baby Blankets, Toys, Towels and Laundry",3,28-04-2011 11:31,21,15223.0,United Kingdom
571310,23434,21.6” Dog Plush Doll Stuffed Shiba Inu 3D Animal Zoo Pet Throw Pillow Bed Nursery Decoration Baby Play Toy Puppy Shape Sleeping Pillow Gift For Girl Boy,18,17-10-2011 10:17,17,13394.0,United Kingdom
542235,21155,"Orino Waterproof Nursery Nautical Fabric Small Storage Baskets Beach Anchor Theme Collapsible Portable Storage Bins with Handle for Cloth, Toys, Books, Sundries, Set of 3",96,26-01-2011 13:56,12,15661.0,United Kingdom
548267,23176,"KEEPTOP Kids Weighted Blanket with Removable Cover (5 lbs, 36"" x 48"") - Cooling Heavy Blanket for Children 50-100 lbs - Upgrade Version 300TC Cotton, Double Sewing Edge - Helps to Quality Sleep",2,30-03-2011 11:32,39,16954.0,United Kingdom
C545003,17012D,"Night Lights for Kids and Baby with Timer, Star Projector Night Light for Boys and Girls, Projection Lamp for Bedroom",192,25-02-2011 12:46,24,18231.0,United Kingdom
556098,22195,"Bedtime Originals Roar Dinosaur Musical Mobile, Blue/Gray",7,08-06-2011 15:36,39,16832.0,United Kingdom
574677,22457,Flash Furniture 24''W x 48''L Rectangular Red Plastic Height Adjustable Activity Table Set with 6 Chairs,12,06-11-2011 12:32,10,16445.0,United Kingdom
574509,23379,Funko Pop! Disney: Holiday - Winnie The Pooh,1,04-11-2011 13:25,6,16012.0,United Kingdom
546092,21481,Amscan Football Scene Setters Wall Party Decorating Kit,2,09-03-2011 11:54,19,17138.0,United Kingdom
563103,22580,"Carter's Toddler Printed Coral Fleece Blanket, Fire Truck",42,12-08-2011 10:08,5,13873.0,United Kingdom
559318,90134,"Nickelodeon PWPE-S100 Lets Rolling Pin Cutters for Cooking Patr Paw Patrol 3-piece Kids Baking Set for Cookies by Zak! Designs, 0, Boy",1,07-07-2011 14:08,20,18013.0,United Kingdom
536981,23112,"HIDBEA Privacy Window Film Static Cling Non Adhesive UV Blocking Heat Control Reusable Matte Glass Tint for Home Kitchen Bathroom Office, 35.4 inches x 8.2 feet, Frosted, 01",2,03-12-2010 14:26,39,14723.0,United Kingdom
552643,21731,"Lulla Bear Shusher by Alex & Kate - White Noise, Lullabies, and Mom’s Heartbeat Sounds - Nursery Décor & Portable Stuffed Animal Bear with Baby Sleep Soothing Sounds for Toddler Crib to Comfort",8,10-05-2011 13:24,9,16791.0,United Kingdom
537846,22193,"IQUALITE IQ_01 12pcs Diamond Shape Crystal Glass 30mm Knob Pull Handle Usd for Cabinet, Drawer, Clear",6,08-12-2010 15:25,27,15347.0,United Kingdom
C537132,22295,"Disney Finding Dory 4 Piece Toddler Bedding Set, Blue/Orange/Yellow",1,05-12-2010 12:29,34,15221.0,United Kingdom
548548,15056P,"Jay Franco Disney Cars 3 Piece Twin Sheet Set, Classic",100,31-03-2011 19:54,17,17781.0,United Kingdom
549837,22736,Mickey Minnie Mouse Kids Room Decor Disney Wall Sticker Cartoon Mural Decal Home 1pc,6,12-04-2011 13:38,10,16705.0,United Kingdom
540815,22629,Newborn Receiving Blanket Headband Set Babys Swaddle Receiving Blankets for Girls Boys,1,11-01-2011 12:55,31,15749.0,United Kingdom
569901,82580,"Storage Basket with Cotton Rope Handle, Collapsible Storage Bins Set Works As Baby Storage, Toy Storage, Nursery Baskets 6Pack (Grey&White)",1,06-10-2011 16:20,22,12923.0,United Kingdom
577521,20914,Baby Monthly Milestone Blanket |Double Sided + Wreath Frame| Growth Month Blanket - Best Shower Gift for Newborn Girl & Boy - Floral Age Photo Props Backdrop - 2 Layer Soft Fleece Large 50 x 40,1,20-11-2011 13:23,7,16411.0,United Kingdom
554157,22782,Disney Princess Little Mermaid Ariel Shimmer and Gleam Slumber-Bag,2,23-05-2011 11:33,29,18283.0,United Kingdom
570230,72801C,"Modern Baby Changing Table with Laundry Hamper, 3 Storage Baskets, and Pad",1,09-10-2011 13:41,98,18088.0,United Kingdom
576791,22653,"Edison Kids Flat Edge Spoon & Grooved Fork Set with Case (Kids, Giraffe Green/Blue Set)",24,16-11-2011 13:59,13,17896.0,United Kingdom
567302,85036C,Goldblue 2 Pcs Mini Hanging Storage Bag Cotton Linen Small Storage Basket Decor Bin Bag for Wall Door Closet,12,19-09-2011 13:02,7,15058.0,United Kingdom
545718,23302,"11"" Plush PATIENT BEAR - FEEL BETTER Gift/Wearing Blue Hospital Gown & Slippers/Holding GET WELL SOON Pillow/ILLNESS/Sick CHILD/CHEER UP/Surgery",4,07-03-2011 10:22,13,12614.0,Germany
548862,20712,"UPINS 284 PCS Glow in Dark Stars Stickers, Glowing Stars, Moon and Meteors for Ceiling and Wall Decals, Good Choice for Kids Bedding Room or Party Birthday Gift",12,04-04-2011 13:47,11,17956.0,United Kingdom
555213,85014B,HomeSmart Products Weighted Throw Blanket for Adults & Kids - 7 lbs 40x60 - Throw Blanket Perfect for The Couch Or for Children - Washable Blanket,96,01-06-2011 12:22,39,13094.0,United Kingdom
569575,21206,"Big Red Rooster White Noise Machine - Sound Machine For Sleeping & Relaxation - 10 Natural and Soothing Sounds - Plug In Or Battery Powered - Portable Sleep Sound Therapy for Home, Office or Travel",10,05-10-2011 10:37,19,16106.0,United Kingdom
550655,23244,"Zack & Ali Organic Toddler Pillowcase, Rocketships, 13-Inch-by-18-Inch",1,19-04-2011 17:19,9,17217.0,United Kingdom
542107,22286,"Woolino Organic Cotton Baby Sleep Bag or Sack, Infant Sleeping Bag Wearable Blanket, 0-3 Years",1,25-01-2011 13:38,39,16222.0,United Kingdom
541948,21164,SHINYTIME Canvas Storage Baskets Bins Star Style Laundry Baskets Room Organizer for Kids Pets Toy Home Laundry Room Closet (Star-2pcs),18,24-01-2011 12:00,49,15820.0,United Kingdom
537022,85184C,Bedtime Originals Snoopy Sports Blanket,10,03-12-2010 15:45,34,12725.0,Italy
555572,22976,Slim Design Baby Closet Dividers for Baby Clothes - Set of 8 Flower Baby Clothing Size Dividers from Newborn Infant to Toddler - YardieBaby Clothes Dividers and Nursery Closet Organizer Gift,6,05-06-2011 15:37,11,12449.0,Belgium
554125,21914,"Crib Bumpers Pads for Baby, Breathable Machine Washable Baby Crib Bumper Liners for Girls, Safe & Soft Baby Crib Padding 4 Pieces/Set, Pink",4,23-05-2011 08:52,7,13885.0,United Kingdom
C571051,21931,Muslin Swaddle Blankets for Baby Girls and Boys - Organic Cotton and Bamboo - Set of 4 Softest Baby Swaddling Blankets - Unisex Newborn Baby Shower Gift Idea - X-Large 47 x 47 Inches Receiving Blanket,10,13-10-2011 13:49,29,14626.0,United Kingdom
577951,21212,"Halo Snoozypod Vibrating Bedtime Soother, White",2,22-11-2011 12:09,25,17238.0,United Kingdom
556190,85150,JURUOXIN 49 Pieces/Set Dog Paws Wall Decals Vinyl Pawprints Sticker Animal Footprint Wall Art Decoration for Kids Boy Girl Baby Nursery Bedroom Living Room Animal Tracks Decor YMX21 (Black),10,09-06-2011 12:01,55,15780.0,United Kingdom
577133,20749,"Baby Head Shaping Pillow for Flat Head Prevention, Head Support, Heart Shaped, Made of Ventilated Organic Cotton and Memory Foam, Ergonomic Design",12,18-11-2011 08:47,9,13962.0,United Kingdom
574914,85123A,"HOMEVAGE Baby Diaper Caddy - Diaper Organizer, Tote Bag, Nursery Storage Bin for Changing Table, Portable Car Travel Organizer, Baby Shower Gift Basket for Baby Essentials, Large Size",5,07-11-2011 16:16,13,17109.0,United Kingdom
569632,22569,Beautyonline Glow in The Dark Moon Wall Decals 20cm Wall Sticker Luminous Sticker at Night Removable Adhesive Wall Decal for Kids Boy and Girl Bedroom,1,05-10-2011 11:57,14,13808.0,United Kingdom
574040,23480,"Nickelodeon's Teenage Mutant Ninja Turtles, ""Tough Turtles Blues"" Fleece Throw Blanket, 45"" x 60"", Multi Color",6,02-11-2011 13:01,3,14974.0,United Kingdom
C567717,23329,"Artscape 01-0124 Etched Glass Sidelight Window Film 12"" x 83""",3,22-09-2011 10:20,13,15601.0,United Kingdom
C566445,21756,Simplay3 Sibling Step Stool - 2 Sided Extra Wide Sit and Stand Multiple Height Lightweight Anti Slip Step Stool for Children,1,12-09-2011 15:35,11,14286.0,United Kingdom
556909,22028,"SwaddleDesigns Cotton Muslin Swaddle Blankets, Set of 4, Hedgehog, Dark Gray and Sterling",1,15-06-2011 13:23,34,17536.0,United Kingdom
576787,21058,"Double Sided Baby Monthly Milestone Blanket Large 60""x40"" |Photography Backdrop | Photo Prop for Newborn Girls & Boys | Perfect Baby Shower Gift for New Moms |Premium Quality Ultra Soft Fleece Blanket",25,16-11-2011 13:54,23,13815.0,Germany
552192,23569,"Rabbitgoo Window Film 3D Decorative Glass Film, No Glue Privacy Frosted Film for Home Office, Anti-UV Window Sticker, Reusable Static Cling Window Decals, Bamboo Pattern, 23.6 x 78.7 inches",5,06-05-2011 14:16,22,15258.0,United Kingdom
559523,85175,"DaVinci Jenny Lind 3-in-1 Convertible Portable Crib in White - 4 Adjustable Mattress Positions, Greenguard Gold",1,08-07-2011 17:19,179,13955.0,United Kingdom
556486,21121,"Delta Children Figural Upholstered Kids Chair, Disney Mickey Mouse",4,12-06-2011 13:22,64,17422.0,United Kingdom
547963,22624,"JUST FUNKY Sonic The Hedgehog Fleece Blanket, 45 X 60 Inch",3,28-03-2011 15:42,29,13037.0,United Kingdom
547874,84880,"Baby Waterproof Bed Pad Organic Cotton Mattress Protector Reusable Incontinence 4 Protective Layers Ultra Absorb Sheets for Infants Kids, Size 39.5”x23.8”",24,27-03-2011 15:39,26,14476.0,United Kingdom
581149,22945,Philips Disney Frozen Portable Children Kids Bedside Table Lamp,19,07-12-2011 14:12,16,15471.0,United Kingdom
577026,23199,"Dream On Me Ashton 5 in 1 Convertible Crib, Black",1,17-11-2011 12:55,126,17237.0,United Kingdom
575757,20756,Niuniu Daddy Cellular Baby Throw Blanket Fuzzy Fluffy Soft Warm Crib Fleece Blanket Cozy Toddler Infant Newborn Girl Boy Bedding (Purple),10,11-11-2011 10:49,7,17295.0,United Kingdom
566623,47566,Cotton Organics Muslin Swaddle Blankets - Extra Soft and Hypoallergenic Organic Cotton - Pack of 2,4,14-09-2011 09:31,22,12756.0,Japan
559044,21484,"Dream On Me Full Size 2 in 1 Folding Stationary Side Crib, White",2,05-07-2011 15:37,189,17306.0,United Kingdom
539313,84755,"TL Care 100% Natural Cotton Swaddle/Thermal Blanket, Blue, Soft Breathable, for Boys and Girls",12,16-12-2010 18:18,7,14220.0,United Kingdom
C558097,37495,Double Wings 96 x Pcs 3D Butterfly Wall Stickers Colorful DIY Removable Art Decor Crafts for Nursery Classroom Offices Kids Girl Boy Baby Bedroom Bathroom Living Room Magnets and Sponge Glue 8 Color,4,26-06-2011 13:29,12,15532.0,United Kingdom
554951,22363,Natemia Extra Soft White Muslin Swaddle Blankets | Large 47 x 47 inches (2 Pack)| Lightweight and Breathable Premium Bamboo/Cotton Baby Swaddle Wrap | Great Baby Shower Gift,6,27-05-2011 14:48,23,16323.0,United Kingdom
570653,22608,Funko Pop! Disney: Nightmare Before Christmas - Witch,2,11-10-2011 13:49,8,14710.0,United Kingdom
568223,35911A,"Bloomsbury Mill - 4 Piece Toddler Comforter Set - Outer Space, Rocket & Planet - Blue - Kids Bedding Set",10,26-09-2011 10:16,34,12412.0,Denmark
549247,21126,Wooden Ruler Growth Charts Ruler for Boys and Girls (Love Grows Gray),1,07-04-2011 12:04,39,13752.0,United Kingdom
C571507,22544,"Moon Lamp, LOGROTATE (Diameter 4.7 inch) 3D Printing LED Night Light Lunar Moon Light with Stand and Warm & Cool Two Colors and Dimmable & USB Rechargeable for Kids Lover Birthday Day Gifts",6,17-10-2011 15:24,14,13919.0,Denmark
576077,23020,"Baby Crib Set 4 Piece, Crib Sheet,Quilted Blanket, Crib Skirt & Baby Pillow Case Grey Bamboo Design Combo",12,13-11-2011 16:22,59,16720.0,United Kingdom
555872,23298,Decowall DA-1701A Uppercase Alphabet ABC Letter Kids Wall Decals Wall Stickers Peel and Stick Removable Wall Stickers for Kids Nursery Bedroom Living Room,1,07-06-2011 15:04,14,13395.0,United Kingdom
536526,21755,"Homfa Toddler's Toy Storage Organizer with 9 Multiple Color Plastic Bins Shelf Drawer for Kid's Bedroom Playroom, White Rack",1,01-12-2010 12:58,39,14001.0,United Kingdom
575509,22573,"Elegant Baby Premium 100% Cotton Knit Blanket, White Texture Knit, 30"" x 40""",6,10-11-2011 10:32,29,17101.0,United Kingdom
542859,22743,"Pomeat Hanging Mesh Space Saver Bags Organizer 4 Compartments, Mesh Hanging Storage Organizer Toy Storage Space Saver Bags for Kid Room, Blue",12,01-02-2011 11:42,6,13606.0,United Kingdom
557330,22403,"Large Premium Knit Baby Swaddle Receiving Blanket""Lunar"" by Copper Pearl",12,20-06-2011 10:20,24,14291.0,United Kingdom
552951,22149,Munchkin Soft-Tip Infant Spoon - 6 Pack by Munchkin,6,12-05-2011 12:05,7,14988.0,United Kingdom
579143,21462,ElecMotive Jungle Wild Animal Vinyl Wall Sticker Decals for Kids Baby Bedroom (Owl Monkey Bear),2,28-11-2011 13:08,8,13882.0,United Kingdom
572351,22457,"Artscape 01-0122 Etched Glass Window Film, 36-by-72-Inch",1,24-10-2011 11:38,28,15516.0,United Kingdom
