product_description,product_price
Women Multiway Padded Push Up Bra Seamless Underwire Deep U Plunge Bra,28
Body Shaper for Women Tummy Control Shapewear High Waist Cincher Thigh Slimmer Seamless Firm Control Panties,14
Women Lingerie Halter Chemise Lace Babydoll Mesh Nightwear V Neck Teddy Sleepwear,29
Adjustable Camisole for Women Spaghetti Strap Tank Top Camisoles,15
Swimwear One Piece Plus Size Swimsuits for Women Tummy Control with Skirt Cover Ups,16
Self Expressions Women's Convertible Push Up Bra with Lace Bra,20
Women's Mock Neck Party Dress,23
Womens Casual Sleeveless Spaghetti Strap Sexy Jumpsuit Rompers Wide Leg Pants,18
"Women's Polar Fleece Jacket, Amazon Exclusive",20
Women's Constant Lightly Lined Demi Racerback Bra,6
Women's Curvy Stretch Microfiber Unlined Bra,15
Elite Max Cushion - No Show Tab - Athletic Running Socks for Men and Women,19
Women's Loose Fit Side Slits Tank Tops,28
Women's Casual High Waist Bow Knot Skirt Printed Ruffle Mini Skirt,16
Women's 3-Pack Long Sleeve Flowy Tunics,6
Women's Casual Short Sleeve T Shirt Dress V Neck Loose Plain Knot Dress,19
Women's Wintergear Compression Baselayer Long Shirts,22
Signature Women's Capri Solid Brushed Leggings Mid/High Waist,15
Women's Authentic Short,63
"Puremove Sports Bra, Black, Medium/Large",16
"Puremove Sports Bra, Black, Medium/Large",31
Women's Truliberty Bra,22
"Puremove Bra, Black, X-Small/Small",83
"Women'S Puremove Bra, Mineral Mist, X-Large",23
Women's Classy Scoop Neck Striped Retro Swing Dress,60
Women's Comfort Support Maternity Wirefree Seamless Nursing Bra,19
Women's Curvy Floral Lace and Mesh Bralette,28
Women's Tunic Summer Short Sleeve Top Loose V Neck Dressy Shirt Blouse,18
Women's Summer Maxi Dress Floral Print Casual Long Dresses with Pockets,38
Women's Bathing Suits One Shoulder Cutout One Piece Swimsuit Swimwear Monokini,18
"Women's Bamboo Dress Socks Crew Business Casual, 3 Pairs, Shoe Size: 6-9/9-12",28
"Cotton Pajamas for Women - Womens PJ Sets, Pullover",4
Pure Color Satin Short Silky Bathrobe Sleepwear Nightgown Pajama,9
Women's Bikini Shirt Cover Up Short Sleeve Cute Bikini Print Cover-Up Baggy T Shirt Dress Fun Wear,13
Seamless Firm Control Shapewear Bodysuits Fajas Compression Garments 125lbs Body Briefer,18
Women's Plus Size Tunic Swing T-Shirt Dress Long Sleeve Maxi Dress with Pockets,13
"Women's Regular Pantyhose with Reinforced Panty and Toe, Pack of 6",34
Cowl Neck Tunics Long Sleeve Patchwork Form Fitting Casual A-Line Top Blouse,39
Women's Lace Underwear Birefs Soft Hipster Panties Comfort Bikini Underwear for Ladies,5
Women's Light-Support Tie Halter Bikini Swimsuit Top,15
Womens Renaissance Shirt Short Sleeve Ruffled Off Shoulder Boho Chiffon Tops,6
Women's Floral Lace Short Bridesmaid Dress Cap-Sleeve Wedding Formal Party Dress,16
Women's Dresses-Summer Spaghetti Strap Sleeveless Cocktail Party Casual Button Down Midi Dress Blue Black Stripe,29
Women's Off Shoulder Blouse Loose Batwing Sleeve Tops,34
Women's Hoodies Long Sleeve Floral Pullover Casual Sweatshirt with Pockets,18
Women's Plus Size Pintucked Flannel Shirt,27
Women's Sun Protective UPF 50+ Cooling Long Sleeve Mock Neck Shirt - 80000,19
Women Sexy Clubwear Mesh Sheer See Through Long Sleeve Crop Tops,21
Women’s Bathing Suit Kimono Beach Cover Up Lace Crochet Pool,32
Women's 2 Pack Yoga Activewear Jogger Capri Cropped Sweat Lounge Pants,10
Women's Cotton Slub V-Neck Sleeveless Tank Top,15
Women's High Waist Tummy Control Workout Running 4 Way Stretch Yoga Shorts Side Pockets,16
Women's Scalloped Tipped Sock 4 Pack,14
Women's Tennis Golf Skorts Workout Built-in Shorts Fitness Pleated Active Running Skirts,21
Women Thigh High Socks Knit Over Knee High Stockings Girls Tall Long Boot Leg Warmers,26
Women's Classic Straight Jeans,34
Women Waist Cincher Girdle Tummy Slimmer Sexy Thong Panty Shapewear Postpartum Underwear,18
Amazon Brand - Lark & Ro Women's Crepe Knit Faux Wrap Dress,27
Men/Women Luxurious Plush Kimono Bathrobe with Side Pockets,14
Women's OL Casual Mermaid Hips-Wrapped Pencil Skirts,21
Womens Wide Low Back Converter (M4002),3
Women's Comfort Revolution Brief Panty (3-Pack),19
Amazon Brand - Lark & Ro Women's Ruffle Sleeve Fit and Flare Dress,14
Women's Plus-Size Elbow-Cinch Sleeve Hanky Hem Top,44
Womens Cold Shoulder Tops 3/4 Sleeve Twist Knot Tunic Tops Casual T Shirt,64
Women's Boyshort Panties Comfortable Cotton Underwear Pack of 5 OR Pack of 2 OR Pack of 3,96
Women's Casual Basic Blouse Short Sleeve Drawstring Summer High Low Shirt Blouse Top,9
Womens Sherpa Pullover Fuzzy Fleece Sweatshirt Oversized Hoodie with Pockets,14
Tennis Skorts for Women Golf Skirts with Pockets Athletic Sports Running Active,19
Women's Backless Long Tank Backless Yoga Shirts Workout Shirts Cover up Long Tank Summer Casual T Shirts,22
Womens Hooded Cardigans Button Up Cable Knit Sweater Coat Outwear with Pockets,4
Women's Island Goddess Lattice Front Strappy Back Halter One Piece Swimsuit,13
Womens Summer Giraffe Printed T-Shirt Funny Cute Animal Graphic Tees Tops,12
Women Summer Deep V Neck Sleeveless Hem Ruffles Crop Tops,45
Women's Glossies Sheer Bra,26
Women Lace Lingerie Sleepwear Chemises V-Neck Full Slip Babydoll Nightgown Dress,119
Women's Laced & Plain/Lace Bras (Packs of 6) - Various Styles,13
Women's Scrubs Set Stretch Ultra Soft Contrast Pocket,17
Women's Beach Swimsuit Cover up Deep V-Neck Short Mini Dress Beach Skirt,13
Women Leopard Cardigan Long Open Front Sweaters Oversized Loose Knit Coat Draped Jackets with Pockets,14
"Montreal Women's Knee-Length Down Puffer Coat, Fill Power 700",26
Women's Casual Slim Fitted Basic Long Sleeve Solid Crop Tee Top,59
Women's Scoop Neck 3/4 Ruffle Detailed Sleeve Floral Tops Blouse,1
Women's S-5XL Long Duster Maxi Casual Soft Bamboo Cardigan Sweater - Made in USA,15
Women's Fairfax High Rise Ankle Skinny Jean,20
Women's Slim Fit Casual Full-Zip Hooded Lightweight Long Sleeve Sweatshirt,37
Women's Actvie Skort Sport Skirt for Running Tennis Golf Workout Casual Skirts for Women,27
Women's Chiffon Long Pant Bikini Bottom Cover up High Split Beach Trouser Beachwear,29
Women's Designed-2-Move Track Jacket,7
One Shoulder Sports Bra Workout Yoga Bra Sexy Cute Medium Support,17
Women Embroidered Half/Long Sleeve Swimsuit Cover Up Mini Beach Dress,33
Western Owl Outfitters Merino Wool Women's Long Sleeve Top |Crew Neck Shirt | Lightweight | Moisture Wicking | Base Layer,38
Women's Studio Basics Tight,184
Women Solid Casual Work Trousers High Waist Ruffle Bow Tie Pants,300
Faux Leather PU Elastic Shaping Hip Push Up Pants Black Sexy Leggings Women,11
Women's Rayon Bandage Bodycon Mini Skirt,14
Women Short Sleeve Casual Loose Fit Long Pant Jumpsuits Romper with Belt,13
Women's Arrowood Triclimate Jacket,18
Women's Short Sleeve Patchwok Floral Dress Dresses with Pockets,19
Women's Skinny Mid Rise Jeans,39
"Sweatproof Undershirt for Women with Underarm Sweat Pads (Slim Fit, Scoop Neck)",49
"Women's GenFlex Junior-Fit V-Neck Scrub Shirt, Ceil Blue, Small",19
Women's Plus Size Flex Motion Regular Fit Straight Leg Pant,28
Women Vintage 1920s Dresses Floary Beaded Cocktail Flapper Dress with Sleeves Gatsby Party,9
Women's Basic Cotton Crewneck O-Neck Short Sleeve Loose Casual T-Shirts,22
Women's Vintage Cocktail Party Half Sleeve Boat Neck Swing Dress,14
Women's Halter A-Line Cocktail Party Skater Dresses Keyhole Neck,17
Women Off Shoulder Romper Strapless Floral Print Striped Beach Shorts Jumpsuit,28
Unisex Ankle Copper Antibacterial Moisture Wicking Golf/Running Socks,139
"Amazon Brand - Core 10 Women's (XS-3X) 'Icon Series' The Warrior Mesh High Waist Yoga Legging -28""",13
Pettipants Nylon Culotte Slip Bloomers Split Skirt 4-inch Inseam,19
Women's Plus Size Cold-Shoulder Dress Side Ruched Skirt,19
Women Long Sleeve Round Neck Blouse Color Block Striped Casual Tops T Shirt,35
Women Casual O-Neck Leopard Patchwork T-Shirt Knits & Tees,49
Women's Casual Button Down Front Knot Knit Sweaters Shirts Henley Long Sleeve V Neck Tunic Blouse Tops,10
Women's Sleeveless Easy Care Button Front Woven Shirt,54
Women's Casual Button Down Front Knot Knit Sweaters Shirts Henley Long Sleeve V Neck Tunic Blouse Tops,8
Women's Sleeveless Easy Care Button Front Woven Shirt,18
American Flag Patriotic Leggings and Bracelet Bundle,13
Women's Sexy Bodycon Spaghetti Strap Cami Slip Under Mini Dress,16
Women's Cotton Linen Dresses Plus Size Summer Roll-up Sleeve Baggy Sundress with Pockets,14
"Women's Fleece Pant Open Leg Sweatpants, Regular S - 2XL",7
Cardigan Sweaters for Women 3/4 Sleeve Open Front Knit Cardigan Casual Sweater,12
Amazon Brand - Daily Ritual Women's Military Cargo Jacket,22
Dress for Women Short Sleeve Knee Length Dress with Front Slit,34
"Seamless Pump&Nurse Nursing Bra with Built in Hands-Free Pumping Bra and Removable Soft pad Inserts - Nude, L",11
Click to see price,26
Women Printed Button Top - Long Sleeve Loose Blouses,21
Womens Tummy Control One Piece Swimsuit Front Cross Colorblock Bathing Suit,39
Amazon Brand - Daily Ritual Women's Jersey 3/4-Sleeve Bateau-Neck T-Shirt Dress,22
Leopard Prints Button Down Open Front Lightweight Shirt Cardigans Sweater,6
Women's Long Sleeve Casual T Shirt Leopard Print Round Neck Blouse Tunic Tops,20
Women's 3-Pack Racerback Cross Straps Sports Bra with Removable Pads,18
Raincoats Waterproof Lightweight Rain Jacket Active Outdoor Hooded Women's Trench Coats,26
Women's Curvy Skinny Jeans,20
Women's Shaped T-Back Sport Bra,22
Women's Gothic Jacquard Shoulder Straps Tank Overbust Corset Bustiers,23
New Balance,14
Women's Casual Sleeveless Button-Down Shirts Basic Camisole Crop Tank Tops,9
Women's Essentials Seven Inch Bike Short,18
High Waist Cotton Power Flex Leggings - Tummy Control,2
Women Tomboy Lesbian Breathable Cotton Elastic Band Colors Chest Binder Tank Top (M-6XL),29
Women's Elegant Lace Short Sleeve Sexy Keyhole Blouse Shirt,19
Women's Perfect Pant with Wide Waistband,32
Women's Solid Scallop Hem Round Neck Short Sleeve Blouse Tops,12
Lace Halter Neck Padded Bralette – Bras Caged Double Crisscross Back Straps Strappy Gentle Seamless with Removable Pads,49
Women's Daywear Solutions Half Slip 11711,23
Women's Spaghetti Strap V Neck Floral Print Split Beam Foot Pants Jumpsuit Rompers,28
Letter Funny O Neck Women T Shirts Top,20
Women's Cross Block with Lining One-Piece Swimsuit,12
"5 Pairs Womens Lightweight Cotton Casual Crew Knit Socks Solid Color,Size 5-10 A504",12
Women's Casual Cotton Linen Baggy Pants with Elastic Waist Relax Fit Lantern Trousers,21
Women's Casual Kimono Bell Sleeve Patchwork Stripe Loose Fit V Neck Pullover Sweater Knitted Tops Blouse Cardigan,24
Women Waist Trainer Corset Weight Loss Slimming Neoprene Sauna Sweat Vest Workout Body Shaper Tank Top,19
Cardigans for Women - Short Sleeve Womens Open Cardigan Sweaters,34
Women's 4 Pairs Adorable Thigh High Cotton Socks LW1024 Size 6-9,5
Women's Winter Super Soft Warm Cozy Fuzzy Fleece-lined Christmas Gift With Grippers Slipper Socks,18
Women's Plus Size Sport Knit Straight Leg Pant,15
Salome 0321 Butt Lifter Shapewear Control BBL Shorts Fajas Colombianas Levanta Pompis/Cola,16
Women's Logo Jogger Sweatpant Lounge Pant Bottom Pajama Pj,18
Womens Strapless Asymmetric Slit Front Evening Party Wedding Maxi Dress,19
Ladies' Long Sleeve Oxford Shirt,14
MystiqueBra Women/Girls Reveal Cleavage Galore Adhesive Silicone Bra Cups Breast Enhancers,15
Plus Size Underwire Bra for Women's Push up Bra Set of 6 Pack of Sexy Full Cup Bra,9
High Impact Seamless Sports Bra Women Yoga Bra Running Crop Tops Workout Fitness Activewear Racerback Sports Bras,22
Womens Plus Size Swimwear Ruffled Bikini off Shoulder High Waist Swimsuit,22
Women's Cold Shoulder Cute Tops Short Sleeve Knot Twist Front Tunic T Shirt,26
Women's Ease in to Comfort Fit Modern Classic Cuffed Capri,9
Women's Stripe Printing Strappy Cross Padding Bikini Set Beach Swimwear Bathing Suit,16
Women's V-Wire Padded Ribbed High Cut Cami Bikini Set Two Piece Swimsuit,32
Basic Long Sleeve Open Front Cardigan (S-XXXL) - Made in USA,24
Essentials Womens Seamless Briefs 4-Pack Panties,28
Women's Casual Classic Bodycon Pencil Skirt,11
Women's Clara Balconette Lace Bra,18
Women's Sexy Backless Short Sleeve Top Back Knot Casual Shirt Tee,15
Women's Plus-Size Versailles Seamless Underwire Bra,18
Women's Seamless Wirefree Zipper Front Racerback Sports Bra with Removable Paddings,17
Women's Shapewear Lace 'N Smooth Brief,38
Women's Long Sleeve Pleated Loose Swing Casual Dress,6
Women's Short Sleeve T-Shirt Dress Off Shoulder Casual Lip Printed Midi Dresses,19
"Womens Premium Long Sleeve Turtleneck Lightweight Pullover Top Sweater (S-3X, Made in USA)",32
Womens Casual Turtleneck Chunky Sweaters Pullover Oversized Batwing Sleeve Loose Knitted Baggy Slouchy Jumper,67
Women's Long Sleeve Wrap V-Neck Leotard Jumpsuit Bodysuit,7
Sheer Mesh Transparent Socks Women - Lace Ultrathin Fishnet See Through Ankle Sock,15
Women Long Sleeve Plaid Shirt V Neck Casual Loose Pocket Button Down Shirts,21
Women's Tame Your Tummy Shaping Lace Thong with Cool Comfort,44
Essentials Women's 3-Stripes Fleece Joggers,8
Women's Swim Beach Dress Deep V Neck Open-Back Beach Cover Up Beach Skirt,35
Women's Cotton V Neck Long Nightgown Sleeveless Full Slip Night Dress,13
Women's Plus Size Lace Pant Set,56
Women Shapewear Slimmer Body Shaper Hi-Waist Tummy Control Compression Butt Lifter Panties Girdle,16
Women's No-Iron Linen Side-Button Tunic,19
Women's Low Rise Thong 5 Pack,3
Women's Power Conceal-Her Mid-Thigh Short,25
Women's Active Lounge Yoga Capri Pants with Pockets,8
"Women's Silver Ridge Pull On Pant, Breathable, UPF 50 Sun Protection",15
Women Casual 1/4 Zip Sweatershirt Long Sleeve High Collar Pullover Tunic Top with Pocket,16
Women’s One Piece Swimdress Solid Push Up Skirtini Cover Up Vintage Swimsuit,34
Women Lace Babydoll Teddy Underwear Black,12
Women's Long Sleeve Boho Tops Tie Neck Embroidered Detail,24
Women's Loose Casual Tunic Sweatshirts Dress Hoodie Pullover Tops with Pockets,10
Womens Lace Lingerie Underwear Bikini Panties Assorted Color Hipsters,10
No Pinching No Problem Cotton Lace Hi-Cut Panty,21
Cold Shoulder Long Sleeve Tops for Women Sexy Lace-up Chiffon Casual Loose T Shirt,9
Women's Cooling Touch Full Figure Wirefree Bra 71355,32
Womens Baseball Tee Long Sleeve Raglan Shirt Crew Neck Striped Tunics Casual Blouses Tops,27
Women's Signature Lace Boyshort Panty,12
Sleeveless Waterfall Jersey Cardigan Lightweight Draped Layering Vest,17
Womens Ain't No Laws When You’re Drinking Claws Day Drinking T Shirt Funny Vintage Spray Graphic Tees Tops,19
Women's Active Casual Zip-up Hoodie Jacket Long Sleeve Comfortable Lightweight Sweatshirt,21
Women's Plus-Size Underwire Padded T-Shirt Bra,70
Women Casual Boho Plus Size Summer Maxi Dresses Polka Dot/Floral Printed Adjustable Strappy Dress with Pockets,89
Women's Fashion Ruffle One Shoulder Sleeveless Midi Bodycon Cocktail Party Dress,9
Women’s One Piece Swimdress Solid Push Up Skirtini Cover Up Vintage Swimsuit,33
Women Lace Babydoll Teddy Underwear Black,37
Women's Long Sleeve Boho Tops Tie Neck Embroidered Detail,10
Women's Loose Casual Tunic Sweatshirts Dress Hoodie Pullover Tops with Pockets,14
Womens Lace Lingerie Underwear Bikini Panties Assorted Color Hipsters,17
No Pinching No Problem Cotton Lace Hi-Cut Panty,12
Cold Shoulder Long Sleeve Tops for Women Sexy Lace-up Chiffon Casual Loose T Shirt,20
Women's Cooling Touch Full Figure Wirefree Bra 71355,11
Womens Baseball Tee Long Sleeve Raglan Shirt Crew Neck Striped Tunics Casual Blouses Tops,18
Women's Signature Lace Boyshort Panty,7
Sleeveless Waterfall Jersey Cardigan Lightweight Draped Layering Vest,17
Womens Ain't No Laws When You’re Drinking Claws Day Drinking T Shirt Funny Vintage Spray Graphic Tees Tops,15
Women's Active Casual Zip-up Hoodie Jacket Long Sleeve Comfortable Lightweight Sweatshirt,22
Women's Plus-Size Underwire Padded T-Shirt Bra,18
Women Casual Boho Plus Size Summer Maxi Dresses Polka Dot/Floral Printed Adjustable Strappy Dress with Pockets,71
Women's Fashion Ruffle One Shoulder Sleeveless Midi Bodycon Cocktail Party Dress,12
Women's Autumn Winter Long Lantern Sleeve Knitted Bodycon Tie Waist Pencil Sweater Dress,19
Women's Casual Lace Crochet Cardigan 3 4 Sleeve Sheer Cover Up Jacket Plus Size,18
Seamless Laser Cut Breathable Sports Womens Panty Underwear Small to Plus Size,45
Women's Long Sleeve Turtleneck Casual Loose T-Shirt Dresses,12
Women's Bikini Bottoms Ruched Swim Bottoms Full Coverage Swim Briefs,19
Women's Knee Strapless Bandage Bodycon Party Dress,7
Women's Blissful Benefits Ultrasoft Wirefree Bra Bra,15
Women's Baseball Quarter Sleeve Tee Shirt,24
Womens Yoga Workout Tops Mesh Open Back Loose Fit Athletic Shirts,15
Women's Reg Sheer Lace Cheeky,45
Womens Bring On The Sunshine Graphic Tees Letter Printed Casual Loose Summer T-Shirt,7
4 Pairs SPORTS No Show Socks Women Cotton No Show Socks Sports Liners,21
Summer Short Sleeve Office Button Down Blouse Stripe Shirt Tops with Bow Tie BP573,21
"Nippleless Cover, 20 Pairs Self-Adhesive Disposable Bra Gel Petals Pad Pasties (Beige 10 Pairs + Black 10 Pairs)",23
Women's Basic Short Sleeve Stretchy Bodysuit Leotard Tops,15
Women Chiffon Blouse V Neck Work Tops Casual Printed Short Sleeve Shirts,20
Women Business Suit Set for Office Lady Two Pieces Slim Work Blazer & Skir,14
Solid Flounced Sleeves Cold Shoulder V Neck Elegant Sexy Party Evening Midi Dress Bodycon Dress,26
Women's Swimsuit Bottoms Tummy Control High Waist Ruched Swim Briefs Bikini Tankini Shorts,3
Women's Perfect A Full Figure Wireless Padded Bra #3010 (A Cup Only),22
Women's Maternity Nursing Tops Short Sleeve Modal Breastfeeding Shirt,12
Women's Running Shirt Full Zip Workout Track Jacket with Thumb Holes,18
Women's Plus Size Perfect V-Neck Three-Quarter Sleeve Tee,13
AuntTaylor Womens Cardigans Solid High Low Long Sleeve Boho Open Front Blouses Cardigans,16
YourStyle Women Open Front Long Sleeve Classic Knit Cardigan,39
Plus Size Queen Soft Sheer Pantyhose- 2 or 6 Pairs,58
Women's Juniors Basic Legendary Stretch Bootcut Denim Jeans,13
Womens Soft Bamboo Viscose Adjustable V Neck Full Slip Dress,38
Women's Sleeveless Tank Dress Basic Scoop Neck Bodycon Midi Dress,8
Women's V Notch Sleeveless Ribbed Knit Basic Cami Top,13
Women's Tunic Tops for Leggings Oversized Shirts Casual Batwing Long Sleeve Loose Pullover Tops Tunics,19
"12 Colors Lady Lace Clip-on Mock Camisole Bra, 12 Colors, Size One Size",18
The Bravely Labor and Delivery Gown - The Perfect Hospital Gown for Maternity/Hospital/Nursing,29
Womens Color Block Raglan Long Sleeve Lightweight Tunic Sweatshirt Tops,4
Women's Plus Size Perfect V-Neck Long Sleeve Tee,20
Women's Sunny Floral Print Lace One-Piece Swimsuit,13
Women's Elastic Waist Ballet Layered Princess Mesh Tulle Midi Skirt,17
Sexy and Sweet Short PJ Set for Women 543188,28
Women's Juniors' Team Shorty Shorts,15
High Cut Halter Deep V Neck Lingerie Floral Lace Bodysuit Plunge Teddy See Through Sexy Babydoll,29
Women's Performance Sport,21
Women's Summer V Neck Cap Sleeve Chiffon Casual Flowy Blouse Shirts,9
Women's Peplum Tops Loose fit Round Neck Casual Tee Shirts,35
Women's Summer Button Down V Neck Strappy Tank Tops Loose Casual Sleeveless Shirts,12
Women's Modern Essential Zip Front Roll Sleeve Blouse,19
Women's Sexy Strapless Bodysuit One Piece Triangle Off Shoulder Leotard,54
Women’s Short Sleeve Floral Lace Elegant Cocktail Party A-Line Mini Dress,16
Women V Neck Long Sleeve Polo Shirt,19
Women's Casual Loose Long Dress Short Sleeve Floral Print Maxi Dresses with Pockets,14
Women Maxi Sleeveless Dress Plus Size Pockets Loose Swing Tank Tunic Dress White/Red,18
Women's Butt Lifter Shaper Seamless Tummy Control Hi-Waist Thigh Slimmer,16
Womens Summer Casual Adjustable Spaghetti Straps Sleeveless Sundress Split Beach Midi Dress,19
Women Leopard Print One Piece Swimsuit Swimwear Bandage High Cut Monokini Bathing Suit,39
Women's Short Sleeve Waisted Slim Fit Midi Dress,118
Amazon Brand - Mae Women's Lace Racerback Bralette with Removable Pads (for A-C cups),9
Women's Spotlight On Lace Bodysuit,14
Womens 3/4 Sleeve Tie Front High Waist Thong Bikini Set 2 Piece Swimsuit,13
Rayon Crepe Short Dress with Multicolored Embroidery,29
Women's Beach Cover Up Lace Tassel Chiffon Swimsuit Bikini Swim Coverups,29
Women's Basic Slim Fitted Short Sleeve Casual V Neck Cotton T Shirt,7
Women's Draped Open-Front Long Sleeve Light Weight Cardigan (S~3XL),21
Women's Plus Size The Authentic Short,14
Women’s Summer Striped Short Sleeve V Neck Button Down Belted Swing Midi Dress with Pockets,27
CozyChic Lite Circle Cardi,7
Women's Bootcut Yoga Pants with Pockets High Waist Bootleg Yoga Workout Pants for Women,11
Womens High Waisted Front Button Retro Vintage Pin up Sailor Shorts Pockets,9
Women Perspective Stripe Print Tassel Swimsuit Cover Up Dress Kaftan Bikini Swimwear Cover-Ups,19
Women's Plunging V Neck Halter Swim Tops Shirred Tankini Top,12
Women's Long Sleeve Open Front Chunky Oversized Knitted Sweater Cardigan,19
Plus Size Unlined Underwire Lace Bra with Padded Shoulder Straps-2PK,18
Women's Stretchy High Waisted Wide Leg Button-Down Pants,18
"Half Slips Anti Static for Women Underskirt with Lace 36""",51
Women's Leopard Print Button Down Lightweight Open Front Shirt Cardigans,125
"Women's Jeans Sock (Pack of 3), One Size",19
Womens Square Neckline Long Sleeve Floral Print Mini Dress,29
3 Piece Athletic Tankini Swimsuit for Women Sport Swimwear with Boyshort,7
Women's Classic Collar Long Sleeve Curved Hem Pullover Sweatshirt,17
"Women's Essentials 5 Pair Microfiber Crew socks, Black",9
Designs Women's Bali Double Support Front Close,11
Women's Plus Size Long Floral Print Cotton Gown,14
Plus Size Unlined Underwire Lace Bra with Padded Shoulder Straps-2PK,20
Women's Stretchy High Waisted Wide Leg Button-Down Pants,28
"Half Slips Anti Static for Women Underskirt with Lace 36""",11
Women's Leopard Print Button Down Lightweight Open Front Shirt Cardigans,28
"Women's Jeans Sock (Pack of 3), One Size",16
Womens Square Neckline Long Sleeve Floral Print Mini Dress,19
3 Piece Athletic Tankini Swimsuit for Women Sport Swimwear with Boyshort,17
Women's Classic Collar Long Sleeve Curved Hem Pullover Sweatshirt,21
"Women's Essentials 5 Pair Microfiber Crew socks, Black",7
Women's Plus Size Long Floral Print Cotton Gown,3
"Bra Discs Nipple Covers - Blush, Non-Adhesive & Reusable",24
Women's Underwear Elance String Bikini - 6 Pack,25
Women's Plus Size Printing Padded High Waist Swimdress,26
Vintage Classy Floral Sleeveless Party Picnic Party Cocktail Dress,9
Women's Workwear Core Stretch Mock Wrap Scrubs Shirt,21
Women's One Shoulder Short Puff Sleeve Self Belted Solid Blouse,30
Women Tiger Print Novelty Sweatshirt Casual Long Sleeve Loose Pullover Shirt Tops,21
2019 Sexy One Piece Swimsuit Women Swimwear Female Solid Bikini Thong Backless Monokini Bathing Suit,49
Women's Contrast Trimmed Solid Medical Scrub Set Mock Wrap Top and Cargo Pants,19
Women's Coat Casual Lapel Fleece Fuzzy Faux Shearling Button Warm Winter Oversized Outwear Jackets with Pockets,36
"Petal Top Disposable Nipple Covers 15 Pair, Beige, One Size",24
Women Lace Shirt Plain Casual Short Sleeve White Zip Up V Neck Cotton,28
"Women's 3"" Mesh Short with Pockets, Amazon Exclusive",5
Women's Pro Tights,28
High Waisted Bikini Set for Women Swimsuits Push Up Tie Knot Swimwear Two Piece Bathing Suits,13
Women's Strappy Jumpsuits Overalls Casual Harem Pants Wide Leg Low Crotch Loose Trousers,32
Open Front Cardigan Women's Long Sleeve Drape Hem Sweater Casual Lightweight Loose Fit Tops,16
Women's Casual Dresses Short Sleeve V Neck Twist Knot Summer T Shirt Dress,11
Womens Shirts Square Neck Ruched Babydoll Tops Short Sleeve Empire Waist Tunics Peplum Summer Tops Blouses,15
Women's Soft Knit Palazzo Wide Leg Pant (Petite and Standard Sizes),8
Women's 2pk Compression Low Cut Socks,16
Women's Plus Size Summer Lightweight Breathable Full Length Leggings,10
"Trendy Womens Loungewear Pants with Luxurious Soft Fabric and Adjustable Elastic Waistband - Garden, Awake Break",20
Women's Basic Ultra Soft Fleece Solid Crew Neck Sweatshirt,13
Women's Swimwear One/Two Piece Swimsuit Skirtini Swimdress with Boyshort/Bikini Bottom,32
Women Plus Size Long Sleeve Round Neck Cotton Linen Loose Long Kaftan Dress M-4XL,21
Women's Great Shapes High Waist Tight,9
Amazon Brand - Daily Ritual Women's Cozy Knit Hooded Pullover,19
Women's Tulle Short Applique Beading Formal Homecoming Cocktail Party Dress,9
Women's Plus Size Floral Blouses Henley V Neck Button Up Tunic Tops Ruffle Flowy Short Sleeve T Shirts,12
Women 'S Sexy Deep V Plunge Sleeveless Cut Out Bodycon Bandage Cocktial Party Dresses,33
Women's 724 High Rise Straight Jeans,101
Prom Dresses Long Split Off Shoulder Ball Gowns for Women Formal Wedding Evening Dress,9
Women V Neck Short Sleeve Wrap Tie Waist Button Front Shirt Dress Striped Dress with Pocket,26
Non Skid Slip Sticky Grippers Socks Pilates Ballet Barre Yoga Socks for Women,10
Womens Wool Socks Warm Winter Vintage Knit Boot Crew Socks,23
Women's Casual Sleeveless Cut Out Back Summer Halter Cami Top,7
Sexy Two Piece Shorts Set - African Floral Jumpsuits Rompers Vacation Club Outfit,26
Sexy Two Piece Shorts Set - African Floral Jumpsuits Rompers Vacation Club Outfit,18
Women's Nursing Sports Bra with Racerback,25
Women's Audrey Seamless Wire Free Comfort Day Bra,16
Lingerie for Women Teddy One Piece Lace Babydoll Bodysuit,80
NCAA Women's Relaxed Henley Tank,17
Women Lingerie Bodysuit Embroidered Lace Teddy with Choker One Piece Babydoll,34
Womens High Waisted Bikini Set Two Piece Swimsuits Gingham Tie Knot Bathing Suit,2
Women's Plus Size Lace Trim Pintucked Tunic,12
Women's Suede Moto Jacket Outerwear,28
Amazon Brand - Goodthreads Women's Wool Blend Jersey Stitch Cocoon Sweater,9
Women's Jean-ish Ankle Leggings,15
Women's How Perfect Full Figure Wire Free Bra,7
