product_description,product_price
Amazon Brand - Daily Ritual Women's Jersey Short-Sleeve Scoop Neck T-Shirt Dress,16
Women's New Englander Waterproof Rain Jacket,8
Women Long Sleeve Bolero Shrug Knit Cropped Knitwear Cardigan Sweater Shrug Bolero Jackets,16
Women's Basic Sleeveless Tube Top Sexy Strapless Bodycon Midi Club Dress,17
Women Summer Casual Spaghetti Strap Adjustable Waist Drawstring Short Jumpsuit Cami Romper for Girl,71
MBJ Womens Long Sleeve Open Front Long Cardigan - Made in USA,21
Women's Sexy Criss Cross High Waisted Cut Out One Piece Monokini Swimsuit,24
Bra-llelujah Full Coverage Back Smoothing Support Bra For Women,17
Swimsuits for Women Two Piece Bathing Suits Ruffled Flounce Top with High Waisted Bottom Bikini Set,19
Women’s Sexy One Shoulder Hips-Wrapped Bodycon Party Pencil Dress,7
Women's Long Sleeve Leopard Color Block Tunic Comfy Stripe Round Neck T Shirt Tops,13
Women's Maternity Nursing Tank Top Sleeveless Comfy Breastfeeding Clothes,14
Women's Tie Dye Letter Print Crop Top T Shirt,17
Womens Short Sleeve T-Shirt Sequined Tops O-Neck Funny Graphic Tees Blouse,37
Women's Cotton Tank Top,88
by Bali Women's Beautiful Support Lace Minimizer,39
Women's Casual Jumpsuits Overalls Baggy Bib Pants Plus Size Wide Leg Rompers,23
Women's Casual Polka Dot Roll Tab Long Sleeve Blouse,30
Women's Lace Up Boned Overbust Corset Bustier Bodyshaper Top,19
Women's Long Mock Dress,18
Women's 6 Pack Comfort Covered Cotton Hipster Panties,41
Women's Short-Sleeve Waisted Maxi Dress,62
Women's Crewneck Sweatshirt,7
Denim Women's Juniors Distressed Slim Fit Stretchy Skinny Jeans,19
Maternity Elegant Fitted Gown Cross-Front V Neck Ruched Slim Fit Maxi Photography Dress,22
Women's Full-Zip Polar Fleece Vest,36
Luxurious Quality High Waisted Leggings for Women | Workout & Yoga Pants Plus,19
MBJ Womens Faux Leather Zip Up Moto Biker Jacket with Stitching Detail,3
Women's V-Neck Solid Button Tops Long Sleeve Knit Casual Cardigans,13
Raincoats Waterproof Rain Jacket Active Outdoor Detachable Hooded Women's Trench Coats,39
Women's 2019 Off Shoulder Side Split Slim Evening Maxi Party Dress,49
Grey's Anatomy 4153 Women's Mock Wrap Scrub Top,9
Women Sleeveless Boat Neck High Low Cocktail Skater Swing Dress,24
Women Feathers Bra Contour Plunge 730023,41
Women's Look at Me Now Seamless Leggings,44
Women's Long Sleeve Half-Zip Sun Protection Rashguard Side Adjustable Swim Shirt,17
Women's Reg Floral Lace Cheeky,24
Women's Short Sleeve Colorblock Button Down Sundress Knee-Length Flared A-Line Casual Party Swing Dress,16
Organic Cotton Shelf Bra Camisole Tank Top,51
Women's Dream Cotton with Lace Boyshort,32
Women's Short Bride Bridesmaid Kimono Robes for Wedding Party,34
Womens Shirts Casual Tee Shirts Long Sleeve Patchwork Color Block Loose Fits Tunic Tops Blouses,24
Amazon Brand - Goodthreads Women's Cotton Half-Cardigan Stitch Mock Neck Sweater,130
Women's Summer Sleeveless Button Up Casual Loose Tank Tops Tunic Shirts Blouses,49
Women's Floral Print Boho Yoga Pants Harem Pants Jogger Pants,144
Women's Vintage 1920s Fringed Gatsby Sequin Beaded Tassels Hem Flapper Dress,23
Women's Oncore High-Waisted Mid-Thigh Short,18
Women’s Crew Neck Ruched Stretchy Tulip Hem Bodycon Short Mini Dress T Shirt Sheath Dresses,19
Women's 2 Piece Outfit Summer Striped V Neck Crop Cami Top with Shorts,27
Rain Jackets Women Lightweight Raincoat Striped Lined Waterproof Windbreaker Active Outdoor Hooded Trench Coats,16
Women's Summer Cotton Half Sleeve Casual Loose Bohemian Floral Tunic Dresses,17
Women's Maternity Tops Short & Long Sleeve Side Ruching Round Neck Shirt,6
Women's Sleeveless Racerback Loose Plain Maxi Dresses Casual Long Dresses with Pockets,48
Women's Plus Size 7-Day Knit Wide Leg Pant,9
Women's Cushioned Athletic Ankle Socks,16
Women's Heathered Jersey Short,9
Womens Halter Swimdress Plus Size Two Piece Swimsuit Tankini Set,18
Women's Fuzzy Fleece Hoodie Long Sleeve Zip Up Hooded Sweatshirt Sherpa Pullover Hoodies Outwear Coat with Pockets,35
Heirloom Cap Sleeve Tee USA Made Extra Length Layering Comfy Slim Fit Womens Tshirt,17
Women's Summer Casual Ruffle Sleeve V-Neck Button Down A-Line Swing Dress,14
Women's Elegant High Neck Short Sleeves Lace Cocktail Party Dress,15
Sport Women's Cool DRI Performance Tee,29
Women's X-Temp Polo with FreshIQ,36
Women's Premium Pleated Maxi Wide Leg Palazzo Pants Gaucho- High Waist with Drawstring,66
Womens Lightweight Hooded Waterproof Active Outdoor Rain Jacket S-XXL,138
Women's Off Shoulder Swing Dress Party Picnic Dress,9
Women's Bathing Suit Adjustable Back Lace-up Bandeau Bikini Set,20
Womens Swimsuits 2 Pcs Brazilian Top Thong Bikini Set High Waisted Bathing Suits for Women,9
Women's Pajama Lounge Pants Floral Striped Polka Dot Print Comfy Casual Stretch Palazzo Bottoms Pants Wide Leg,26
"Women's Roll Tab Sleeve Tunic, Perfect Long for Leggings Shirt Cute Versatile Top",9
Women's Jumpsuits Casual Long Rompers Wide Leg Baggy Bibs Overalls Pants S-5XL,41
High Waisted Soft Capri Leggings for Women-Tummy Control and Elastic Opaque Slim-One/Plus Size 20+Design,23
High Waisted Soft Capri Leggings for Women-Tummy Control and Elastic Opaque Slim-One/Plus Size 20+Design,4
Amazon Brand - Daily Ritual Women's Slouchy Pullover Top,36
Women Casual Short Sleeve Long Sleeve Side Button T Shirt Blouse Top Plus Size,25
Women's Letter Print Long Sleeve Crop Top Sweatshirt Hoodies,9
Women's Relaxed-Fit Bermuda Short,18
Women's Body Caress Full Coverage Wirefree Bra 72335,12
Women Post-Surgical Sports Support Bra Front Closure with Adjustable Straps Wirefree Racerback,18
Women's Idol Underwire Molded Balcony Bra,16
Womens Underwear Pack Seamless Hipster Panties Ladies Bikini No Show Panty Lines,54
Women's High Waist Dress Pants,16
Dress Pants for Women Stretch Pull-on Pants Ease into Comfort Office Ponte Pants,74
"Women Seamless Premium Classic Tank Top, Made in U.S.A, One Size",18
"Women's 6 Pack Runner Socks, Grey White Black, 9-11",13
Canvas 6400 - Relaxed Short Sleeve Jersey T-Shirt,142
Women's Silk Reflections Thigh-High Stockings,3
Women's Flowy Kimono Cardigan Open Front Maxi Dress,13
Women's Casual Baggy Overalls Jumpsuit with Pockets,4
Womens Casual V Neck Shirt Boho Print Short Sleeve Tops Loose Blouse (S-XXL),25
Women's Energy 3-Pack Control Top Reinforced Toe Panty Hose,27
Women's Pure Color Silk Kimono Short Robes for Bridesmaids and Bride,14
Women's 6-Pack Quick Dry Breathable Seamless Thong Panties Underwear,12
Womens Floral Print Button Down Collar Long Shirt Dress Blouse Mini Dress,3
Womens Button Down Shirts Long Sleeve Regular Fit Cotton Stretch Work Blouse,23
Women's High Waist Stretch Bodycon Pencil Skirt,5
Premium Soft Cotton Spandex Jersey Leggings - High Yoga Waistband - Regular Plus Size - Capri and Full Length,22
Women's Renaissance Lace Up Vintage Boned Bustier Corset with Garters,15
Boho Bliss!,21
Women's Everyday Basic Comfort Lightly Padded Underwire Plunge T-Shirt Bra,20
Women's Yoga Pant Running Workout Leggings with Pocket Tummy Control High Waist,22
Women Hoodies-Tops Floral Printed Long Sleeve Drawstring Sweatshirt with Pocket,8
"Womens Seamless Sleep Nursing Bra,Breastfeeding Maternity Bra with Remove Bra Pads Extenders Pack of 3",21
Absolute Sports Bra With SmoothTec Band,11
Womens Button Up Printed Long Wide Leg Pant Party Jumpsuits with Belt,15
086 Fajas Colombianas Postparto Levanta Pompis Bra Shapewear Waist Slimming Girdles for Women,9
Women Off Shoulder Ruched Metallic Knit High Slit Evening Party Cocktail Dress,11
Women's 3-in-1 Waterproof Ski Jacket Interchange Windproof Puffer Liner Warm Winter Coat Insulated Short Parka,22
Women's Ease in to Comfort Fit Classic Bootcut Pant w/Tummy Control,26
Length 1 - Quick Wrap Athletic Cover-up That Multitasks as The Perfect Travel/Summer Skirt,21
Women's Short Sleeve Tunic Dress V Neck Ruffle Loose Mini Dress Swing Shift Dresses,28
Women's 50's Retro Ruched Tankini Swimsuit Top with Ruffle Hem,14
Vintage Tea Dress 1950's Floral Spring Garden Retro Swing Prom Party Cocktail Dress for Women,20
Women's Skinny Slimming Jeans,9
Women's 501 Shorts,15
Women's Floral Kimono Cardigan Summer Loose Shawl Chiffon Beach Blouse Cover up,8
Lightweight Long Waffle Kimono Unisex Spa Robe,29
Women Casual Batwing Sleeve Crew Neck Long Pants Loose Wide Legs Jumpsuits Overalls,24
Amazon Brand - Mae Women's Uplift Plunge T-Shirt Bra,32
Invisible Adhesive Bra 2 Pack Sticky Bra Reusable Push up Invisible Women Bra Drawstring Silicone Bras,27
Amazon Brand - Mae Women's Uplift Plunge T-Shirt Bra,22
Invisible Adhesive Bra 2 Pack Sticky Bra Reusable Push up Invisible Women Bra Drawstring Silicone Bras,11
Women's High Waisted Swimsuit Bikini Bottoms Tummy Control Tankini Bottoms Swim Shorts Plus Size,16
Women's Maternity Dress Nursing Nightgown for Breastfeeding Nightshirt Sleepwear S-XL,12
Women's 6-Pack Performance Cotton Cushioned Athletic Ankle Socks,22
"Women's Regular & Plus Size Stretch Cotton Long Leg 6.5"" Boyshort Briefs",13
Women's Sexy Detachable Padded Cutout Push Up Striped Bikini Set Two Piece Swimsuit,15
Women's Fully Lined 4 Button V-Neck Economy Dressy Suit Vest Waistcoat,26
Women's Casual T Shirts Cotton Mid Sleeve Basic Tunics Tee Tops Solid,32
Lingerie Women Role Play Costume Mini Plaid Skirt Schoolgirl Outifts,13
Women's Double-Support Wire-Free Bra #3820,22
Women's Round Neck Summer Casual Plus Size Fit and Flare Midi Dress with Pocket,21
Women Plus Size Swimwear One Piece Swimsuits Ruffled Flounce Off Shoulder,25
Lite Women's V-Neck Ombre Reform Scrub Top,7
Women's Casual Sherpa Fleece Lightweight Fall Warm Zipper Vest with Pockets,19
Womens Long Sleeve V Neck Casual Loose Tshirts Hoody Tops,8
Women's Bounce Control Wirefree High Impact Maximum Support Sports Bra,13
Women Lightweight Cardigan Leopard Printed Button Down Cardigans Shirt W Pockets(S-2XL),14
Women's Sleek Fit Yoga Crop Pant,99
"Women's Flat Knit Crew Sock, 3 Pair Pack",22
Women's One Piece Skirt Swimsuit Ruched Retro Swimdress Bathing Suit,26
No Show Socks 7 Pack Cotton Non Slip Low Cut Invisible Loafer Socks Men&Women Boat Liner 6-9/10-12/12-14,22
"Cotton Active Running Bike Leggings-Athletic Exercise Yoga Walking 7""/3"" Shorts",28
Push Up Strapless Sticky Adhesive Invisible Backless Bras Plunge Reusable Magic Bra for Women,29
Lace Dresses Women Crochet High Waisted Solid Color Elegent Ruffle Short Dress,41
Womens Casual 3/4 Sleeve Color Block T-Shirt Blouses Back Lace Striped Tops Tee Shirts,25
Women's Shirred Halter One Piece Swimsuits Macrame Back Swimwear Tummy Control Bathing Suit,31
Womens Leopard Print Long Skirts Drawstring High Waisted Bohemian Maxi Skirt,8
Women's Plus Size Perfect Polo Shirt,17
Akstore 6 Pieces Women's Soft Comfortable Elastic Bra Extenders Bra Extension Strap 2 Hook 3 Row Lady's Bra Extender Bra Band (Multicolors),24
Womens Sleeveless V Neck Dress with Pocket Summer Beach Midi Flared Tank Dress,9
Women's No Panty Line Promise Tactel Hip Brief,20
1950's Bowknot Vintage Retro Polka Dot Rockabilly Swing Dress,16
Women's Turn Down Shawl Collar Earth Tone Check/Black White Grid/Black/Plum/Cream/Pink Wool Blend Coat,47
Halter Bikini Set with Boyshort Push Up 2 Piece Swimsuit Bating Suit for Women,5
3 Pieces Women's Floral Lace Tube Top Bra Bandeau Strapless Bras Seamless Stretchy Chest Wrap,30
"Yoga Pants,BESTENA Womens Leggings with Pockets High Waist Tummy Control Workout Running Pants",34
Women Scrunch Butt Yoga Pants Leggings High Waist Waistband Workout Sport Fitness Gym Tights Push Up,9
Women's Solid Soft Stretch Longline Long Sleeve Open Front Cardigan,14
Womens Shirts Halter Neck Racerback Tank Top Summer Casual Basic Tee Shirts,8
Warner's,12
Women's Midi Skater Skirt Flared Stretch Skirt for Women Reg & Plus Size - Made in USA,12
Women's Sleeveless Chiffon Tank Top Double Layers Casual Blouse Tunic,13
Women's Bikini Hign Cut Leopard Print One Piece Monokini Swimsuits Backless Thong Bathing Suits,29
Women's Tie Neck Short Sleeve Ruffle Hem Cocktail Party Dress,9
Women's Autumn Winter Long Sleeve Zipper Sherpa Fleece Sweatshirt Pullover Jacket Coat,17
Women's Nylon Striped Tights,23
"Women's Long Sheer Floral Kimono Cardigan, Chiffon Bikini Beach Cover up, Summer Blouse Loose Tops",29
Nightdress Womens Cotton Sleepwear Short Nightgowns Knit Sleepshirts S-XXL,11
"Women's 21""/23""/25"" Yoga Capri Pants Flare Workout Bootleg Crop Leggings",21
Women's Short Sleeve Striped Crop T-Shirt Casual Tee Tops,19
Women's Summer V Neck Strappy Cami Tank Tops Casual Loose Sleeveless Shirts Blouses,29
Women's Shirring Design V-Neck Low Back One Piece Swimsuit,5
Women's Long Sleeve Loose Plain Dresses Casual Short Dress with Pockets,12
Women's Ease Into Comfort Above The Knee Stretch Pencil Skirt 19 inch,17
"High Waisted Leggings -10+Colors -Soft Slim Pants for Women w Hidden Inner Pocket, Reg&Plus Size",17
Women's Lace Nightgowns Sexy Honeymoon Lingerie for Bride Full Slip Mesh Negligee Dress,24
Women's Casual Round Neck Floral Print T-Shirt Top Chiffon Long Sleeve Tops Blouse,29
Women's Lightweight Vee Cardigan Sweater,16
Women Boho Chevron Striped Floral Printed Summer Sleeveless Tank Long Maxi Party Dress,20
Women's Chiffon V Neck Bell Sleeve Casual Loose Shift Party Mini Short Dresses,24
Women's Nursing Shaping Foam Wirefree Bra,10
Women's 6pk Sports Bras,19
Waist Trainer Corset for Weight Loss -Faja Colombiana Latex Waist Trimmer Belt Waist Cincher Slimming Waist Shaper,8
Women's Short Sleeve Tunics Shirt Floral Pleated Front Mesh Blouses Tops,17
Women's Plus Size Curvy Signature Lace Unlined Underwire Bra W/Added Support,9
Women's Underwear Illumination Brief Panty 13109,16
Women's A-Line Swing Trapeze Midi Dress,22
Womens Blouson Striped Printed Strappy T-Back Push up Tankini Top with Shorts,19
Women's Full Figure Wonderwire Lace Bra #9845,12
Women's Fall Long Sleeve Side Split Loose Casual Pullover Tunic Tops,20
Women Stretch Denim Mini Skirt Jean Skirts,10
Extra Long Cotton Thigh High Socks Over the Knee High Boot Stockings Cotton Leg Warmers,33
Canvas Unisex Jersey 3/4 Sleeve Baseball Tee,14
Open Back Lingerie Lace Babydoll Sleepwear Plus Size,33
Women Sexy One Piece Swimsuits Halter Plunge V Neck Cutout Swimwear,19
Queen.M Women's Sexy Bodysuit Leopard Spaghetti Strap Cami Leotard Top Sleeveless Bodycon Jumpsuit Onesie Romper,26
Women's Dress Summer Floral Long Sleeve Off Shoulder Casual Mini Dresses,18
Women's Sexy V Neck Floral Printed Side Slit Two-Piece Maxi Dress,28
Women's 6-Pack Turn Cuff Sock,12
"6 Pairs Over Knee Thigh Socks Knee-High Warm Stocking Women Boot Sock Leg Warmer High Socks for Daily Wear, Cosplay",30
Women's Give-N-Go Sport Mesh Hipkini,5
Women's Yellow and Leaves Print Lace Bikini Set,20
"Women's Bandeau Bra, Basic Layering Seamless Bra Crop Tube Top Bandeau Strapless Brarette",19
Women's Striped Button Down Open Front Long Sleeve Contrast Color Casual Cardigans Sweaters,24
DPO Women's Vintage Collared Pleated Button Down Shirt Long Sleeve Lace Stretchy Blouse,3
Monokini Swimsuit for Women One Piece Bathing Suits Tummy Control Cutout,26
5 Pairs Women's Wicking Cushion Cotton Crew Outdoor Multi Performance Trekking Walking Sports Athletic Hiking Socks Year Round,27
Women's Jean Look Cotton Blend Jeggings Tights Slimming Full Lenght Capri Bermuda Shorts Leggings Pants S-3XL,86
Women's Sport Full Figure Wirefree Bra 71500,14
Women’s Slim Fit Lightweight Full Zip Up Yoga Workout Jacket,18
Women's Comfort Front-Close Sports Bra,26
Summer Beach Maxi Dresses for Women Off The Shoulder Floral Boho Sundresses,27
Women's Mile High Skinny Super Jeans,16
Slip Lingerie Sexy Chemise Nightgown Babydoll Soft Sleepwear S-XXL,6
Womens Waffle Knit Tunic Blouse Tie Knot Henley Tops Loose Fitting Bat Wing Plain Shirts,73
1920s Vintage Inspired Sequin Embellished Fringe Long Gatsby Flapper Dress,29
Women Full Slips Cotton Blend V Neck Straight Dress Nightwear,39
Women's Dresses Floral Print Deep V-Neck Short Bell Sleeve Ruffle Wrap Tie Knot Fishtail Short Dress,3
"Neoprene Sweat Vest for Women, Slimming Body Shaper with Adjustable Waist Trimmer Belt, Weight Loss",17
"Prime Amazon Day, Womens Shapewear Bodysuit High Waist Tummy Control with Butt Compression Shorts",15
Ultralite Compression Running Socks for Men & Women (2 Pairs),17
Juniors Homecoming Dresses Short Beading Satin Prom Dresses Open Back 107,11
Women's Cute Juniors Tops Teen Girl Tee Funny T Shirt,20
Smart & Sexy Women's Swim Secret Convertible Push-up Bikini Top,16
"High Waist Squat Proof 9"" Biker Shorts with Side Pockets for Women",7
Women's Plus Size Striped Henley Tunic,12
Women’s 4-Way Stretch 5” Swim Shorts Boardshorts,48
Tanst Women Summer Sleeveless Damask Print T-Shirt Dress with Pockets(S-3XL),66
Women's Slightly Lined Lift Support Invisible Seamless Plunge Strapless Bra,10
Women's Princess Tank Leotard,18
Women's Color Block Plaid Shirt Crew Neck Elbow Patches Pullover Sweatshirt Top,46
Long Sleeve Hoodies for Women Womens Button Neck Pullover Drawstring Pullover with Pocket,18
Women's Catherine Boyfriend Jean,28
Women's Vintage Ruffle Floral Flared A Line Swing Casual Cocktail Party Dresses,17
"Women's Saturday Trail II Knee Pant, Water & Stain Resistant",34
Women's Play It Cool Wire-Free Contour Bra with Lift,19
Women's French Terry Fleece Sweatpant,33
Women's Black One Piece Bathing Suit Ruched Tummy Control Swimsuit,14
Women's Solid Basic Open Front Pockets Knit Sweater Cardigan,26
Womens Dresses Summer Floral Spaghetti Strap Sundress Button Down Swing Midi Dress with Pockets,23
Women's Breast Shapers,12
Women's Long Sleeve Color Block Cute Shirt Round Neck Casual Tops,29
Women's Sexy Deep V Neck Short Sleeve Striped Wrap Ruffle Hem Pleated Mini Dress with Belt,11
Womens Plus Size Tops V Neck Wrap Short Sleeve Shirts Casual Loose Dolman Top Tunic Blouses,23
Womens Waterproof Long Raincoat Ladies Lightweight Hooded Rain Coat Outdoor Hiking Breathable Rain Jackets S-XXL,55
Women's Off Shoulder Batwing Sleeve Ribbed Shirt Loose Pullover Tops,56
Women Butt Lifter Shapewear Hi-Waist Tummy Slimmer Thong Panty Seamless Body Shaper Shorts,78
Womens Halter Neck Chiffon Tunic Tank Dress T Shirt Dresses,89
Pack of 5 Womens Vintage Winter Soft Warm Thick Cold Weather Knit Wool Casual Cozy Crew Socks,12
Women's V Neck Strappy Embroidery Tank Tops Loose Casual Sleeveless Shirts Blouses,24
Women's Plus Size Long Sleeve Tee,19
Active Women's Golf/Tennis Everyday Casual Athletic Skort with Bike Shorts,133
Women's Vintage Rockabilly Petticoat Skirt Tutu 1950s Underskirt,15
Womens Tank Tops Adjustable Strap Camisole with Built in Padded Bra Vest Cami Sleeveless Top for Yoga Daily Wearing,49
Women's 6 Pack Sporty Boyshort Panty,18
Amazon Brand - Lark & Ro Women's Crepe Knit Short Sleeve Center Twist Dress,9
Women's Casual Sleeveless Halter Neck Party Lace Mini Dress,26
Women Summer Short Sleeve Loose T Shirt Babydoll Peplum Tee Tops Casual Blouse Shirts,9
Women's Halter Neck Floral Summer Dress Casual Sundress with Pockets,52
Women Short Sleeve Solid Color Bodycon Tight Ruched Wrap T Shirt Mini Short Dress,8
Women's V Neck Tankini Set Criss Cross Back Tankini Top with Bikini Bottom Two Piece Bathing Suits,19
Women's Thinstincts High-Waisted Mid-Thigh Short,27
Women's Plus Size Thinstincts High-Waisted Mid-Thigh Short,18
Women's Summer Cold Shoulder Tunic Top Swing T-Shirt Loose Dress with Pockets,10
Women's Lace Short Sleeve Round Neck T-Shirt Casual Blouse Tunics Tops,19
Women's Summer V Neck Raglan Short Sleeve Shirts Casual Blouses Baseball Tshirts Top,16
Women's Baggy Plus Size Overalls Cotton Linen Jumpsuits Wide Leg Harem Pants Casual Rompers,18
Women's Sleeveless Flowy Loose Fit Racerback Yoga Workout Tank Top,6
Womens/Girls Shin Guard Rash UNDER Sport Socks,17
Women's Notch V Neck Short Sleeve Chiffon Shirts Casual Lace Blouse Top,20
Women's 26 Steel Boned Cotton Long Torso Hourglass Body Shaper Corset,24
Lingerie for Women Teddy One Piece Lace Babydoll Bodysuit,7
Women's Performance Mid-Rise Capri Active Legging,13
035P Women's' X-Temp Pique Polo Fresh IQ,17
Women's French Terry Capri,18
Summer Chiffon High Waist Pleated Big Hem Floor/Ankle Length Beach Maxi Skirt for Women Wedding Party,17
Women's Ab Solution Ankle Skimmer Jean,28
Women's Crew Neck Short Sleeve Striped Loose T-Shirt Mini Dress,29
Women's Retro 50s Plaid Pattern Polka Dot Halter Molded Soft Pads Vintage Bikini Swimsuits Tops,42
"High Waist Yoga Pants with Pockets, Workout Pants for Women, Yoga Leggings with Pockets",6
Women's Essential Insulated Bib Overalls,13
Short Spaghetti Straps V-Neck A-line Homecoming Dress with Pockets,16
Womens Summer Short Sleeve V Neck Knot Tie Front Short Jumpsuit Rompers,18
Amazon Brand - Lark & Ro Women's Cap Sleeve Bateau Neck Wrap Dress,7
Basic Round Crew Neck Short Sleeve T-Shirts Stretch Cotton Spandex Tee,19
Womens Beach Cover Up Sarong Swimsuit Cover-Up Many Solids Colors,9
Women's Sexy Everyday Basic Deep V-Neck Padded Bralette,19
Women's Nursing Tank Top Cami Maternity Bra Breastfeeding Shirts,35
Women's High Neck Tank Tops Summer Sleeveless T Shirts Loose Fit with Pockets,39
Women's Long Sleeve Casual Peter Pan Collar Fit and Flare Skater Dress,54
Summer Blouse Short Sleeves Tunic Cold Shoulder Tops Shirts for Women,56
Womens 2 Pieces Outfits Deep V Neck Crop Top Side Slit Drawstring Wide Leg Pants Set Jumpsuits,7
Baikea Women's 3/4 Rolled Sleeve Zipped V Neck Plaid Shirt Casual Tunic Blouses,16
Waist Trainer Corset for Weight Loss Sport Workout Body Shaper Tummy Fat Burner,16
Women Polo Neck Knit Stretchable Elasticity Long Slim Sweater,29
Women's Blouson Floral T-Back Push Up Tankini Top S-XXXL,9
Rain Jacket Women Windbreaker Striped Climbing Raincoats Waterproof Lightweight Outdoor Hooded Trench Coats,15
Women Blouses Tops Buffalo Check Plaid Long Sleeve Collar Neck Casual Button Down Shirts,23
Women's Casual Soft Long Sleeves Knot Side Twist Knit Blouse Top,82
"Sexy Underwear, Kinds of Women T-Back Thong G-String Underpants Sexy Lacy Panties",79
Women V Neck Boho Embroidered Shirt Short Sleeve Summer Tops Casual Blouses,19
Womens Off Shoulder Bell Sleeve High Slit Formal Evening Party Maxi Dress,22
"Seamless Bandeau Tube top - UV Protective Fabric, Rated UPF 50+ (Non-Padded) -Made in USA-",39
Women's Perfect Tee Shirt,4
Simplee Women's Casual Open Front Long Sleeve Knit Cardigan Sweater Coat with Pockets,14
Women's 6 Pack Cotton Stretch Light Weight Boyshort Boxer Brief Undershorts,21
Women Plus Size Tops V Neck Short Sleeve Batwing Top Cold Shoulder T Shirt,16
Women 1920s Gatsby Cocktail Sequin Art Deco Flapper Dress,69
Silicone Bra Inserts - Transparent Cleavage-Enhancing Breast Pads,32
Women's 3/4 Sleeve Cotton Linen Jacquard Blouses Top T-Shirt,39
Womens Off Shoulder Ruffle Party Long Dresses Casual Side Split Beach Maxi Dress with Pockets,6
Womens Cotton Robe Soft Kimono Spa Knit Bathrobe Lightweight Long,18
Women's Plus Size Fit for Me 4 Pack Microfiber Slip Short Panties,25
328 Women Waist Cincher Girdle Tummy Slimmer Sexy Thong Panty Shapewear,12
Women's Long Sleeve Hoodie Sweatshirt Colorblock Tie Dye Print Tops,29
Pumpkins Hayrides Apple Cider and Falling Leaves T-Shirt Women Funny Thanksgiving Letter Printed Graphic Fall Tee Tops,7
Unisex Dry Cushion Crew Training Sock (3 Pair),12
Women Swim Skirt Solid Color Waistband Skort Bikini Bottom,13
Women's V Neck Spaghetti Strap Drawstring Waisted Long Pants Jumpsuit Rompers,18
"American Made Basic Seamless Cami, UV Protective Fabric UPF 50+ (Made with Love in The USA)",16
Women's French Terry Fleece Full-Zip Hoodie,13
Women's Tops Short Sleeve V Neck T Shirts Summer Basic Tees with Pocket,41
Two-Pocket Faux Leather Hooded Bomber Jacket,13
Women Crochet Lace Basic Tank Top Sleeveless Loose Fitting Tunic,17
Women's A-Line Short Sleeve Midi Dress Solid and Floral Print,18
"XXXL Graduated Women’s Compression Stockings Leggings with Control Top - Firm Graduated Support 20-30mmHg, Color Black, Size 3XL, Absolute Support SKU: A717BL6",22
Women's Mid-Rise Shorts,11
Women’s Plus Size Morgan Short Sleeve Polo Shirt,27
Women's Vintage Floral Lace Half Sleeve Boat Neck Formal Swing Dress,20
Fully Women's Longline Lace Posture Bra #5107565,9
Women's Bohemian Striped Printed Crop Top with High Waist Shorts Two Piece Outfit Suit Set,17
Womens Plus Size Deep V Neck Wrap Ruched Waisted Bodycon Dress,69
Women's 18 Hour Front Close Wirefree Back Support Posture Full Coverage Bra #E525,100
Women's Scrubs Drawstring Cargo Pants (Available in 12 Colors),13
Women's Plus Size Oncore Shapesuit,19
Women's Everyday Lightweight No-Show Socks (6 Pairs),16
Medium Length Bandeau Tube Bra Strapless Top - UV Protective Fabric UPF 50+ (Made with Love in The USA),21
Women's 4-Pack Seamless Bonded Stretch Hipster Panty,34
Summer Tshirt Dresses for Women Casual Ruched Irregular Bodycon Short Mini Dress,17
Women's Two Piece Outfit Off Shoulder Drawstring Crop Top and Skirt Set,19
Women's Active Shorts Fitness Sports Yoga Booty Shorts for Running Gym Workout,9
Basic Loose Fit Pocket Pullover Hoodie Long Tunic Sweatshirts (S~3X),15
Women's Sports Define Jacket Slim Fit and Cottony-Soft Handfeel,19
Lace Shorts Underwear Yoga Shorts Stretch Safety Leggings Undershorts for Women Girls,39
Women's Open Front Cardigan 3/4 Sleeve Draped Ruffles Soft Knit Sweaters,16
Women's Paisley Printed Button Top Long Sleeve V Neck Pleated Casual Flare Tunic Loose Blouse Shirt,27
Women Butt Lifter Padded Shapewear Enhancer Control Panties Body Shaper Underwear,12
Women's Coat Casual Lapel Fleece Fuzzy Faux Shearling Zipper Warm Winter Oversized Outwear Jackets,24
Women's Zip Up Cotton Light Hoodie Jacket,16
Women's Heather Hi Cut,25
Amazon Brand - Daily Ritual Women's Lightweight Lived-In Cotton Short-Sleeve Swing T-Shirt,14
Women's Cat Print Sweatshirt Long Sleeve Loose Pullover Shirt,39
Women's Lightweight V-Neck Tunic Sweater,8
Women's Ruffle One Shoulder Split Midi Party Bodycon Dress,17
Womens Pajama Set Striped Short Sleeve Top & Pants Sleepwear Pjs Sets,87
