product_description,product_price
Women,12
Clothing,8
Women,12
Clothing,10
Women's Casual Summer Empire Waist Tshirt Dresses with Pockets,21
Women's Nike Swoosh Sports Bra,22
Women's Marilyn Straight Leg Denim Jeans,24
Women's Amanda Classic Tapered Jean,143
Women's This is Not a Bra Full-Coverage Underwire Bra,35
Unbranded Women's Sleeveless Loose Plain Dresses Casual Short Dress with Pockets,233
Women's Long Sleeve Casual Loose T-Shirt Dress,5
High Waisted Leggings -Soft & Slim - Solid Colors & 1000+ Prints,59
Women's 2-Pack Classic-Fit Short-Sleeve Crewneck T-Shirt,13
Women's Cute Mesh Yoga Workout Tank Tops Activewear Sexy Open Back Sports Shirts,69
Womens Loose Blouse Short Sleeve V Neck Button Down T Shirts Tie Front Knot Casual Tops,15
"Simple Wishes Signature Hands Free Pumping Bra, Patented, Pink, X-Small - Large",22
MBJ Women's Solid Short Sleeve Boat Neck V Neck Dolman Top with Side Shirring-Made in U.S.A.,9
Women's Easy Does It No Bulge Wire-Free,19
Womens Power Flex Yoga Pants,7
Women's Short Sleeve V-Neck Shirts Loose Casual Tee T-Shirt,31
Women's Sleeveless Lace Floral Elegant Cocktail Dress Crew Neck Knee Length for Party,16
Women's Casual Plain Simple T-Shirt Loose Dress,18
Womens Off The Shoulder Short Sleeve High Low Cocktail Skater Dress,10
"Women's 5"" Inseam Chino Short",15
High Waist Power Flex Tummy Control Leggings,15
Women’s Beauty Back Full Figure Wirefree Bra 71380,18
Women's 4-Pack Camisole,34
Women's Comfy Casual Pajama Pants Floral Print Drawstring Palazzo Lounge Pants Wide Leg,9
Women's Vintage Patchwork Pockets Puffy Swing Casual Party Dress OX165,16
Women's 2-Pack Slim-Fit Tank,10
Women's Summer Sleeveless Pleated Back Closure Casual Tank Tops,49
Women's Built-Up Sports Bra 3 Pack Bra,24
Women's Comfort Revolution Front-Close Shaping Underwire Bra,44
Women's 2-Pack Classic-Fit Short-Sleeve V-Neck T-Shirt,15
Women's Cotton Pullover Sport Bra(Pack of 3),19
Workout Tank Tops for Women - Running Muscle Tank Sport Exercise Gym Yoga Tops Running Muscle Tanks(Pack of 3),19
"Workout Tank Tops for Women - Racerback Athletic Yoga Tops, Running Exercise Gym Shirts(Pack of 3)",38
Women's Short Sleeve Ruched Casual Sundress Midi Bodycon T Shirt Dress,12
Women's Essential No-Show Liner Socks (6 Pairs),20
Women's Full Figure Underwire Front Close Bra #1245,12
Women's Paisley Printed Long Sleeve Henley V Neck Pleated Casual Flare Tunic Blouse Shirt,27
Women's Workwear Elastic Waist Cargo Scrubs Pant,16
3PACK Full Bust Seamless Nursing Maternity Bras Bralette S-XXL with Extra Bra Extenders & Clips,17
Women's Floral Print Sheer Chiffon Loose Kimono Cardigan Capes,25
Passion For Comfort Minimizer Underwire Bra,64
Women’s Comfort Long Sleeve T-Shirt/Underscrub Tee,17
Women's Straight-Fit Stretch Twill Chino Pant,101
Women's Short Sleeve Pleated Loose Swing Casual Dress with Pockets Knee Length,24
"Hybrid Womens Hyper Ultra Stretch Comfy Skinny Pants, Capri, Bermuda",13
Women's 2-Pack Tech Stretch Short-Sleeve V-Neck T-Shirt,16
Women Outfit Sleeveless Shoulder Bandage Waistband Sexy V-Neck Wide Leg Long Jumpsuit with Belt,29
Women's Nano T-Shirt,14
Womens Long Sleeve Button Cowl Neck Casual Slim Tunic Tops with Pockets,23
Women One Piece Swimsuit High Neck Plunge Mesh Ruched Monokini Swimwear,25
"Compression Socks,(3 Pairs) Compression Sock Women & Men - Best Running, Athletic Sports, Crossfit, Flight Travel",16
Women's 8-Pair Performance No-Show Sport Socks,27
Women's Stretch Cotton Cami with Built-in Shelf Bra,9
Women's 2-Pack Tech Stretch Short-Sleeve Crewneck T-Shirt,17
The Ultimate NippleCovers | Nippies Skin Sticky Adhesive Pasties - Light Skin,14
3 in 1 Postpartum Support Recovery Belly Wrap Waist/Pelvis Belt Body Shaper Postnatal Shapewear,6
Womens Casual Tops Sleeveless Cute Twist Knot Waffle Knit Shirts Tank Tops,21
Workwear Professionals WW170 Women's Mid Rise Straight Leg Pull-on Cargo Pant,18
Women's 3-9 Pairs Casual Thin No Show Socks Non Slip Flat Boat Line,25
Women's Reg Floral Lace Triangle Bralette,20
Women's UPF 50+ Sun Protection T-Shirt Long/Short Sleeve Outdoor Performance,15
Women's Instastretch Luscious Curvy Bootcut Jeans,18
Women's Play Up Shorts 2.0,18
Women's Pull-On Jegging,23
Boatneck Sleeveless Vintage Tea Dress with Belt,7
Women Good Vibes Tank Blouse Round Neck Sleeveless and Long Sleeve Rainbow Casual Ladies Waistcoat Tank Tops for Women,13
womens Cloud 9 Wire-Free Contour Bra,25
Women's Basic Versatile Stretchy Flared Casual Mini Skater Skirt,14
Women’s Yoga Capris Power Flex Running Pants Workout Leggings,18
Women's Bohemian Floral Printed Wrap V Neck Short Sleeve Split Beach Party Maxi Dress,21
Women's Cotton Stretch High-Cut Bikini Panty,39
Women's Retro 1950s Style Sleeveless Slim Business Pencil Dress,13
Women's V Neck T Shirt Rolled Sleeve Side Split Tunic Tops,79
Women's Beauty Back Strapless Full Figure Underwire Bra 74380,28
Women's Bralette,23
Women's Ultimate T-Shirt Bra Soft Foam Wirefree,32
Women's Full Figure No Bounce Plus Size Camisole Wirefree Back Close Sports Bra #1066,13
Women's Basic V Neck Short Sleeve T Shirts Summer Casual Tops,18
Ultra Low Cut Liner Socks Women No Show Non Slip Hidden Invisible for Flats Boat Summer 3/5 Pairs,16
Women's 711 Skinny Jean,54
Women's Boho Button Up Split Floral Print Flowy Party Dress,12
Women's Stretch Denim Jacket,14
Women's Mid Rise Shorts Frayed Raw Hem Ripped Denim Jean Shorts,16
Women's Comfy Casual Short Sleeve Side Twist Knotted Tops Blouse Tunic T Shirts,21
Adhesive Bra Strapless Sticky Invisible Push up Silicone Bra for Backless Dress with Nipple Covers,25
Women's Casual Short Sleeve Slit Solid Party Summer Long Maxi Dress,30
– High Waist Tummy Control Shapewear – Power Flex Capri,12
Women's Underwear Breathable Panties (Regular & Plus Size) Colors May Vary,20
Women's Floral Short Sleeve Casual Pockets Midi Dress,29
Women's High Waist Stretch Athletic Workout Shorts with Pocket,9
Women's Scrub Sets Six Pocket Medical Scrubs (V-Neck with Cargo Pant),17
Women's Jersey Full Zip Hoodie,16
Women's Sweater Casual Oversized Baggy Loose Fitting Shirts Batwing Sleeve Pullover Tops,92
Women's Flare Leg Drawstring Scrub Pant,29
Women's Flat Front Stretch Twill Pant Slim Fit Bootcut,12
Women's Flat Front Stretch Twill Pant Slim Fit Bootcut,53
"Waist Trainer Belt for Women - Waist Cincher Trimmer - Slimming Body Shaper Belt - Workout Back Support Girdle (Purple, Medium(27.7""-31.5"" waist))",9
Women's High Waist Yoga Pants Tummy Control Slimming Booty Leggings Workout Running Butt Lift Tights,15
Women's Curvy Straight Jean,14
Women's Summer Casual Loose Dress Beach Cover Up Long Cami Maxi Dresses with Pocket,39
Unisex Arizona SFB,18
Women's 6-Pack Cotton Stretch Thong Panty,23
Women's Long Sleeve Pocket Casual Loose T-Shirt Dress,89
Womens Casual Scoop Collar Plus Size T Shirts Summer Tops Tee,200
Women's Comfort Revolution Shaping Wirefree Bra,12
Women's Summer Maxi Dress Casual Loose Pockets Long Dress Short Sleeve Split,14
Premium Thick High Waist Tummy Compression Slimming Leggings,21
M&Z Low Cut No Show Socks Mens Casual Invisible Cotton Non-Slip Durable Socks S/M/L,12
Adult Women's Belted Low Rise Fastpitch Softball Pant,13
Women's Seamless Underwear Multipack (Assorted),14
Women's Open Front Long Sleeve Boho Boyfriend Knit Chunky Cardigan Sweater,59
Women's Beauty Back Full Figure Underwire Bra (76380),17
Women's Short Sleeve V-Neck Loose Casual Tee T-Shirt Tops,22
Women's Casual 3/4 Tiered Bell Sleeve Crewneck Loose Tops Blouses Shirt,18
Silver Antimicrobial No-Show Compression-Fit Running Socks for Men and Women (1 Pair),19
Women's Stretchy Wide Leg Palazzo Lounge Pants,12
Women Summer Tunic Dress V Neck Casual Loose Flowy Swing Shift Dresses,14
Women's 18 Hour Sensational Sleek Wirefree Full Coverage Bra #4803,24
Women's Summer Casual Tshirt Dresses Short Sleeve Boho Beach Dress,39
Womens Scoop Neck Cut Out Front Lace Up Back High Cut Monokini One Piece Swimsuit,7
Women's Signature Lace Deep V Bralette,28
Women's Summer Boho Polka Dot Sleeveless V Neck Swing Midi Dress with Pockets,25
Womens Casual Color Block Long Sleeve Round Neck Pocket T Shirts Blouses Sweatshirts Tops,33
Women's Short Sleeve Moisture Wicking Athletic Shirts Sizes XS-4XL,17
Women's V Neck Ruffle Polka Dot Pocket Loose Swing Casual Short T-Shirt Dress,80
Women's Floral Maxi Dresses Boho Button Up Split Beach Party Dress,15
TeeHee Women's Fashion No Show/Low cut Fun Socks 12 Pairs Packs,18
Women's Classic Short Sleeve Leotard,9
Rain Poncho Jacket Coat Hooded for Adults with Pockets,19
Women's Ab Solution Jegging,14
"Sports Bras for Women, Seamless Comfortable Yoga Bra with Removable Pads",15
Women's Long Sleeve Floral Print Retro V Neck Tassel Bohemian Midi Dresses,17
Women's Sleeveless Cocktail A-Line Embroidery Party Summer Wedding Guest Dress A079,21
Push up Strapless Self Adhesive Plunge Bra Invisible Backless Sticky Bras,24
Women's Zip Front Sports Bra Wireless Post-Surgery Bra Active Yoga Sports Bras,12
Women’s Summer Wrap V Neck Bohemian Floral Print Ruffle Swing A Line Beach Mini Dress,69
Fajas Colombiana Latex Waist Cincher/Trainer/Trimmer/Corset Weight Loss Shaper,13
Women's No Side Effects Full Coverage Underwire Bra,20
Women's Long Sleeve Soft Chunky Knit Sweater Open Front Cardigan Outwear with Pockets,16
3 Pack Seamless Clip Down Deep V Neck Push Up Nursing Bra Maternity Bras 3PACK Inlcuding Extenders & Clips,19
Lovaru Womens Boho Open Front Cardigan Colorblock Long Sleeve Loose Knit Lightweight Sweaters,11
Women Short Sleeve Loose Plain Maxi Dresses Casual Long Dresses with Pockets,26
Women's Long Sleeve/Short Sleeve Boat Neck Off Shoulder Blouse Tops,19
"Women's Benton Springs Full Zip Jacket, Soft Fleece with Classic Fit",23
"Women's Benton Springs Full Zip Jacket, Soft Fleece with Classic Fit",23
Women's Button Down V Neck Strappy Tank Tops Loose Casual Sleeveless Shirts Blouses,94
Women Summer Casual T Shirt Dresses Beach Cover up Plain Tank Dress,6
Women's Buttery Soft High Waisted Yoga Pants Full-Length Leggings,19
Women's Essential Capri Legging,15
Women's Summer Sleeveless V-Neck T-Shirt Tunic Tops Blouse Shirts,21
Women 50s Petticoat Skirts Tutu Crinoline Underskirt CL8922,22
Women's Bootleg Yoga Pant,14
Women's Comfortable Seamless Smooth Slip Shorts for Under Dresses,49
Women's V-Neck Button Down Knitwear Long Sleeve Soft Basic Knit Cardigan Sweater,12
Women's Totally Shaping Skinny Jean,18
Women's Floral Print Puff Sleeve Kimono Cardigan Loose Cover Up Casual Blouse Tops,8
Women's Solid Short Sleeve Boat Crew Neck V Neck Dolman Top XS - 5XL Plus Size Made in USA,23
Women's Boyfriend Jeans Comfy Stretch Ripped Jeans Distressed Denim Skinny Jeans,15
Women Body Shaper High Waist Butt Lifter Tummy Control Panty Slim Waist Trainer,34
Women's Modern Bootcut Jean,9
Women's Barbara Boot-Cut Jeans,19
Women's Active Athletic Skort Lightweight Skirt with Pockets for Running Tennis Golf Workout,25
"Ladies' 5.6 oz., 50/50 Jersey Polo with SpotShield 437W",20
Women Short Sleeve Round Neck Summer Casual Flared Midi Dress,22
Women's Utility Jacket,11
Women's Beauty Back Minimizer Full Figure Underwire Bra 76080,15
Women's V Neck Stripes Roll up Sleeve Button Down Blouses Tops,9
High Waisted Leggings -Soft & Slim - 37+ Colors & 1000+ Prints,16
Women's Loose Casual Short Sleeve Chiffon Top T-Shirt Blouse,18
5PACK Nursing Bra Wireless Bra Women's Sleeping Maternity Bra Breastfeeding Bra,37
Women's Loose Open Front Long Sleeve Solid Color Knit Cardigans Sweater Blouses with Pockets,8
Women's Deep V Neck Adjustable Spaghetti Straps Summer Dress Sleeveless Sexy Backless Party Dresses with Pocket,14
Women Two Piece Swimsuit High Waisted Off Shoulder Ruffled Bikini Set,7
Women's Modern Cotton Bralette,47
Women's Underwire Sport Bra,29
Women's Laced & Lace Trimmed Bras (Packs of 6),217
Juniors' Authentic Short,21
Amazon Brand - Lark & Ro Women's Classic Cap Sleeve Wrap Dress,6
Women's Relaxed Fit Straight Leg Jean,22
Womens Color Block Striped Draped Kimono Cardigan with Pockets Long Sleeve Open Front Casual Knit Sweaters Coat,12
Women's Satin Tracings Minimizer Underwire Bra,19
Women's High Waisted Yoga Pants 7/8 Length Leggings with Pockets,32
Women's Ease in to Comfort Boot Cut Pant,18
Women's Summer Short Sleeve Loose Casual Tee T-Shirt,72
Summer Women Short Sleeve Print Dress V Neck Casual Short Dresses,3
Women's Classic-Fit Long-Sleeve Poplin Shirt,22
Women's 2 Pieces Bandeau Bikini Swimsuits Off Shoulder High Waist Bathing Suit High Cut,4
"Simple Wishes D Lite Hands Free Pumping Bra, Patented, Black, X-Small/Large (Pack of 1)",12
Women's Plain Casual Flowy Short Sleeve Midi Dress with Belt,12
Womens Loose Strappy Cold Shoulder Tops Basic T Shirts,21
Women's Yoga Tops Activewear Athletic Shirts Workout Clothes Racerback Tank Tops,25
"Women's 10"" Inseam Bermuda Short",34
Womens T Shirt Casual Cotton Short Sleeve V-Neck Graphic T-Shirt Tops Tees,11
Women's Tiro19 Training Pants,17
Women's Elegant Spaghetti Straps Deep V Neck Sleeveless Bodycon Party Dress,104
"Adult Resistor 3.0 Lo Cut Socks, 6 Pairs",19
Women's Relaxed-Fit Lightweight 3/4 Sleeve Cotton Popover Shirt,26
Women's Basic V Neck T Shirt with Suede Pocket S-XXL,16
Wrap Maxi Dress Short Sleeve V Neck Floral Flowy Front Slit High Low Women Summer Beach Party Wedding Dress,61
Women's Skinny Stretch Pull-On Knit Jegging,19
Women's Button Up Split Floral Print Flowy Party Maxi Dress,9
Women's Awareness Full Figure Underwire Bra,18
Women's Comfort Devotion Embellished Bra,37
Women's Maternity Indigo Blue Stretch Secret Fit Belly Boot Cut Jean,39
Women's Deep V Neck Short Sleeve Unique Cross Wrap Casual Flared Midi Dress,20
"Fearless Tape - Womens Double Sided Tape for Clothing and Body, Transparent Clear Color for All Skin Shades, 50 Count.",19
Performance Women's 3.75'' Game Shorts,39
Women's Chiffon Swimsuit Beach Bathing Suit Cover Ups for Swimwear,43
Women's Ultra Soft Transition Tight,126
Women's Convertible Seamless Wire Free Bra,14
Women's Lace Off Shoulder Tops Casual Loose Blouse Shirts,55
No Side Effects Wire-Free Contour Bra,19
Women's Arcadia II Waterproof Rain Jacket,34
Women's Basic Beauty Contour T-Shirt Bra,12
Women's Full Figure High Impact Wonderwire Sports Bra #9066,19
Women's Floral Print Kimono Sheer Chiffon Loose Cardigan,9
Women's Sheer Thigh-High Stockings,17
Women's 3 Pack Compression Base Layer Dry Fit Tank Top,35
Women's Ultra Soft Printed Fashion Leggings BAT1,12
Arizona Unisex Leather Sandal,21
Women's Drape Front Open Cardigan Long Sleeve Irregular Hem,9
"High Waist Yoga Leggings with 3 Pockets,Tummy Control Workout Running 4 Way Stretch Yoga Pants",54
Women's Loose Solid Off Shoulder Elastic Waist Stretchy Long Romper Jumpsuit with Pockets,9
Women's Naked Feeling I High Waist Tight Yoga Pants Workout Leggings-25 Inches,21
"Women's Essential 2.0 No Show Socks, 6-Pair",16
Women Waist Trainer Shapewear Tummy Control Body Shaper Shorts Hi-Waist Butt Lifter Thigh Slimmer,20
Women's Long Sleeve Snap Button Down Solid Color Knit Ribbed Neckline Cardigans,16
Women's Drawstring Waist Long Workout Yoga Active Pant with Pocket,47
Women's Athletic Training Adjustable Strap One Piece Swimsuit Swimwear Bathing Suit,48
Women's Crew/V Neck 3/4 Sleeve Drape Dolman Shirt Top with Side Shirring XS-5XL Plus Size-Made in USA,119
Womens Off The Shoulder Ruffle Party Dresses Side Split Beach Maxi Dress,29
Women Bohemian Neck Tie Vintage Printed Ethnic Style Summer Shift Dress,127
Womens Long Sleeve Round Neck T Shirts Color Block Striped Causal Blouses Tops,30
Women's Comfort Revolution Wirefree Bra with Smart Sizes Bra,100
Women's One Smooth U Ultra Light Illusion-Neckline Underwire Bra,9
Women's Basic Versatile Stretchy Flared Casual Mini Skater Skirt XS-3XL Plus Size-Made in USA,18
Women's Casual Round Neck Basic Pleated Top Cap Sleeve Curved Keyhole Back Blouse,7
Women's Jersey Short,20
Women's Cotton Spandex Seamless Sleep Bra for Nursing and Maternity [2019 Upgraded Version],7
Women Floral Print Button Up Split Flowy Party Maxi Dress,13
Women's Sarong Swimsuit Cover Up Summer Beach Wrap Skirt Swimwear Bikini Cover-ups,12
Womens Polka Dot V Neck Button Down Ruffles Loose Mini Short T-Shirt Dress,17
Women Sequin Bridesmaid Dress Sleeveless Maxi Evening Prom Dresses,16
Women's Halle Pant,26
Women's Vintage Floral Lace Short Sleeve Boat Neck Cocktail Party Swing Dress,29
Women's Removable Strap Wrap Pad Cheeky High Waist Bikini Set Swimsuit,54
Women's Fringe Cuff Boyfriend Jean,58
"Women's Fringe Cuff Boyfriend Jean, mid Shade, 6",162
Women's Stretch Jersey Bike Short,19
Women's Slimming Tummy Control Swimdress Swimwear Long Torso Tankini Swimsuit Retro Skirt Swimming Suit for Women,40
Women's Active Performance Skort Lightweight Skirt for Running Tennis Golf Workout Sports,17
Women Waist Trainer Tummy Control Panties Body Shaper High Waisted Shapewear Briefs Butt Lifter Slimming Corset Seamless,24
Women Kimono Robes Cotton Lightweight Long Robe Knit Bathrobe Soft Sleepwear V-Neck Ladies Loungewear S-XXL,26
Women's Plus Size Red Carpet Strapless,27
Women's Size Plus Short Sleeve Graphic Tunic,26
Casual Maxi Short Sleeve Split Tie Dye Long Dress,5
Vortex Volleyball Short,18
Women's Comfort Evolution Bra,15
Women's Casual T Shirts Twist Knot Tunics Tops,29
Women's Body By Wacoal Underwire Bra,11
Women's Casual Long Sleeve Round Neck Loose Tunic T Shirt Blouse Tops,21
Women and Men No Show Socks Low Cut Anti-slid Cotton Athletic Casual Socks,13
"DuPont Tyvek 400 TY122S Disposable Protective Coverall Hood, Boots, XL 25PACK",27
Women's Sexy Scoop Neck Racerback Tank Top Button Down Bodysuits,33
Women's Sexy Bodycon Tank Dress Sleeveless Basic Midi Club Dresses,47
Women's Casual Summer Ruffle Babydoll Loose Mini Dress,130
Pocket Shirts for Women Casual Loose Fit Tunic Top Baggy Comfy Blouse,6
Lingerie for Women Front Closure Babydoll Lace Chemise V Neck Mesh Sleepwear,16
Women's Front Close Builtup Sports Bra,23
Women's Casual Long Open Front Drape Lightweight Duster High Low Hem Maxi Long Sleeve Cardigan with Pocket(S-3XL),27
Women's Workout Active Skorts Sports Tennis Golf Skirt Built-in Shorts Casual Workout Clothes Athletic Yoga Apparel,16
Purple Label Yoga Women's Tori 9133 5 Pocket Knit Waist Pant,27
Women's Pure Colour Short Satin Kimono Robes with Oblique V-Neck,9
Women's One Piece Swimsuits Tummy Control Swimwear V Neck Bathing Suits,27
Unisex No Show Flat Cushion Athletic Cotton Sneakers Sports Socks,14
Amazon Brand - Daily Ritual Women's Mid-Rise Skinny Jean,19
Workwear Revolution Women's Mid Rise Straight Leg Pull-On Scrub Pant,22
Women's Breathable Cotton Thong Panties Pack of 6,101
Hybrid & Co. Women's Butt Lift Super Comfy Stretch Denim Skinny Yoga Jeans,12
Women's Double-Support Spa Closure Wire-Free Bra,18
Women's Printed Solid Activewear Jogger Track Cuff Sweatpants Inner Pockets,11
Waist Trainer Belt Corset Body Shaper Belly Wrap Trimmer Slimmer Compression Band for Weight Loss Workout Fitness,14
Women's MagicLift Full Figure Minimizer Support Bra #1003,133
Women's Skinny Jean,16
Women's Loose Casual Long Sleeved Open Front Breathable Cardigans with Pocket,17
Women's Maternity Skinny Jeans,9
Sport Women's Cool DRI Performance Polo,16
Women's Plus Size Magic Lift Full-Figure Support Bra #1000,18
Women's Summer Swimsuit Bikini Beach Swimwear Cover up,16
Women's Sexy V Neck Sleeveless Lace Dress,29
Savage X Women's Unlined Microfiber Demi Cup Bra,39
Women's 3 Stripes Legging,44
Women Lingerie V Neck Nightwear Satin Sleepwear Lace Chemise Mini Teddy,20
"Women's Saturday Trail Pant, Water and Stain Resistant",84
Push up Strapless Self Adhesive Plunge Bra Invisible Backless Sticky Bras Beige,2
Women's Maxi Dress Floral Printed Autumn 3/4 Sleeve Casual Tunic Long Maxi Dress,15
High Waisted Capri Leggings - Soft & Slim - 37+ Colors,9
Women's Perfectly Fit Lightly Lined Memory Touch T-Shirt Bra,149
2PACK Nursing Bra Wireless Bra Women's Sleeping Maternity Bra Breastfeeding Bra,16
Beach Swimsuit for Women Sleeve Coverups Bikini Cover Up Net,15
High Waisted Leggings -Soft & Slim - 37+ Colors & 1000+ Prints,22
Women Short Sleeves Flare Tunic Tops for Leggings Flowy Shirt,7
Women's Nursing Tank Top Cami Maternity Bra Breastfeeding Clothes,12
Women's Savage X Thong,21
Women's Denim Leggings With Pockets,91
Womens Lace Underwear Hipster Panties Cotton/Spandex - 10 Pack Colors and Patterns May Vary …,7
Break On Through Women's The Jogger Low Rise Tapered Leg Scrub Pant,15
Women's Full Figure MagicLift Plus Size Seamless Wirefree Back Close Sports Bra #1006,16
Women 3/4 Sleeve Blazer Open Front Cardigan Jacket Work Office Blazer,9
Compression Yoga Pants Power Stretch Workout Leggings with High Waist Tummy Control,12
"Women's Comfort Blend Crew Sock, 6 Pack",5
Women's Performance Athletic Running Socks (6 Pair Pack),23
Women's Underwear Moisture Wicking Coolblend Panties,13
Women Solid Super Pro - Pro LT Swimsuit,34
Women's Summer Sexy One Shoulder Ruffle Bodycon Midi Cocktail Dress,18
Women's Low-Rise Boyshort,21
Push Up Strapless Sticky Adhesive Invisible Backless Bras Plunge Reusable Magic Bra for Women,15
Women Long Sleeve Open Front Leopard Knit Long Cardigan Casual Print Knitted Maxi Sweater Coat Outwear with Pockets,29
Women's Studio Terry Capri Jogger Pant,21
Women’s Underwear Cotton Brief Panty Multipack,29
Women's Casual Chiffon V Neck Cuffed Sleeve Blouse Tops,32
Women's Underwire Sports Bra,24
Women's Straight 505 Jeans,80
Women's Straight 505 Jeans,14
Women's Straight 505 Jeans,23
Women's High Waist Yoga Pants Workout Running Capri Legging Inner Pocket,19
Womens Shirts Casual Tee Shirts Short Sleeve Patchwork Color Block Loose Fits Tunic Tops Blouses,21
"Pinzon Terry Bathrobe 100% Cotton, Platinum, Small / Medium",5
Women's Pants Casual Trouser Paper Bag Pants Elastic Waist Slim Pockets,19
Women's Casual Beach Summer Dresses Solid Cotton Flattering A-Line Spaghetti Strap Button Down Midi Sundress,18
Womens Tops Sleeveless Halter Racerback Summer Basic Tee Shirts Cami Tank Tops Beach Blouses,5
Women's Hooded Faux Leather Moto Biker Jacket (XS~2XL),19
Women's Comfort Devotion Demi Bra,19
Women Lingerie Lace Babydoll Strap Chemise Halter Teddy V Neck Sleepwear,52
Women's Batwing Sleeve Off Shoulder Loose Oversized Baggy Tops Sweater Pullover Casual Blouse T-Shirt,19
Women's 18-Hour Seamless Smoothing Full Coverage Bra #4049,27
3/4 Sleeve Stretchy Button Down Collar Office Formal Casual Shirt Blouse for Women Fit (XS-6XL),11
St. Jubileens Women Roll-Up 3/4 Sleeve Plaid Shirt Tunic V Neck Casual Pullover Blouses Tops,26
Women Floral Lace Bralette Padded Breathable Sexy Racerback Lace Bra Bustier,19
Womens Summer Ruffle Sleeve Sweetheart Neckline Printing Dress Mini Dress,15
Women's Long Sleeve Flannel Plaid Shirt,16
Women's Casual Work Solid Color Knit Blazer,17
Women's Quick-Dry Stretch Scrub Pant,27
Power Flex Yoga Short Tummy Control Workout Running Athletic Non See-Through Yoga Shorts with Hidden Pocket,12
Women's Casual Shirts Twist Knot Tunics Tops,21
Women Floral Kimono Cardigan Chiffon Casual Loose Open Front Cover Up Tops (28 Colors),19
Empetua Ultra-Thin High-Waisted Shaper Panty - Body Shaper,27
Women Lingerie Lace Babydoll V Neck Sleepwear Strap Chemise,17
Women's Chunky Button Turtle Cowl Neck Asymmetric Hem Wrap Pullover Sweater,12
Women Off Shoulder Ruffles Bodycon Mini Dress,14
Women's Cold Shoulder Little Cocktail Party A-line Skater Dress,16
Women's Leopard Print Long Sleeve Crew Neck Fit Casual Sweatshirt Pullover Tops Shirts,18
"Women’s Storm Surge Waterproof Rain Pants, Mesh Lined",8
"Women's Storm Surge Waterproof Rain Pant, Black, Small x Short",15
Women's Modern Straight Jeans,21
Ua Womens Essential Ultra Low 3pk,14
High Waist Running Workout Leggings for Yoga with Pockets,15
Women's 2019 Casual Short Sleeve Party Bodycon Sheath Belted Dress with Pockets,18
Women's Full-Zip Polar Fleece Jacket,35
Women's Blissful Benefits No Side Effects Smoothing Wirefree Bra,3
Women's GenFlex Cargo Scrubs Pant,26
Women's GenFlex Cargo Scrubs Pant,24
Womens 3/4 Cuffed Sleeve Chiffon Printed V Neck Casual Blouse Shirt Tops,28
Women's Short Sleeve Pockets Empire Waist Pleated Loose Swing Casual Flare Dress,20
Women's Casual Solid T Shirts Twist Knot Tunics Tops Blouses,21
Women's Halter Floral Lace Cocktail Party Dress Hi-Lo Bridesmaid Dress,21
"Compression Socks (3/6/7 Pairs),15-20 mmHg is Best Athletic & Medical for Men & Women, Running, Flight, Travel, Nurses",119
Women Long Sleeve Loose Plain Plus Size Maxi Dresses Casual Long Dresses with Pockets,37
Waist Trainer Corset for Weight Loss Tummy Control Sport Workout Body Shaper Black,15
Women Teddy Lingerie One Piece Babydoll Mini Bodysuit,75
Women 2 Piece Flounce Printed Top with Boyshorts Tankini Bathing Suits,14
Women Maxi Dress Striped Long Dresses Casual Loose Kaftan Oversized Round Neck Sundress,64
Women's Underwear Beyond Soft Panties (Regular & Plus Size),18
Women's Elite Performance No-Bounce Cami Wirefree Sports Bra #1067,37
Women's Cute Cartoon Print Tee and Shorts Pajama Set,19
Women’s Instantly Slims Classic Relaxed Fit Monroe Straight Leg Jean,20
Women's One Fab Fit Extra Coverage Lace T-Back,13
Women's Swimsuit Beach Cover Up Shirt Bikini Beachwear Bathing Suit Beach Dress S-XL,34
Women's Ladies Vintage Lace Bikini Sets Beach Swimwear Bathing Suit,20
Women's Summer Tank Jumpsuit Casual Loose Sleeveless Beam Foot Elasitic Waist Jumpsuit Romper with Pockets,36
Be Kind T Shirts Women Cute Graphic Blessed Shirt Funny Inspirational Teacher Fall Tees Tops,22
Womens Leopard Print Tops Short Sleeve Round Neck Casual T Shirts Tees,36
Womens Summer Halter Neck Floral Print Sleeveless Casual Mini Dress,17
Women's 3-Pack Seamless Wireless Sports Bra with Removable Pads,27
Women's Original Trucker Jacket,31
"Women's Trucker Jackets Original, Jeanie, Small",64
"Women's Trucker Jackets Original, Jeanie, Medium",64
"Women's Trucker Jackets Original, Jeanie, X-Large",64
Women's Trucker Jackets Original,64
"Women's Trucker Jackets Original, Jeanie, Large",25
