product_description,product_price
Women's Stabilyx Joint Support 3/4 Capri Compression Tight,25
Lingerie for Women Lace Babydoll Sexy Chemise V Neck Mesh Sleepwear,15
Women's Cushioned Low Cut Socks (3 Pairs),25
Women's Casual Off Shoulder T Shirts Blouse and Short Sleeve Plus Size Tops,13
21111 Butt Lifter Bodysuit Postpartum Girdle Fajas Colombianas Postparto,14
Women Lace Pajamas Set Shorts Nightwear Camisole Sets Sexy Sleepwear,5
Retro 50s Black Pink Blue Floral Halter High Waist Bikini Set Halter Carnival Swimsuit(FBA),16
Womens V Neck Sleeveless Nightgown Sleepwear Summer Slip Night Dress S-XXL,24
Womens Short Sleeve Pocket Floral Print Patchwork Casual Swing Midi Dress,28
Women's Long Formal Sequin Chiffon Evening Prom Dress,16
Family Matching Swimwear Two Pieces Bikini Set 2019 Newest Printed Ruffles Mommy and Me Bathing Suits,18
Women's Linen Cotton Casual Large Size Pants Plus Size Pant With Band Waist,24
Satin Wedding Robes with Clear Rhinestones-Bride&Bridesmaid Edition Short Kimono,29
Women's Plus-Size Flex Motion Regular Fit Bootcut Jean,59
Women's Seamless High Impact Support Racerback Workout Yoga Sports Bra,15
"6 Pack Seamless Fleece Lined Leggings for Women - Winter, Workout & Everyday Use - One Size",14
Women's Boho Floral Print Elastic High Waist Pleated A Line Midi Skirt with Pockets,12
Womens Summer Short Sleeve Funny Cute Graphic T Shirt Tee Shirts,17
"Rafaela Two-Pocket Mandarin Collar Medical Scrub Top Women — Relaxed Fit, Super Soft Stretch",54
Womens Elegant Patchwork Pockets Print Work Casual A-Line Midi Dress,77
Women Zipper Robe Half Sleeve Loungewear Full Length Nightgown Duster Housecoat with Pockets S-XXL,2
Women's Microfiber Footless Tight,17
Women's Plus Size Casual Long Sleeve Pleated T Shirt Dress with Pockets,23
Women's Vintage Floral Lace Long Sleeve Ruched Neck Flowy Long Dress,19
Women Button Up Cardigan Knit Hooded Cable Sweater Coat Outwear,20
Women's Summer Casual V Neck Flowy Tank Top Strappy Cami Swing Top,21
Womens Crochet Net Hollow Out Beach Pants Sexy Swimsuit Cover Up Pants,49
Women's Shiny Liquid Metallic Holographic Pleated Flared Mini Skater Skirt,13
Womens Stretch Solid Athletic Shorts Cross Side Tie Dance Yoga Shorts,19
Splatter Neon Leggings - Neon Retro Rainbow Tights for Women,27
Women's Fashion Summer Leopard Beach Shorts Casual Short Pants,32
Women's Basic Five-Pocket Rugged Wear Denim Skirt with Slit,10
Women's Plus Size Casual Long Sleeve Pleated T Shirt Dress with Pockets,20
Women's Vintage Floral Lace Long Sleeve Ruched Neck Flowy Long Dress,25
Women Button Up Cardigan Knit Hooded Cable Sweater Coat Outwear,19
Women's Summer Casual V Neck Flowy Tank Top Strappy Cami Swing Top,39
Womens Crochet Net Hollow Out Beach Pants Sexy Swimsuit Cover Up Pants,12
Women's Shiny Liquid Metallic Holographic Pleated Flared Mini Skater Skirt,45
Womens Stretch Solid Athletic Shorts Cross Side Tie Dance Yoga Shorts,7
Splatter Neon Leggings - Neon Retro Rainbow Tights for Women,16
Women's Fashion Summer Leopard Beach Shorts Casual Short Pants,13
Women's Basic Five-Pocket Rugged Wear Denim Skirt with Slit,23
Women's Ripped Distressed Casual Long Sleeve Denim Jacket,10
Womens Workout Shirts Sexy Open Back Activewear Workout Clothes Sports Yoga Tank Tops,14
Print Brushed Ultra Soft Cropped Capri Leggings Regular and Plus List 1,9
Women's Plus Size Celebrity Pink Infinite Stretch Mid Rise Skinny Jean,13
Women's Modern Cotton Bralette,19
Women's Q-Baby Mid Rise Boot Cut Ultimate Riding Jean,11
Women's Adjustable Spaghetti Straps Long Cami Slip Dress,12
"Amazon Brand - Core 10 Women's (XS-3X) All Day Comfort High Waist Full-Length Yoga Legging - 27""",19
Women's Plus Size Off The Shoulder Hollowed Out Scallop Hem Party Short Dresses,29
Women's Lace Kimono Robe Lingerie Eyelash Babydoll Sheer Nightwear,39
"Terramed Advanced Graduated Compression Leggings Women - 20-30 mmhg Footless Microfiber Leggings Tights (Black, Large)",9
"Women's Essential Denim Jean Capri Leggings, Assorted",15
"Summer Pajamas for Women - Stylish Print Ladies Pajama Set, Oversized Shirt Capri Lounge Pants",11
Womens Off The Shoulder Ruffle Party Dress Casual Side Split Beach Long Maxi Dresses with Pockets,12
Women's Invisibles Hipster Panty,28
Women's Plus-Size Energise Underwire Sport Bra,36
Vintage 1920s Long Wedding Prom Dresses 2/3 Sleeve Sequin Party Evening Gown,14
Basic Double-Layer Cotton Simple Stretchy Tube Pencil Mini Skirt,58
Women One Piece Vintage Deep V Neck Halter Backless Monokini Swimsuits,39
Family Matching Swimsuit One Piece V Neck Mommy and Me Bathing Suit 2019 Newest Beach Wear,79
Womens Sexy Plus Size 2 Piece Midi Dress Outfits - Sleeveless Tie Dye Print Tank Crop Top Bodycon Skirts Set,16
Women's Power Mama Shaper,27
Women's V Neck Floral Maxi Dress Boho Printed Adjustable Spaghetti Strap Ethnic Beach Long Dress with Pockets,29
Juniors' Mesh T-Shirtny Tiny Short,21
Women's Sleeveless Sexy Club Party Bandage Dresses Spaghetti Strap Two Piece Clubwear Crop Top + Lace Up Skirt,22
Women's Nylon Fishnet Thigh Highs,2
Women's Summer Swimsuit Cover up Bikini Beach Bathing Suit Swimwear,17
"Women’s High Waist Yoga Capri Leggings with Side Pockets, Tummy Control Workout Squat-Proof Yoga Pants",31
Women's Baby Shower Floral Lace Maternity Dress,14
Womens 1920s Midi Flapper Dress V Neck Grey Bow Roaring 20s Great Gatsby Dress,57
Women's Casual Criss Cross V-Neck Tops Short Sleeve Summer Tunic T-Shirts Blouse Shirt,19
Women's V Neck Long/Short Sleeve Button Decoration Plaid Swing Dress,26
Women's Casual Basic Strappy Velvet V Neck Cami Tank Top,15
Women's Standard Wrap Back Wide Leg Jumpsuit,28
Women's Strappy Backless Summer Evening Party Maxi Dress,4
Women's Elegant Off Shoulder V-Neck Evening Party Cocktail Dress,19
Women 3/4 Sleeve Cold Shoulder T-Shirt Tops Casual Blouses,26
Cold Shoulder Casual Tunic Tops Loose Blouse Shirts,139
Cold Shoulder Casual Tunic Tops Loose Blouse Shirts,9
Women's Underwear Supersoft Brief - 3 Pack,16
"Short Sleeve Round Neck Cotton Tri-Blend Summer T-Shirt Top (6 Style, S-3X)",21
Women's 3/4 Sleeve Lace Trim Casual Wrap Cardigan Coverup Outerwear Sweater,70
Women's Round Neck Ruffle Long Sleeve Blouse,8
Women Button Down Shirts Long Sleeve Chiffon Office Casual Blouses,12
Women's Daisy Lace Wire-Free Bra with Plushline,22
Women's Plus Size Smoothing Seam Free Underwire Bra,14
"Bring It Up Women's Original Instant Breast Lifts Cup Size A-D, 8 Pair",19
Womens Ripped Hole Bandage Pants Denim Shorts,19
Amazon Brand - Lark & Ro Women's Short Sleeve Bateau Neck Sheath Dress with Pockets,21
Amazon Brand - Lark & Ro Women's Sleeveless Twist Neck Knot Sheath Dress,15
Women's B-Smooth Brief Panty,32
Classic High Waist Jeans Vintage Sexy Boyfriend Jeans for Women,22
Women Wrap Maxi Dress Floral Short Sleeve Flowy Slit Tie Waist Summer Beach Party Wedding Dress,101
Womens Sexy Ruffle Criss Cross Back One Piece Swimsuit Monokini Swimwear,16
Women's Lightly Padded Wireless Racerback Sports Maternity Nursing Bra,18
Women Emboridery Blue Corset Top Sexy Lingerie Sets,21
Women Lingerie Lace Chemise Sleepwear Babydoll Set Mini Dress,21
Women's Sheer To Waist Toe Pantyhose 6-Pack,52
Soft Printed Leggings 80s Style Neon Leggings Pants with Assorted Designs for Women and Girls,45
Women's Basic Long/Short Sleeve High Turtle Mock Neck/Crew Neck Slim Fit Rayon Layering T Shirts Tops,49
Plus Size Unlined Minimizer Wire Free Bra with Embroidery Lace-3Pack,12
Women's Lace Casual Tops Short Sleeve/Long Sleeve Boho Elegant Casual Loose Blouse Shirts,39
Women Ultra Soft Maternity & Nursing Pajama Set Pregnancy Sleepwear ZE0045,34
Canvas 6405 Missy Jersey Short-Sleeve V-Neck T-Shirt,46
Women's Half Placket Above Knee Printed Belted Sleeveless Dress,30
Women's Knit Cardigan Open Front Sweater Coat Long Sleeve,39
Tummy Control Leggings Plus Size XL 2XL 3XL 4XL,4
HaoDuoYi Womens Mardi Gras's Sparkly Sequin V Neck Party Clubwear Romper Jumpsuit,23
Squad Goals Sanderson Sisters Funny Halloween Hocus Pocus Classic Movie T-Shirt,20
Women's Split Neck Floral Button 1940s Day 1950s Vintage Tea Dress,14
Coffee T Shirts for Women Coffee Coffee Coffee Letters Print Shirt with Funny Sayings Casual Tee Tops,20
"Women Seamless Premium Classic Camisole, Made in U.S.A, One Size",2
Retro Mae Mid Rise Stretch Boot Cut Jean,17
Women's 6-Pack Performance Cotton Cushioned Athletic No-Show Socks,19
Women's Natural Boost Demi Bra,9
Women's 711 Plus-Size Skinny Jeans,13
Women's Casual Blouse Half Bell Sleeve Crewneck Keyhole Tunic Top Shirt,13
Women's Pajama Sets Capri Pants with Short Tops Cotton Sleepwear Ladies Sleep Sets,18
Women's Plus Size Active French Terry Full-Zip Hoodie,39
Women Casual Color Block Long Sleeve Pullover Tunic Top Loose Shirt,59
Maternity Dress Sexy Off Shoulder Gown Dress Women,7
Womens Sleeveless Deep V Neck Unique Cross Wrap Sexy Tank Top Blouse,25
Womens Retro High Waisted Bathing Suits Vintage Tankini Print Swimsuits Bikini Set for Women,15
Women Waist Trainer Belt - Slimming Sauna Waist Trimmer Belly Band Sweat Sports Girdle Belt,29
Maternity Shapewear for Dresses Soft Seamless Pregnancy Underwear,5
Women's Performance Skort with Knit Waist,28
Women Classic Scallop Bikini Swimwear Two Piece Bathing Suit,15
Women's Island Goddess Multi Strap Cross Back One Piece Swimsuit,19
Womens Fuzzy Casual Loose Sweatshirt Hooded with Pockets Outwear S-XXL,30
Womens Tops Plus Size Raglan Shirt 3/4 Sleeve Short Sleeve Striped Crew Neck Tshirt Tunic with Pockets,127
Women Short Sleeve Loose Plain Casual Plus Size Long Maxi Dress,5
Women's Short Sleeve V-Neck Basic T-Shirt,26
Prima Donna Women's Madison Full Cup Bra,20
Women's Wedding Dress Lace Double V-Neck Sleeveless Evening Dress,25
Women Casual Swimwear Swimsuit Cover Up Short Beach Dress,22
Womens High Waist Microstretch Cotton Denim Shorts,25
Women's Passion for Comfort Minimizer Bodysuit,6
Women's Long Sleeve Button Down Plaid Flannel Shirt,13
Sparkle Rhinestone Fishnet Stockings Crystal High Waist Mesh Hollow Out Pantyhose for Women Tights Set,78
"Sticky Bra Push up Women A/B/C/D/DD/DDD Cup (2 Pairs,Beige)",134
Women's 3 Stripe Active Tights Leggings,4
Women's Linen Blouse High Low Shirt Roll-Up Sleeve Tops,95
Womens Flannels Long/Roll Up Sleeve Plaid Shirts Cotton Check Gingham Top S-3XL …,21
Women's Long Sleeve Criss Cross Casual Basic up Blouse,19
Women's Aura Instantly Slimming Mid Rise Boot Cut Jean,27
Women's Off The Shoulder One Sleeve Slit Maxi Party Prom Dress,84
Adar 2 Pack Women’s Comfort Long Sleeve T-Shirt/Underscrub Tee,8
Women's Front Adjustable Wirefree High Impact Full Support Plus Size Sports Bra,21
Women's Essential Twist 2.0 No Show Socks (6 Pack),9
Women's Snakeskin Print Biker Shorts High Waist Active Gym Workout Yoga Short Leggings Sexy Stretch Bodycon Hot Shorts,10
Womens Casual Short Sleeve Belted Jumpsuit Long Pants Back Keyhole Overall Romper Playsuit,12
Women's Casual Cotton Linen Pant w/Unique Pockets,17
Women's Summer Short Sleeve Pocket Tassel Hem Loose Tunic T-Shirt Dress,40
Women's Sheer Chiffon Kimono Cardigan Solid Casual Capes Beach Cover up,21
Women's Ease Into Comfort Stretchable Pull-On 5 inch Slimming Tab Short,28
Curvy Woman Ease into Comfort Plus Size Straight Pant w/Tummy Control,2
Womens 2 Piece Swimsuits Tankini Top Set with Boy Shorts Slimming Swimdress Swimwear,24
Women's Classic Plaid Cotton Hoodie Button-up Flannel Shirts,12
Women's Solid Color Ultra Stretch Fitted Low Rise Moleton Denim Booty Shorts,18
Women's Underwear Elance Breathe French Cut - 3 Pack,30
ZAFUL Women's Tie Knot Front Spaghetti Strap High Cut Bikini Set Swimsuit,70
Women's Midrise Bootcut Jean,8
Women's Mini Ruched Tank Shift Dress,34
1-4Packs Women's Seamless Bandeau Crop Tube Top Bra Strapless Padded Bralette,14
Women's Ribbon Stripe Patchwork Long Sleeve Pullover Tops Sweatshirt,37
Women's Regular Fit Chino Walkshort,24
Plus Size Spaghetti Strap Cover Up Beach Backless Wrap Long Dress,19
Women's Swimsuit Cover up Beach Long Kimono Bathing Suit Chiffon Floral Cardigan,2
Women's Bustier Corset Sexy Satin Brocade Overbust Waist Cincher Shapewear Top,12
Women's Casual Shirts Long Sleeve Button up Henley T-Shirt Tunic Tops Blouses,9
Womens Destroyed Ripped Distressed Skinny Jeans,28
Women's 525 Straight Jeans Perfect Waist,34
Womens Two Piece Swimsuits Tie Knot Padded Push Up Brazilian Thong Cheeky Bikini Set,39
Women's Breeze Solid Stretch Boardshort,12
Women Sleeveless Maxi Dress Casual Long Dresses Beach Dresses Bohemian Printed Dresses,18
Women’s Cotton Stretch Underwear Multipack (Assorted),23
"Body EcoWear Women's Shaper Bra - Seamless Cooling, Light Support",10
Womens Summer Long/Short Sleeve Cold Shoulder T Shirts Cut Out Tops V Neck Tunic Blouses,24
Women's Long Sleeve V Neck Raglan Shirts Loose Blouse Tops Casual Striped Tunic Tee Shirts,14
Women's Bell Sleeve Embroidered Tunic Dress,22
3 Pack Women's Medium Support Cross Back Wirefree Removable Cups Yoga Sport Bra,13
Women's 3/4 Sleeve V-Neck Button Down Knit Cardigan Sweater (S-3X),19
Women's Full Figure Lacey Wonderwire Bra #9035,7
Women's DWMXW Walking Thick Padded Ankle Sock,17
Adar Women's Comfort Long Sleeve T-Shirt/Underscrub Tee (3 Pack),15
"Quick Weight Loss, Adjustable Straps Body Shaper Waist Cincher Tank Top",24
Women's Sexy Bandeau Tie Waist High Waisted Two Pieces Bikini Set Swimsuit,19
Bring It Up Instant Breast Lift - Plus Size - 3 Pairs,20
Invisible Clear Bra Strap Non-Slip Adjustable Bra Strap Soft 2 Pair Transparent Shoulder Strap,7
Breast Lift Pasties - Invisible Silicone Breast Lifting Petals Adhesive Bra Reusable Nipple Covers for Women Nude,21
Button Up Pajamas for Women - Women's PJs Sets,17
Cycling Socks for Men and Women | Unisex Breathable Sport Socks,86
Women Sports Mesh Trouser Gym Workout Fitness Capris Yoga Pant Legging,14
Women's Everyday Regular Panty Hose,38
Women's Velvet 2 Piece Outfit Spaghetti Strap Sleeveless Crop Top+ Shorts Set,19
High Waist Tummy Control Capri Shaper | Shapewear,35
Womens Shapewear Weight Loss Neoprene Sauna Sweat Waist Trainer Corset Tank Top Vest Sport Workout Slimming Body Shaper,14
Women's Summer Tank Tops Sleeveless Casual V Neck Shirts,18
Women's Sexy Short Sleeve Long Dress Low V-Neck Lace Romper,8
Novias Women Fashion Multicolored Print High Waist Maxi Skirt Long Skirt,18
Womens Striped Printed Strappy Racerback Tankini Swim Top No Bottom S - XXXL,13
"Women's Turkish Cotton Robe, Terry Cloth Kimono Bathrobe",8
Womens Short Sleeve Sexy Semi Formal Cocktail One Piece Jumpsuit Romper,12
Ladies' Ankle Length Travel Pant,43
Women's Original Footless Shaper,48
Women Summer Short-Sleeved T-Shirt Crop Top Sleeveless Racerback Workout Yoga Short Tank Top.JNINTH,17
Viscose from Bamboo Postpartum Belly Wrap,40
Womens Girls Embroidered Peasant Tops Mexican Bohemian Blouses,9
Women's Classic Cashmere Wool Blend Coat,15
Women's UA Rival Polo,5
Women's Petite Instantly Slims Classic Relaxed Fit Monroe Straight Leg Jean,15
Women's Sexy V Neck Printed Spaghetti Strap Beach Romper Shorts Jumpsuit XS-3XL,11
ZAFUL Women's Loose Long Sleeve V-Neck Ripped Pullover Knit Sweater Crop Top,19
Women’s Roll Up Long Sleeve Collared Button Down Plaid Shirt,16
Women's Off Shoulder Ruffle Sleeve Lace Maternity Gown Plus Maxi Photography Dress,30
Women's Ponte Knit Pant,16
Women's Carousel Logo Bralette,22
Women's Lightweight Lounge Terry Pajama Pant,15
Women's Pineapple Embroidered Hoodie Plaid Crop Top Sweatshirt,17
Womens Off Shoulder High Waisted Long Wide Leg Jumpsuits Rompers,24
Women's V Neck Waffle Knit Henley Tops Casual Long Sleeve Pullover Sweater Blouses,48
Women's Criss Cross Casual Cami Shirt Sleeveless Tank Top Basic Lace up Blouse,16
Women's Criss Cross Casual Cami Shirt Sleeveless Tank Top Basic Lace up Blouse,4
Casual Comfort Halter Bralette Bra,15
Women Sexy Lace Bra and Panty Set Bralette Lingerie 2 Piece Babydoll Bodysuit S-XXL,19
Women's Minimizer Unline Underwire Full Figure Bra with Embroidery Lace-2 Pack,38
Women's 5 Pack Microfiber Hi-Cut,4
Yoga Pants for Women Running Workout Leggings High Waist Tummy Control,13
Womens Casual Work Office Blazer Jacket Made in USA,28
Women's Casual Button Down V Neck Cami Tank Tops Sleeveless Blouses,28
Women Short Sleeve Plus Size Long Maxi Dress with Pockets Loose Casual T-Shirt Dress,13
Women's Short Sleeve Loose Plain Maxi Dresses Casual Long Dresses with Pockets,13
Unisex No Show Socks Cushioned Comfort,15
Women's Casual Elastic Waist Summer Shorts Jersey Walking Shorts,21
"Copper Compression Ankle Running Socks Men Women 3/7 Pack, Performance Cozy Low Cut Cushion Athletic socks Arch Support",19
Womens Plus Size Sleeveless Deep V Neck Bodycon Wrap Dress with Front Slit,24
Women's Summer Vintage Floral Print Deep V Neck High Low Long Dresses,13
Women's Long Full Cami Slip Dress Sleeveless Nightgowns,17
Women Long Floor Length Chiffon High Waist Skirt Maxi Bridesmaid Party Dress,17
Blank Women's Top & Bottom Set w Microfiber,25
Women's Retro Fashion Dolphin Running Workout Shorts,16
Women's Tummy Control Swimwear Paisley Printed Tankini Swimsuit with Boyshorts Two Piece Bathing Suit,21
Women's Ruffle Trim Sleeve Summer Beach A Line Loose Swing Dress,6
Body EcoWear Women's Classic Bikini - Sporty Cooling Underwear,9
Amazon Brand - Daily Ritual Women's Washed Poplin Patch-Pocket Pant,12
Women's Lace Tunic Top Sweatshirt Long Sleeve Blouse A-Line Flowy T-Shirt Dress,20
Women's Tank Tops Graphic Tees Good Vibes Loose Fit Sleeveless Crew Neck T Shirts Tops,11
Women's Punk Rock Faux Leather Buckle-up Corset Bustier Basque with G-String,18
Women's Shiny Flared Pleated Mini Skater Skirt,16
Women's 415 Plus-Size Classic Bootcut Jeans,22
Women's Classic V-Neck Casual Party Knee Length Sheath Work Short Sleeve Faux Black Wrap Dress,16
Women's Metallic Shiny Off Shoulder Crop Top + Mini Dress Two Piece Outfit Set,15
Strapless Ball Gown Evening Prom Party Dress CL675,34
Amazon Brand - Lark & Ro Women's Half Sleeve Twist Front A-Line Ponte Dress,44
Amazon Brand - Lark & Ro Women's Bootcut Trouser Pant: Curvy Fit,13
Women's Hartford Chef Coat,16
Women's Long Board Shorts with Pocket Quick Dry Swim Shorts Boardshorts,3
Slippers for Women | Lotsa Dots Colorful Cozy Sherpa Slipper Socks | Womens House Slippers | Cozy Slippers for Women | Colorful Womens Fuzzy Slippers,12
Womens Sexy G-String Lace Thongs Panty Underwear Low Rise T-Back Underpants,9
Tunic Tops for Women Long Sleeve Deep V Neck Shirts,27
Women's Plus Size Elastic-Waist Cotton Straight Leg Pant,21
Women's Super Star Track Pants,24
Yoga Socks for Women Barre Sock Non-Slip No-Skid Grip Pilates Hospital Maternity,9
Yoga Socks for Women Barre Socks Grip Non Skid Pilates Ballet Hospital Maternity 3 Packs,19
Womens 3/4 Sleeve Casual Loose Fit Swing Plus Size Tunic Tops Basic T Shirt,22
Women's Contrast-Sleeve Cotton Sweater,29
Women's Surplice Dress,17
Women's Suede,19
Women's Soft Cotton Turtleneck Top Basic Pullover Sweater,15
Amazon Brand - Daily Ritual Women's Lived-in Cotton Roll-Sleeve V-Neck T-Shirt Dress,18
Women's Hartford Chef Coat,33
Women's Long Board Shorts with Pocket Quick Dry Swim Shorts Boardshorts,42
Slippers for Women | Lotsa Dots Colorful Cozy Sherpa Slipper Socks | Womens House Slippers | Cozy Slippers for Women | Colorful Womens Fuzzy Slippers,19
Womens Sexy G-String Lace Thongs Panty Underwear Low Rise T-Back Underpants,25
Tunic Tops for Women Long Sleeve Deep V Neck Shirts,12
Women's Plus Size Elastic-Waist Cotton Straight Leg Pant,6
Women's Super Star Track Pants,17
Yoga Socks for Women Barre Sock Non-Slip No-Skid Grip Pilates Hospital Maternity,18
Yoga Socks for Women Barre Socks Grip Non Skid Pilates Ballet Hospital Maternity 3 Packs,20
Womens 3/4 Sleeve Casual Loose Fit Swing Plus Size Tunic Tops Basic T Shirt,32
Women's Contrast-Sleeve Cotton Sweater,44
Women's Surplice Dress,111
Women's Suede,7
Women's Soft Cotton Turtleneck Top Basic Pullover Sweater,20
Amazon Brand - Daily Ritual Women's Lived-in Cotton Roll-Sleeve V-Neck T-Shirt Dress,6
Women's Color Block Long Sleeve Shirt Pullover Round Neck Side Split High Low Tunic Tops,19
Women Short Sleeve Sheer Chiffon Shrug Open Front Bolero Cardigan,39
Women's Floral Print Short Sleeve Flared Midi Dress,20
Women's Plus-Size Relaxed Straight Stretch Twill Pant,101
High Waist Athletic Yoga Shorts Tummy Control Workout Running,198
Maternity Long Dress Off Shoulder Elegant Fitted Gown Stretchy Maxi Photography Dress,16
Women's Plus Size Curves Blackout Tights,19
Women's Plus Size Elegant Mesh Contrast Pearl Beading Sleeve Stretchy Bodycon Pencil Dress,18
Women's Floral Ruffle Off Shoulder Maternity Dress - Made in USA,16
Women's Invisibles No Panty Line Thong Multipack,1
"Womens Ankle Low Cut Socks with Cushion for Athletic,Sport and Casual Use (6 Pack)",16
Women's Flannel Collared Long Sleeve Plaid Shirt,22
Women's Two Pieces Swimwear Ruched Tankini Top with Triangle Bottoms S-XXXL,20
Women's Adjustable Spaghetti Strap Cami Full Slip Under Dress,38
Premium Ultra Soft High Waisted Capri Leggings for Women - Regular and Plus Size - Many Colors,19
5-Pack Women's Short Sleeve V-Neck Activewear T-Shirt Dry-Fit Moisture Wicking Perfomance Yoga Top,21
Dream Flex Women's Bikini 8 Pack,26
Women's Casual Sweatshirts Long Sleeve Leopard Print Tops Cowl Neck Raglan Shirts,6
Women's Long Board Shorts High Waist Swim Bottom Solid Jammer Swim Shorts,16
"Hanes Cushioned Womens Athletic Socks, Ankle White, Size 5-9",28
"17""/23""/27""/29""/31""/33""/35"" Inseam Capri/Petite/Regular/Tall Length Women's Straight Leg Yoga Pants Zip Pocket",29
Womens Halter Neck Top Cut Out Shoulder Blouse Sweatshirts,14
Pajamas for Women Cotton - Womens Capri Pajama Sets,35
Women's High Waist A-Line Pockets Skirt Skater Flared Midi Skirt,14
Seamless Underwire Minimizer Bra Style 7000,102
Women's Plus Size Short Sleeve Flowy A-Line Pocket Midi Maxi Dress (1X-4X),13
Women's V Neck Lace Floral Open Back Skater Cocktail Wedding Party Dress,23
Women's Plus Size Floral Print Short/Long Sleeve Belt Tie Peplum Wrap Blouse Top Shirts,45
Women's Scoop Neck Pleated Front Blouse Tunic Top,29
Women's Embellished Tiered Jacket Dress (Petite and Regular),7
"Ameyda Unisex Children's Flannel Bathrobes Hoodie, 1 Years - 13 Years",12
Women's Cute Contrast Collar Short Sleeve Casual Work Blouse Tops,12
Women's Boho V Neck Print Romper Playsuit with Long Flare Sleeves,13
Womens Sleepshirt Button Down Nightgown Sleepwear Summer Slip Night Dress S-XXL,14
Layered Tulle Tutu Skirts,29
Womens Nursing Hoodie Long Sleeves Sweatshirt Breastfeeding Layered Top Pocket Casual Clothes,6
Women's 1950's Vintage V Neck Ruched Sheath Formal Pencil Dress,13
Women's Sexy V Neck Floral Long Sleeves Maxi Dresses Casual Loose Party Prom Ladies Outfits,23
Women's Dresses - Summer Boho Floral Spaghetti Strap Button Down Belt Swing A line Midi Dress with Pockets,24
Women’s Strapless Pleated Sexy Tube Crop Tops,29
6 Pack Women's Nylon Spandex Thong Underwear,32
Women's Livingston Basic Scrub Pants,19
Kaftan Tunic Kimono Dress Ladies Summer Women Evening Maxi Party Plus Size 6-24,37
Women's Cowl Neck Tops Two Tone Color Block Pullovers Elbow Patchs Loose Long Tunic Blouse,23
Women's 0520 Sleeveless Liposculpture Girdle,6
Women's Scalloped Lace Brazilian,20
RAZOR Bra Strap Clips Holder Women’s,11
Women's Maia Bra,12
Womens Shirts Sleeveless Summer Beach Halter Neck Tops Casual Basic Tee Shirts Loose Tunic Cami Tank Tops Blouses,56
Womens Crop Tank Tops Workout Running High Neck Sports Bra with Built-in Bra,17
Women’s 3/4 Sleeve Open Front Knit Cropped Cardigan Sweater Lightweight Short Bolero Shrug,13
4-Pack Women's Seamless Wireless Cooling Unpadded Comfort Bra,19
Dreamcrest Silky Soft Nightgown Women Sleepwear Crochet Trim Sleep Dress,55
Women's Ruffles Flounce Cute Bikini Two Piece Swimsuit Bathing Suits,100
Women's Casual Cute Shirts Leopard Print Tops Basic Short Sleeve Soft Blouse,18
Women's Oceanside Beach Short,6
Women's Hollow Out Rhinestone Fishnet Pantyhose Tights,9
Leopard Midi Skirt Plus Size for Women High Waist Silk Satin Elasticized Skirts,131
Women's Plus-Size Wireless Padded T-Shirt Bra,9
Women's Core18 Training Pants,14
Womens Super Soft Leggings for Ladies Fashion Cute Spandex Seamless Ankle Pants,15
Women's Color Block Lightweight Long Sleeve Pullover Hoodie,39
Womens Zip Front Printed Half Sleeve/Long Sleeve One Piece Swimsuit Swimwear,12
Women's Summer Sleeveless Buttons Up Neck Casual Tank Tops Basic Flowy Blouse,19
Women's Reg High Neck Microfiber Bralette,18
Women's Cap Sleeve Floral Nightgown,14
Women's Plus Size Sleeveless Long Pants Jumpsuit with Chiffon Overlay,19
Women's Floral Printed Summer Dress Romper Boho Playsuit Jumpsuits Beach 2 Piece Outfits Top with Shorts,24
Women's Summer Ruffle Short V-Neck Swing Shift Dress Plain T Shirt Dress,4
Women's Full Figure MagicLift Cotton Wirefree Support Bra #1001,17
Women's Ruched Waist Stretchy Flared Yoga Skirt,12
Women's Sexy Elegant One Shoulder Backless Evening Long Dress,66
Women' s Flowy and Comfort Draped Long Sleeve Batwing Dolman top S-3XL Plus Size_Made in U.S.A.,9
Women's Lollipop Plus Size Brief Panties 3 Pack,15
Women's Sexy Sleeveless Bodysuit Tops High Waist Bodycon Scoop Neck Leotard,25
"Tactical Women's Flex-Tac Stretch Fabric Cirrus Pants, Full Gusseted Crotch, Style 64391",18
Women's Spaghetti Strap Front Button Closure Denim Bodycon Dress,43
"Women's 3"" Knit Waistband Running Short, Amazon Exclusive",19
Women's Knit Pull-On Pant,70
Women's Crew-Neck Button Down 3/4 Sleeve Knit Cropped Cardigan Sweater (S-3XL),10
Women's Casual Button Down Blouse Shirts Cuffed Sleeve Loose T-Shirt Tops,26
Women's Underwear Comfies Microfiber French Cut - 3 Pack,14
"Dress Shirt for Women - Long Sleeve Women Tops Blouses, White Red XS M 2 XL",80
Salome 0218 High Waist Compression Shapewear Tummy Control BBL Shorts Fajas Colombianas para Mujer Levanta Cola,19
Women Ruched Butt Lift Yoga Pants Leggings High Waist Tummy Control Tights,24
Womens Turtleneck Oversized Sweaters Batwing Long Sleeve Pullover Loose Chunky Knit Jumper,40
